"","X","Fecha","Hora","Bosque","Transecto","Planta","Polinizador","sexo","capturado","Codigo","Observaciones","Fecha2","b","Pollinator_id","Pollinator_genus","Pollinator_sps","Pollinator_family","Periodo","julian","Year","Site"
"1",1,"08/04/21","13:30:00","2",2,"Anemone nemorosa","","","si",1,"","2021-04-08","2021-04-08 1","Sphaerophoria sp","Sphaerophoria","sp","Syrphidae",1,97,2021,"Gorbea"
"2",2,"08/04/21","13:30:00","2",2,"Potentilla montana","?=C1","","no",NA,"Andrena cf morio","2021-04-08","2021-04-08 NA","Andrena cineraria","Andrena","cineraria","Andrenidae",1,97,2021,"Gorbea"
"3",3,"08/04/21","13:30:00","2",2,"Bellis perennis","?=2","","no",NA,"foto","2021-04-08","2021-04-08 NA","Diptera","Diptera","","Diptera",1,97,2021,"Gorbea"
"4",4,"08/04/21","13:30:00","2",2,"Potentilla montana","?=C1","","no",NA,"Andrena cf morio","2021-04-08","2021-04-08 NA","Andrena cineraria","Andrena","cineraria","Andrenidae",1,97,2021,"Gorbea"
"5",5,"08/04/21","13:30:00","2",2,"Bellis perennis","Eristalis sp.","","no",NA,"","2021-04-08","2021-04-08 NA","Eristalis sp.","Eristalis","sp.","Syrphidae",1,97,2021,"Gorbea"
"6",6,"08/04/21","13:30:00","2",2,"Bellis perennis","Eristalis sp.","","no",NA,"","2021-04-08","2021-04-08 NA","Eristalis sp.","Eristalis","sp.","Syrphidae",1,97,2021,"Gorbea"
"7",7,"08/04/21","13:30:00","2",2,"Potentilla montana","?=C1","","no",NA,"Andrena cf morio","2021-04-08","2021-04-08 NA","Andrena cineraria","Andrena","cineraria","Andrenidae",1,97,2021,"Gorbea"
"8",8,"08/04/21","13:30:00","2",2,"Ranunculus ficaria","Eristalis sp.","","no",NA,"","2021-04-08","2021-04-08 NA","Eristalis sp.","Eristalis","sp.","Syrphidae",1,97,2021,"Gorbea"
"9",9,"08/04/21","13:30:00","2",2,"Bellis perennis","?=C1","","no",NA,"Andrena cf morio","2021-04-08","2021-04-08 NA","Andrena cineraria","Andrena","cineraria","Andrenidae",1,97,2021,"Gorbea"
"10",10,"08/04/21","16:00:00","2",3,"Helleborus viridis subsp. occidentalis","Apis mellifera","","no",NA,"","2021-04-08","2021-04-08 NA","Apis mellifera","Apis","mellifera","Apidae",1,97,2021,"Gorbea"
"11",11,"13/04/21","11:00:00","3",1,"Lathyrus linifolius","Bombus lapidarius","","no",NA,"","2021-04-13","2021-04-13 NA","Bombus lapidarius","Bombus","lapidarius","Apidae",1,102,2021,"Gorbea"
"12",12,"13/04/21","13:30:00","3",2,"Potentilla montana","","","si",3,"","2021-04-13","2021-04-13 3","Andrena nitida","Andrena","nitida","Andrenidae",1,102,2021,"Gorbea"
"13",13,"13/04/21","13:30:00","3",2,"Lathyrus linifolius","","","si",4,"Posible B. Pratorum??","2021-04-13","2021-04-13 4","Bombus lapidarius","Bombus","lapidarius","Apidae",1,102,2021,"Gorbea"
"14",14,"13/04/21","15:30:00","3",3,"Lathyrus linifolius","Bombus pascuorum","","no",NA,"","2021-04-13","2021-04-13 NA","Bombus pascuorum","Bombus","pascuorum","Apidae",1,102,2021,"Gorbea"
"15",15,"13/04/21","15:30:00","3",3,"Lathyrus linifolius","Bombus pascuorum","","no",NA,"","2021-04-13","2021-04-13 NA","Bombus pascuorum","Bombus","pascuorum","Apidae",1,102,2021,"Gorbea"
"16",16,"13/04/21","15:30:00","3",3,"Lathyrus linifolius","Bombus pascuorum","","no",NA,"","2021-04-13","2021-04-13 NA","Bombus pascuorum","Bombus","pascuorum","Apidae",1,102,2021,"Gorbea"
"17",17,"13/04/21","15:30:00","3",3,"Lathyrus linifolius","Bombus lapidarius","","no",NA,"","2021-04-13","2021-04-13 NA","Bombus lapidarius","Bombus","lapidarius","Apidae",1,102,2021,"Gorbea"
"18",18,"13/04/21","15:30:00","3",3,"Lathyrus linifolius","Bombus lapidarius","","no",NA,"","2021-04-13","2021-04-13 NA","Bombus lapidarius","Bombus","lapidarius","Apidae",1,102,2021,"Gorbea"
"19",19,"13/04/21","15:30:00","3",3,"Lathyrus linifolius","?=3","","no",NA,"","2021-04-13","2021-04-13 NA","Andrena nitida","Andrena","nitida","Andrenidae",1,102,2021,"Gorbea"
"20",20,"13/04/21","15:30:00","3",3,"Lathyrus linifolius","Bombus pascuorum","","no",NA,"","2021-04-13","2021-04-13 NA","Bombus pascuorum","Bombus","pascuorum","Apidae",1,102,2021,"Gorbea"
"21",21,"13/04/21","15:30:00","3",3,"Scilla verna","Eristalis sp.","","no",NA,"","2021-04-13","2021-04-13 NA","Eristalis sp.","Eristalis","sp.","Syrphidae",1,102,2021,"Gorbea"
"22",22,"14/04/21","10:30:00","1",1,"Ranunculus ficaria","Eristalis sp.","","no",NA,"","2021-04-14","2021-04-14 NA","Eristalis sp.","Eristalis","sp.","Syrphidae",1,103,2021,"Gorbea"
"23",23,"14/04/21","10:30:00","1",1,"Taraxacum sp.","Eristalis sp.","","si",5,"","2021-04-14","2021-04-14 5","Eristalis similis","Eristalis","similis","Syrphidae",1,103,2021,"Gorbea"
"24",24,"14/04/21","10:30:00","1",1,"Helleborus viridis subsp. occidentalis","Apis mellifera","","no",NA,"","2021-04-14","2021-04-14 NA","Apis mellifera","Apis","mellifera","Apidae",1,103,2021,"Gorbea"
"25",25,"14/04/21","10:30:00","1",1,"Taraxacum sp.","Eristalis tenax","","no",NA,"","2021-04-14","2021-04-14 NA","Eristalis tenax","Eristalis","tenax","Syrphidae",1,103,2021,"Gorbea"
"26",26,"14/04/21","10:30:00","1",1,"Taraxacum sp.","Eristalis sp.","","no",NA,"","2021-04-14","2021-04-14 NA","Eristalis sp.","Eristalis","sp.","Syrphidae",1,103,2021,"Gorbea"
"27",27,"14/04/21","10:30:00","1",1,"Taraxacum sp.","Eristalis sp.","","no",NA,"","2021-04-14","2021-04-14 NA","Eristalis sp.","Eristalis","sp.","Syrphidae",1,103,2021,"Gorbea"
"28",28,"14/04/21","10:30:00","1",1,"Taraxacum sp.","Eristalis sp.","","no",NA,"","2021-04-14","2021-04-14 NA","Eristalis sp.","Eristalis","sp.","Syrphidae",1,103,2021,"Gorbea"
"29",29,"14/04/21","10:30:00","1",1,"Helleborus viridis subsp. occidentalis","Bombus terrestris","","no",NA,"","2021-04-14","2021-04-14 NA","Bombus terrestris","Bombus","terrestris","Apidae",1,103,2021,"Gorbea"
"30",30,"14/04/21","10:30:00","1",1,"Helleborus viridis subsp. occidentalis","Bombus terrestris","","no",NA,"","2021-04-14","2021-04-14 NA","Bombus terrestris","Bombus","terrestris","Apidae",1,103,2021,"Gorbea"
"31",31,"14/04/21","10:30:00","1",1,"Taraxacum sp.","Eristalis sp.","","no",NA,"","2021-04-14","2021-04-14 NA","Eristalis sp.","Eristalis","sp.","Syrphidae",1,103,2021,"Gorbea"
"32",32,"14/04/21","10:30:00","1",1,"Taraxacum sp.","Eristalis sp.","","no",NA,"","2021-04-14","2021-04-14 NA","Eristalis sp.","Eristalis","sp.","Syrphidae",1,103,2021,"Gorbea"
"33",33,"14/04/21","10:30:00","1",1,"Taraxacum sp.","Eristalis tenax","","no",NA,"","2021-04-14","2021-04-14 NA","Eristalis tenax","Eristalis","tenax","Syrphidae",1,103,2021,"Gorbea"
"34",34,"14/04/21","10:30:00","1",1,"Bellis perennis","Eristalis tenax","","no",NA,"","2021-04-14","2021-04-14 NA","Eristalis tenax","Eristalis","tenax","Syrphidae",1,103,2021,"Gorbea"
"35",35,"14/04/21","13:30:00","1",2,"Taraxacum sp.","Apis mellifera","","no",NA,"","2021-04-14","2021-04-14 NA","Apis mellifera","Apis","mellifera","Apidae",1,103,2021,"Gorbea"
"36",36,"14/04/21","13:30:00","1",2,"Taraxacum sp.","","","si",8,"similar a 3","2021-04-14","2021-04-14 8","Andrena nitida","Andrena","nitida","Andrenidae",1,103,2021,"Gorbea"
"37",37,"14/04/21","16:00:00","1",3,"Taraxacum sp.","Eristalis sp.","","no",NA,"","2021-04-14","2021-04-14 NA","Eristalis sp.","Eristalis","sp.","Syrphidae",1,103,2021,"Gorbea"
"38",38,"14/04/21","16:00:00","1",3,"Helleborus viridis subsp. occidentalis","Bombus terrestris","","no",NA,"","2021-04-14","2021-04-14 NA","Bombus terrestris","Bombus","terrestris","Apidae",1,103,2021,"Gorbea"
"39",39,"14/04/21","16:00:00","1",3,"Taraxacum sp.","?=8","","no",NA,"","2021-04-14","2021-04-14 NA","Andrena nitida","Andrena","nitida","Andrenidae",1,103,2021,"Gorbea"
"40",40,"14/04/21","16:00:00","1",3,"Taraxacum sp.","Eristalis tenax","","no",NA,"","2021-04-14","2021-04-14 NA","Eristalis tenax","Eristalis","tenax","Syrphidae",1,103,2021,"Gorbea"
"41",41,"14/04/21","16:00:00","1",3,"Taraxacum sp.","Apis mellifera","","no",NA,"","2021-04-14","2021-04-14 NA","Apis mellifera","Apis","mellifera","Apidae",1,103,2021,"Gorbea"
"42",42,"15/04/21","10:30:00","2",1,"Taraxacum sp.","Eristalis sp.","","no",NA,"","2021-04-15","2021-04-15 NA","Eristalis sp.","Eristalis","sp.","Syrphidae",2,104,2021,"Gorbea"
"43",43,"15/04/21","13:15:00","2",2,"Taraxacum sp.","Eristalis tenax","","no",NA,"","2021-04-15","2021-04-15 NA","Eristalis tenax","Eristalis","tenax","Syrphidae",2,104,2021,"Gorbea"
"44",44,"15/04/21","13:15:00","2",2,"Taraxacum sp.","Eristalis tenax","","no",NA,"","2021-04-15","2021-04-15 NA","Eristalis tenax","Eristalis","tenax","Syrphidae",2,104,2021,"Gorbea"
"45",45,"15/04/21","13:15:00","2",2,"Bellis perennis","Eristalis tenax","","no",NA,"","2021-04-15","2021-04-15 NA","Eristalis tenax","Eristalis","tenax","Syrphidae",2,104,2021,"Gorbea"
"46",46,"15/04/21","13:15:00","2",2,"Bellis perennis","Eristalis tenax","","no",NA,"","2021-04-15","2021-04-15 NA","Eristalis tenax","Eristalis","tenax","Syrphidae",2,104,2021,"Gorbea"
"47",47,"15/04/21","13:15:00","2",2,"Bellis perennis","Eristalis tenax","","no",NA,"","2021-04-15","2021-04-15 NA","Eristalis tenax","Eristalis","tenax","Syrphidae",2,104,2021,"Gorbea"
"48",48,"15/04/21","13:15:00","2",2,"Bellis perennis","Eristalis tenax","","no",NA,"","2021-04-15","2021-04-15 NA","Eristalis tenax","Eristalis","tenax","Syrphidae",2,104,2021,"Gorbea"
"49",49,"15/04/21","13:15:00","2",2,"Taraxacum sp.","Eristalis tenax","","no",NA,"","2021-04-15","2021-04-15 NA","Eristalis tenax","Eristalis","tenax","Syrphidae",2,104,2021,"Gorbea"
"50",50,"15/04/21","13:15:00","2",2,"Potentilla sterilis","Bombus terrestris","","no",NA,"","2021-04-15","2021-04-15 NA","Bombus terrestris","Bombus","terrestris","Apidae",2,104,2021,"Gorbea"
"51",51,"15/04/21","15:30:00","2",3,"Taraxacum sp.","?=8","","no",NA,"","2021-04-15","2021-04-15 NA","Andrena nitida","Andrena","nitida","Andrenidae",2,104,2021,"Gorbea"
"52",52,"15/04/21","15:30:00","2",3,"Taraxacum sp.","Eristalis tenax","","no",NA,"","2021-04-15","2021-04-15 NA","Eristalis tenax","Eristalis","tenax","Syrphidae",2,104,2021,"Gorbea"
"53",53,"15/04/21","15:30:00","2",3,"Bellis perennis","Eupeodes sp.","","no",NA,"","2021-04-15","2021-04-15 NA","Eupeodes sp.","Eupeodes","sp.","Syrphidae",2,104,2021,"Gorbea"
"54",54,"15/04/21","15:30:00","2",3,"Taraxacum sp.","Apis mellifera","","no",NA,"","2021-04-15","2021-04-15 NA","Apis mellifera","Apis","mellifera","Apidae",2,104,2021,"Gorbea"
"55",55,"15/04/21","15:30:00","2",3,"Bellis perennis","Eristalis tenax","","no",NA,"","2021-04-15","2021-04-15 NA","Eristalis tenax","Eristalis","tenax","Syrphidae",2,104,2021,"Gorbea"
"56",56,"15/04/21","15:30:00","2",3,"Taraxacum sp.","Apis mellifera","","no",NA,"","2021-04-15","2021-04-15 NA","Apis mellifera","Apis","mellifera","Apidae",2,104,2021,"Gorbea"
"57",57,"16/04/21","13:40:00","3",2,"Scilla verna","Eristalis sp.","","no",NA,"frío","2021-04-16","2021-04-16 NA","Eristalis sp.","Eristalis","sp.","Syrphidae",2,105,2021,"Gorbea"
"58",58,"16/04/21","15:45:00","3",3,"Lathyrus linifolius","?=C4","","no",NA,"","2021-04-16","2021-04-16 NA","Bombus lapidarius","Bombus","lapidarius","Apidae",2,105,2021,"Gorbea"
"59",59,"16/04/21","15:45:00","3",3,"Scilla verna","","","si",10,"","2021-04-16","2021-04-16 10","Andrena nigroaenea","Andrena","nigroaenea","Andrenidae",2,105,2021,"Gorbea"
"60",60,"21/04/21","10:30:00","5",1,"Scilla verna","Eristalis tenax","","no",NA,"","2021-04-21","2021-04-21 NA","Eristalis tenax","Eristalis","tenax","Syrphidae",1,110,2021,"Gorbea"
"61",61,"21/04/21","10:30:00","5",1,"Scilla verna","","","si",11,"","2021-04-21","2021-04-21 11","Empis sp","Empis","sp","Empididae",1,110,2021,"Gorbea"
"62",62,"21/04/21","13:30:00","5",2,"Scilla verna","?=11","","no",NA,"","2021-04-21","2021-04-21 NA","Empis sp","Empis","sp","Empididae",1,110,2021,"Gorbea"
"63",63,"21/04/21","13:30:00","5",2,"Scilla verna","?=11","","no",NA,"","2021-04-21","2021-04-21 NA","Empis sp","Empis","sp","Empididae",1,110,2021,"Gorbea"
"64",64,"23/04/21","10:30:00","2",1,"Taraxacum sp.","Eupeodes sp.","","no",NA,"","2021-04-23","2021-04-23 NA","Eupeodes sp.","Eupeodes","sp.","Syrphidae",3,112,2021,"Gorbea"
"65",65,"23/04/21","10:30:00","2",1,"Taraxacum sp.","Apis mellifera","","no",NA,"","2021-04-23","2021-04-23 NA","Apis mellifera","Apis","mellifera","Apidae",3,112,2021,"Gorbea"
"66",66,"23/04/21","10:30:00","2",1,"Taraxacum sp.","Andrena cf morio","","no",NA,"","2021-04-23","2021-04-23 NA","Andrena cf morio","Andrena","cf morio","Andrenidae",3,112,2021,"Gorbea"
"67",67,"23/04/21","10:30:00","2",1,"Taraxacum sp.","Andrena cf morio","","no",NA,"","2021-04-23","2021-04-23 NA","Andrena cf morio","Andrena","cf morio","Andrenidae",3,112,2021,"Gorbea"
"68",68,"23/04/21","10:30:00","2",1,"Bellis perennis","Andrena cf morio","","si",13,"","2021-04-23","2021-04-23 13","Andrena minutula","Andrena","minutula","Andrenidae",3,112,2021,"Gorbea"
"69",69,"23/04/21","13:30:00","2",2,"Taraxacum sp.","Apis mellifera","","no",NA,"","2021-04-23","2021-04-23 NA","Apis mellifera","Apis","mellifera","Apidae",3,112,2021,"Gorbea"
"70",70,"23/04/21","13:30:00","2",2,"Taraxacum sp.","Apis mellifera","","no",NA,"","2021-04-23","2021-04-23 NA","Apis mellifera","Apis","mellifera","Apidae",3,112,2021,"Gorbea"
"71",71,"23/04/21","13:30:00","2",2,"Taraxacum sp.","Apis mellifera","","no",NA,"","2021-04-23","2021-04-23 NA","Apis mellifera","Apis","mellifera","Apidae",3,112,2021,"Gorbea"
"72",72,"23/04/21","13:30:00","2",2,"Bellis perennis","Eristalis sp.","","no",NA,"","2021-04-23","2021-04-23 NA","Eristalis sp.","Eristalis","sp.","Syrphidae",3,112,2021,"Gorbea"
"73",73,"23/04/21","13:30:00","2",2,"Bellis perennis","?=13","","no",NA,"","2021-04-23","2021-04-23 NA","Andrena minutula","Andrena","minutula","Andrenidae",3,112,2021,"Gorbea"
"74",74,"23/04/21","13:30:00","2",2,"Taraxacum sp.","Apis mellifera","","no",NA,"","2021-04-23","2021-04-23 NA","Apis mellifera","Apis","mellifera","Apidae",3,112,2021,"Gorbea"
"75",75,"23/04/21","13:30:00","2",2,"Taraxacum sp.","Apis mellifera","","no",NA,"","2021-04-23","2021-04-23 NA","Apis mellifera","Apis","mellifera","Apidae",3,112,2021,"Gorbea"
"76",76,"23/04/21","13:30:00","2",2,"Bellis perennis","Eristalis sp.","","no",NA,"","2021-04-23","2021-04-23 NA","Eristalis sp.","Eristalis","sp.","Syrphidae",3,112,2021,"Gorbea"
"77",77,"23/04/21","13:30:00","2",2,"Taraxacum sp.","","","si",14,"","2021-04-23","2021-04-23 14","Andrena nitida","Andrena","nitida","Andrenidae",3,112,2021,"Gorbea"
"78",78,"23/04/21","13:30:00","2",2,"Taraxacum sp.","Andrena cf morio","","no",NA,"","2021-04-23","2021-04-23 NA","Andrena cf morio","Andrena","cf morio","Andrenidae",3,112,2021,"Gorbea"
"79",79,"23/04/21","13:30:00","2",2,"Bellis perennis","Eristalis tenax","","no",NA,"","2021-04-23","2021-04-23 NA","Eristalis tenax","Eristalis","tenax","Syrphidae",3,112,2021,"Gorbea"
"80",80,"23/04/21","13:30:00","2",2,"Bellis perennis","Eristalis tenax","","no",NA,"","2021-04-23","2021-04-23 NA","Eristalis tenax","Eristalis","tenax","Syrphidae",3,112,2021,"Gorbea"
"81",81,"23/04/21","13:30:00","2",2,"Taraxacum sp.","Apis mellifera","","no",NA,"","2021-04-23","2021-04-23 NA","Apis mellifera","Apis","mellifera","Apidae",3,112,2021,"Gorbea"
"82",82,"23/04/21","13:30:00","2",2,"Taraxacum sp.","?=14","","no",NA,"","2021-04-23","2021-04-23 NA","Andrena nitida","Andrena","nitida","Andrenidae",3,112,2021,"Gorbea"
"83",83,"23/04/21","13:30:00","2",2,"Taraxacum sp.","Apis mellifera","","no",NA,"","2021-04-23","2021-04-23 NA","Apis mellifera","Apis","mellifera","Apidae",3,112,2021,"Gorbea"
"84",84,"23/04/21","13:30:00","2",2,"Bellis perennis","Eristalis tenax","","no",NA,"","2021-04-23","2021-04-23 NA","Eristalis tenax","Eristalis","tenax","Syrphidae",3,112,2021,"Gorbea"
"85",85,"23/04/21","13:30:00","2",2,"Taraxacum sp.","Apis mellifera","","no",NA,"","2021-04-23","2021-04-23 NA","Apis mellifera","Apis","mellifera","Apidae",3,112,2021,"Gorbea"
"86",86,"23/04/21","13:30:00","2",2,"Taraxacum sp.","Apis mellifera","","no",NA,"","2021-04-23","2021-04-23 NA","Apis mellifera","Apis","mellifera","Apidae",3,112,2021,"Gorbea"
"87",87,"23/04/21","13:30:00","2",2,"Bellis perennis","","","si",15,"","2021-04-23","2021-04-23 15","Lasioglossum immunitum","Lasioglossum","immunitum","Halictidae",3,112,2021,"Gorbea"
"88",88,"24/04/21","13:00:00","1",2,"Taraxacum sp.","Apis mellifera","","no",NA,"","2021-04-24","2021-04-24 NA","Apis mellifera","Apis","mellifera","Apidae",2,113,2021,"Gorbea"
"89",89,"24/04/21","13:00:00","1",2,"Taraxacum sp.","","","si",18,"","2021-04-24","2021-04-24 18","Eupeodes corollae","Eupeodes","corollae","Syrphidae",2,113,2021,"Gorbea"
"90",90,"24/04/21","13:00:00","1",2,"Taraxacum sp.","Apis mellifera","","no",NA,"","2021-04-24","2021-04-24 NA","Apis mellifera","Apis","mellifera","Apidae",2,113,2021,"Gorbea"
"91",91,"24/04/21","13:00:00","1",2,"Taraxacum sp.","Apis mellifera","","no",NA,"","2021-04-24","2021-04-24 NA","Apis mellifera","Apis","mellifera","Apidae",2,113,2021,"Gorbea"
"92",92,"24/04/21","13:00:00","1",2,"Taraxacum sp.","Apis mellifera","","no",NA,"","2021-04-24","2021-04-24 NA","Apis mellifera","Apis","mellifera","Apidae",2,113,2021,"Gorbea"
"93",93,"24/04/21","13:00:00","1",2,"Taraxacum sp.","Apis mellifera","","no",NA,"","2021-04-24","2021-04-24 NA","Apis mellifera","Apis","mellifera","Apidae",2,113,2021,"Gorbea"
"94",94,"24/04/21","13:00:00","1",2,"Taraxacum sp.","Apis mellifera","","no",NA,"","2021-04-24","2021-04-24 NA","Apis mellifera","Apis","mellifera","Apidae",2,113,2021,"Gorbea"
"95",95,"24/04/21","13:00:00","1",2,"Taraxacum sp.","Eristalis sp.","","no",NA,"","2021-04-24","2021-04-24 NA","Eristalis sp.","Eristalis","sp.","Syrphidae",2,113,2021,"Gorbea"
"96",96,"24/04/21","15:30:00","1",3,"Taraxacum sp.","Apis mellifera","","no",NA,"","2021-04-24","2021-04-24 NA","Apis mellifera","Apis","mellifera","Apidae",2,113,2021,"Gorbea"
"97",97,"24/04/21","15:30:00","1",3,"Taraxacum sp.","Apis mellifera","","no",NA,"","2021-04-24","2021-04-24 NA","Apis mellifera","Apis","mellifera","Apidae",2,113,2021,"Gorbea"
"98",98,"24/04/21","15:30:00","1",3,"Bellis perennis","Eupeodes sp.","","no",NA,"","2021-04-24","2021-04-24 NA","Eupeodes sp.","Eupeodes","sp.","Syrphidae",2,113,2021,"Gorbea"
"99",99,"24/04/21","15:30:00","1",3,"Helleborus viridis subsp. occidentalis","Apis mellifera","","no",NA,"","2021-04-24","2021-04-24 NA","Apis mellifera","Apis","mellifera","Apidae",2,113,2021,"Gorbea"
"100",100,"24/04/21","15:30:00","1",3,"Taraxacum sp.","Apis mellifera","","no",NA,"","2021-04-24","2021-04-24 NA","Apis mellifera","Apis","mellifera","Apidae",2,113,2021,"Gorbea"
"101",101,"24/04/21","15:30:00","1",3,"Taraxacum sp.","Bombus sp.","","no",NA,"","2021-04-24","2021-04-24 NA","Bombus sp.","Bombus","sp.","Apidae",2,113,2021,"Gorbea"
"102",102,"24/04/21","15:30:00","1",3,"Taraxacum sp.","Apis mellifera","","no",NA,"","2021-04-24","2021-04-24 NA","Apis mellifera","Apis","mellifera","Apidae",2,113,2021,"Gorbea"
"103",103,"24/04/21","15:30:00","1",3,"Taraxacum sp.","","","si",20,"","2021-04-24","2021-04-24 20","Andrena bicolor","Andrena","bicolor","Andrenidae",2,113,2021,"Gorbea"
"104",104,"24/04/21","15:30:00","1",3,"Taraxacum sp.","?=20","","no",NA,"","2021-04-24","2021-04-24 NA","Andrena bicolor","Andrena","bicolor","Andrenidae",2,113,2021,"Gorbea"
"105",105,"24/04/21","15:30:00","1",3,"Taraxacum sp.","Apis mellifera","","no",NA,"","2021-04-24","2021-04-24 NA","Apis mellifera","Apis","mellifera","Apidae",2,113,2021,"Gorbea"
"106",106,"24/04/21","15:30:00","1",3,"Taraxacum sp.","Eristalis sp.","","no",NA,"","2021-04-24","2021-04-24 NA","Eristalis sp.","Eristalis","sp.","Syrphidae",2,113,2021,"Gorbea"
"107",107,"24/04/21","15:30:00","1",3,"Helleborus viridis subsp. occidentalis","","","si",21,"","2021-04-24","2021-04-24 21","Bombus soroeensis","Bombus","soroeensis","Apidae",2,113,2021,"Gorbea"
"108",108,"24/04/21","15:30:00","1",3,"Helleborus viridis subsp. occidentalis","Apis mellifera","","no",NA,"","2021-04-24","2021-04-24 NA","Apis mellifera","Apis","mellifera","Apidae",2,113,2021,"Gorbea"
"109",109,"24/04/21","15:30:00","1",3,"Taraxacum sp.","Pieris brassicae","","no",NA,"foto","2021-04-24","2021-04-24 NA","Pieris brassicae","Pieris","brassicae","Lepidoptera",2,113,2021,"Gorbea"
"110",110,"24/04/21","15:30:00","1",3,"Taraxacum sp.","Apis mellifera","","no",NA,"","2021-04-24","2021-04-24 NA","Apis mellifera","Apis","mellifera","Apidae",2,113,2021,"Gorbea"
"111",111,"24/04/21","15:30:00","1",3,"Taraxacum sp.","Apis mellifera","","no",NA,"","2021-04-24","2021-04-24 NA","Apis mellifera","Apis","mellifera","Apidae",2,113,2021,"Gorbea"
"112",112,"24/04/21","15:30:00","1",3,"Taraxacum sp.","Apis mellifera","","no",NA,"","2021-04-24","2021-04-24 NA","Apis mellifera","Apis","mellifera","Apidae",2,113,2021,"Gorbea"
"113",113,"02/05/21","10:30:00","5",1,"Scilla verna","","","si",22,"","2021-05-02","2021-05-02 22","Empis sp","Empis","sp","Empididae",2,121,2021,"Gorbea"
"114",114,"02/05/21","10:30:00","5",1,"Scilla verna","?=22","","no",NA,"","2021-05-02","2021-05-02 NA","Empis sp","Empis","sp","Empididae",2,121,2021,"Gorbea"
"115",115,"02/05/21","13:00:00","5",2,"Scilla verna","Eristalis tenax","","no",NA,"","2021-05-02","2021-05-02 NA","Eristalis tenax","Eristalis","tenax","Syrphidae",2,121,2021,"Gorbea"
"116",116,"02/05/21","13:00:00","5",2,"Pedicularis sylvatica subsp. sylvatica","Bombus hortorum","","no",NA,"","2021-05-02","2021-05-02 NA","Bombus hortorum","Bombus","hortorum","Apidae",2,121,2021,"Gorbea"
"117",117,"02/05/21","13:00:00","5",2,"Scilla verna","?=22","","no",NA,"","2021-05-02","2021-05-02 NA","Empis sp","Empis","sp","Empididae",2,121,2021,"Gorbea"
"118",118,"02/05/21","13:00:00","5",2,"Scilla verna","?=22","","no",NA,"","2021-05-02","2021-05-02 NA","Empis sp","Empis","sp","Empididae",2,121,2021,"Gorbea"
"119",119,"02/05/21","13:00:00","5",2,"Scilla verna","?=22","","no",NA,"","2021-05-02","2021-05-02 NA","Empis sp","Empis","sp","Empididae",2,121,2021,"Gorbea"
"120",120,"02/05/21","13:00:00","5",2,"Scilla verna","?=22","","no",NA,"","2021-05-02","2021-05-02 NA","Empis sp","Empis","sp","Empididae",2,121,2021,"Gorbea"
"121",121,"02/05/21","13:00:00","5",2,"Scilla verna","?=22","","no",NA,"","2021-05-02","2021-05-02 NA","Empis sp","Empis","sp","Empididae",2,121,2021,"Gorbea"
"122",122,"02/05/21","13:00:00","5",2,"Scilla verna","?=22","","no",NA,"","2021-05-02","2021-05-02 NA","Empis sp","Empis","sp","Empididae",2,121,2021,"Gorbea"
"123",123,"02/05/21","13:00:00","5",2,"Scilla verna","?=22","","no",NA,"","2021-05-02","2021-05-02 NA","Empis sp","Empis","sp","Empididae",2,121,2021,"Gorbea"
"124",124,"02/05/21","13:00:00","5",2,"Scilla verna","?=22","","no",NA,"","2021-05-02","2021-05-02 NA","Empis sp","Empis","sp","Empididae",2,121,2021,"Gorbea"
"125",125,"02/05/21","13:00:00","5",2,"Scilla verna","?=22","","no",NA,"","2021-05-02","2021-05-02 NA","Empis sp","Empis","sp","Empididae",2,121,2021,"Gorbea"
"126",126,"02/05/21","13:00:00","5",2,"Scilla verna","?=22","","no",NA,"","2021-05-02","2021-05-02 NA","Empis sp","Empis","sp","Empididae",2,121,2021,"Gorbea"
"127",127,"02/05/21","13:00:00","5",2,"Pedicularis sylvatica subsp. sylvatica","Bombus hortorum","","no",NA,"","2021-05-02","2021-05-02 NA","Bombus hortorum","Bombus","hortorum","Apidae",2,121,2021,"Gorbea"
"128",128,"03/05/21","10:45:00","4",1,"Scilla verna","?=22","","no",NA,"","2021-05-03","2021-05-03 NA","Empis sp","Empis","sp","Empididae",1,122,2021,"Gorbea"
"129",129,"03/05/21","13:15:00","4",2,"Taraxacum sp.","Eristalis tenax","","no",NA,"","2021-05-03","2021-05-03 NA","Eristalis tenax","Eristalis","tenax","Syrphidae",1,122,2021,"Gorbea"
"130",130,"03/05/21","13:15:00","4",2,"Taraxacum sp.","Apis mellifera","","no",NA,"","2021-05-03","2021-05-03 NA","Apis mellifera","Apis","mellifera","Apidae",1,122,2021,"Gorbea"
"131",131,"04/05/21","10:30:00","3",1,"Lathyrus linifolius","Bombus lapidarius","","no",NA,"","2021-05-04","2021-05-04 NA","Bombus lapidarius","Bombus","lapidarius","Apidae",3,123,2021,"Gorbea"
"132",132,"04/05/21","13:30:00","3",2,"Potentilla erecta","","","si",24,"","2021-05-04","2021-05-04 24","Lasioglossum tricinctum","Lasioglossum","tricinctum","Halictidae",3,123,2021,"Gorbea"
"133",133,"04/05/21","13:30:00","3",2,"Potentilla erecta","?=24","","no",NA,"","2021-05-04","2021-05-04 NA","Lasioglossum tricinctum","Lasioglossum","tricinctum","Halictidae",3,123,2021,"Gorbea"
"134",134,"04/05/21","13:30:00","3",2,"Ranunculus repens","","","si",25,"","2021-05-04","2021-05-04 25","Lasioglossum immunitum","Lasioglossum","immunitum","Halictidae",3,123,2021,"Gorbea"
"135",135,"04/05/21","13:30:00","3",2,"Potentilla montana","?=24","","no",NA,"","2021-05-04","2021-05-04 NA","Lasioglossum tricinctum","Lasioglossum","tricinctum","Halictidae",3,123,2021,"Gorbea"
"136",136,"04/05/21","13:30:00","3",2,"Bellis perennis","Eupeodes sp.","","no",NA,"","2021-05-04","2021-05-04 NA","Eupeodes sp.","Eupeodes","sp.","Syrphidae",3,123,2021,"Gorbea"
"137",137,"04/05/21","13:30:00","3",2,"Potentilla erecta","?=24","","no",NA,"","2021-05-04","2021-05-04 NA","Lasioglossum tricinctum","Lasioglossum","tricinctum","Halictidae",3,123,2021,"Gorbea"
"138",138,"04/05/21","13:30:00","3",2,"Lathyrus linifolius","Bombus lapidarius","","no",NA,"","2021-05-04","2021-05-04 NA","Bombus lapidarius","Bombus","lapidarius","Apidae",3,123,2021,"Gorbea"
"139",139,"04/05/21","13:30:00","3",2,"Bellis perennis","Curculionoidea","","no",NA,"fotos (superfamilia curculionoidea)","2021-05-04","2021-05-04 NA","Curculionoidea","Curculionoidea","",NA,3,123,2021,"Gorbea"
"140",140,"04/05/21","13:30:00","3",2,"Potentilla erecta","?=24","","no",NA,"","2021-05-04","2021-05-04 NA","Lasioglossum tricinctum","Lasioglossum","tricinctum","Halictidae",3,123,2021,"Gorbea"
"141",141,"04/05/21","13:30:00","3",2,"Potentilla montana","?=25","","no",NA,"","2021-05-04","2021-05-04 NA","Lasioglossum immunitum","Lasioglossum","immunitum","Halictidae",3,123,2021,"Gorbea"
"142",142,"04/05/21","13:30:00","3",2,"Potentilla montana","?=24","","no",NA,"","2021-05-04","2021-05-04 NA","Lasioglossum tricinctum","Lasioglossum","tricinctum","Halictidae",3,123,2021,"Gorbea"
"143",143,"04/05/21","16:00:00","3",3,"Ranunculus repens","?=25","","no",NA,"","2021-05-04","2021-05-04 NA","Lasioglossum immunitum","Lasioglossum","immunitum","Halictidae",3,123,2021,"Gorbea"
"144",144,"04/05/21","16:00:00","3",3,"Potentilla erecta","?=25","","no",NA,"","2021-05-04","2021-05-04 NA","Lasioglossum immunitum","Lasioglossum","immunitum","Halictidae",3,123,2021,"Gorbea"
"145",145,"04/05/21","16:00:00","3",3,"Bellis perennis","?=25","","no",NA,"","2021-05-04","2021-05-04 NA","Lasioglossum immunitum","Lasioglossum","immunitum","Halictidae",3,123,2021,"Gorbea"
"146",146,"04/05/21","16:00:00","3",3,"Potentilla montana","?=25","","no",NA,"","2021-05-04","2021-05-04 NA","Lasioglossum immunitum","Lasioglossum","immunitum","Halictidae",3,123,2021,"Gorbea"
"147",147,"04/05/21","16:00:00","3",3,"Potentilla erecta","?=25","","no",NA,"","2021-05-04","2021-05-04 NA","Lasioglossum immunitum","Lasioglossum","immunitum","Halictidae",3,123,2021,"Gorbea"
"148",148,"04/05/21","16:00:00","3",3,"Potentilla montana","?=25","","no",NA,"","2021-05-04","2021-05-04 NA","Lasioglossum immunitum","Lasioglossum","immunitum","Halictidae",3,123,2021,"Gorbea"
"149",149,"04/05/21","16:00:00","3",3,"Potentilla montana","?=25","","no",NA,"","2021-05-04","2021-05-04 NA","Lasioglossum immunitum","Lasioglossum","immunitum","Halictidae",3,123,2021,"Gorbea"
"150",150,"04/05/21","16:00:00","3",3,"Potentilla erecta","?=25","","no",NA,"","2021-05-04","2021-05-04 NA","Lasioglossum immunitum","Lasioglossum","immunitum","Halictidae",3,123,2021,"Gorbea"
"151",151,"04/05/21","16:00:00","3",3,"Bellis perennis","?=25","","no",NA,"","2021-05-04","2021-05-04 NA","Lasioglossum immunitum","Lasioglossum","immunitum","Halictidae",3,123,2021,"Gorbea"
"152",152,"04/05/21","16:00:00","3",3,"Potentilla montana","","","si",26,"","2021-05-04","2021-05-04 26","Andrena bicolor","Andrena","bicolor","Andrenidae",3,123,2021,"Gorbea"
"153",153,"04/05/21","16:00:00","3",3,"Potentilla montana","Pyrgus malvoides","","no",NA,"","2021-05-04","2021-05-04 NA","Pyrgus malvoides","Pyrgus","malvoides","Lepidoptera",3,123,2021,"Gorbea"
"154",154,"06/05/21","10:30:00","1",1,"Taraxacum sp.","Apis mellifera","","no",NA,"","2021-05-06","2021-05-06 NA","Apis mellifera","Apis","mellifera","Apidae",3,125,2021,"Gorbea"
"155",155,"06/05/21","10:30:00","1",1,"Taraxacum sp.","Eristalis tenax","","no",NA,"","2021-05-06","2021-05-06 NA","Eristalis tenax","Eristalis","tenax","Syrphidae",3,125,2021,"Gorbea"
"156",156,"06/05/21","10:30:00","1",1,"Taraxacum sp.","Apis mellifera","","no",NA,"","2021-05-06","2021-05-06 NA","Apis mellifera","Apis","mellifera","Apidae",3,125,2021,"Gorbea"
"157",157,"06/05/21","10:30:00","1",1,"Taraxacum sp.","Apis mellifera","","no",NA,"","2021-05-06","2021-05-06 NA","Apis mellifera","Apis","mellifera","Apidae",3,125,2021,"Gorbea"
"158",158,"06/05/21","10:30:00","1",1,"Bellis perennis","","","si",27,"","2021-05-06","2021-05-06 27","Eupeodes corollae","Eupeodes","corollae","Syrphidae",3,125,2021,"Gorbea"
"159",159,"06/05/21","10:30:00","1",1,"Taraxacum sp.","Apis mellifera","","no",NA,"","2021-05-06","2021-05-06 NA","Apis mellifera","Apis","mellifera","Apidae",3,125,2021,"Gorbea"
"160",160,"06/05/21","10:30:00","1",1,"Taraxacum sp.","Apis mellifera","","no",NA,"","2021-05-06","2021-05-06 NA","Apis mellifera","Apis","mellifera","Apidae",3,125,2021,"Gorbea"
"161",161,"06/05/21","10:30:00","1",1,"Bellis perennis","Eristalis sp.","","no",NA,"","2021-05-06","2021-05-06 NA","Eristalis sp.","Eristalis","sp.","Syrphidae",3,125,2021,"Gorbea"
"162",162,"06/05/21","10:30:00","1",1,"Scilla verna","Eristalis tenax","","no",NA,"","2021-05-06","2021-05-06 NA","Eristalis tenax","Eristalis","tenax","Syrphidae",3,125,2021,"Gorbea"
"163",163,"06/05/21","10:30:00","1",1,"Taraxacum sp.","Eristalis tenax","","no",NA,"","2021-05-06","2021-05-06 NA","Eristalis tenax","Eristalis","tenax","Syrphidae",3,125,2021,"Gorbea"
"164",164,"06/05/21","10:30:00","1",1,"Taraxacum sp.","Apis mellifera","","no",NA,"","2021-05-06","2021-05-06 NA","Apis mellifera","Apis","mellifera","Apidae",3,125,2021,"Gorbea"
"165",165,"06/05/21","10:30:00","1",1,"Taraxacum sp.","","","si",28,"","2021-05-06","2021-05-06 28","Cheilosia sp","Cheilosia","sp","Syrphidae",3,125,2021,"Gorbea"
"166",166,"06/05/21","10:30:00","1",1,"Bellis perennis","?=33","","no",NA,"","2021-05-06","2021-05-06 NA","Diptera","Diptera","","Diptera",3,125,2021,"Gorbea"
"167",167,"06/05/21","10:30:00","1",1,"Bellis perennis","?=33","","no",NA,"","2021-05-06","2021-05-06 NA","Diptera","Diptera","","Diptera",3,125,2021,"Gorbea"
"168",168,"06/05/21","10:30:00","1",1,"Taraxacum sp.","Apis mellifera","","no",NA,"","2021-05-06","2021-05-06 NA","Apis mellifera","Apis","mellifera","Apidae",3,125,2021,"Gorbea"
"169",169,"06/05/21","13:30:00","1",2,"Taraxacum sp.","Apis mellifera","","no",NA,"","2021-05-06","2021-05-06 NA","Apis mellifera","Apis","mellifera","Apidae",3,125,2021,"Gorbea"
"170",170,"06/05/21","13:30:00","1",2,"Taraxacum sp.","Apis mellifera","","no",NA,"","2021-05-06","2021-05-06 NA","Apis mellifera","Apis","mellifera","Apidae",3,125,2021,"Gorbea"
"171",171,"06/05/21","13:30:00","1",2,"Primula elatior","Bombus pascuorum","","no",NA,"","2021-05-06","2021-05-06 NA","Bombus pascuorum","Bombus","pascuorum","Apidae",3,125,2021,"Gorbea"
"172",172,"06/05/21","13:30:00","1",2,"Hutchinsia alpina","?=28","","no",NA,"","2021-05-06","2021-05-06 NA","Cheilosia sp","Cheilosia","sp","Syrphidae",3,125,2021,"Gorbea"
"173",173,"06/05/21","13:30:00","1",2,"Taraxacum sp.","Apis mellifera","","no",NA,"","2021-05-06","2021-05-06 NA","Apis mellifera","Apis","mellifera","Apidae",3,125,2021,"Gorbea"
"174",174,"06/05/21","13:30:00","1",2,"Erysimum gorbeanum","","","si",29,"","2021-05-06","2021-05-06 29","Lasioglossum tricinctum","Lasioglossum","tricinctum","Halictidae",3,125,2021,"Gorbea"
"175",175,"06/05/21","13:30:00","1",2,"Taraxacum sp.","Apis mellifera","","no",NA,"","2021-05-06","2021-05-06 NA","Apis mellifera","Apis","mellifera","Apidae",3,125,2021,"Gorbea"
"176",176,"06/05/21","13:30:00","1",2,"Taraxacum sp.","Andrena cf morio","","no",NA,"","2021-05-06","2021-05-06 NA","Andrena cf morio","Andrena","cf morio","Andrenidae",3,125,2021,"Gorbea"
"177",177,"06/05/21","16:00:00","1",3,"Viola riviniana","","","si",30,"","2021-05-06","2021-05-06 30","Anthophora plumipes","Anthophora","plumipes","Apidae",3,125,2021,"Gorbea"
"178",178,"06/05/21","16:00:00","1",3,"Scilla verna","","","si",31,"","2021-05-06","2021-05-06 31","Episyrphus sp","Episyrphus","sp","Syrphidae",3,125,2021,"Gorbea"
"179",179,"06/05/21","16:00:00","1",3,"Taraxacum sp.","Apis mellifera","","no",NA,"","2021-05-06","2021-05-06 NA","Apis mellifera","Apis","mellifera","Apidae",3,125,2021,"Gorbea"
"180",180,"06/05/21","16:00:00","1",3,"Taraxacum sp.","Apis mellifera","","no",NA,"","2021-05-06","2021-05-06 NA","Apis mellifera","Apis","mellifera","Apidae",3,125,2021,"Gorbea"
"181",181,"06/05/21","16:00:00","1",3,"Taraxacum sp.","Apis mellifera","","no",NA,"","2021-05-06","2021-05-06 NA","Apis mellifera","Apis","mellifera","Apidae",3,125,2021,"Gorbea"
"182",182,"06/05/21","16:00:00","1",3,"Bellis perennis","Eristalis tenax","","no",NA,"","2021-05-06","2021-05-06 NA","Eristalis tenax","Eristalis","tenax","Syrphidae",3,125,2021,"Gorbea"
"183",183,"06/05/21","16:00:00","1",3,"Bellis perennis","?=27","","no",NA,"","2021-05-06","2021-05-06 NA","Eupeodes corollae","Eupeodes","corollae","Syrphidae",3,125,2021,"Gorbea"
"184",184,"06/05/21","16:00:00","1",3,"Taraxacum sp.","Apis mellifera","","no",NA,"","2021-05-06","2021-05-06 NA","Apis mellifera","Apis","mellifera","Apidae",3,125,2021,"Gorbea"
"185",185,"07/05/21","10:30:00","2",1,"Taraxacum sp.","Apis mellifera","","no",NA,"","2021-05-07","2021-05-07 NA","Apis mellifera","Apis","mellifera","Apidae",4,126,2021,"Gorbea"
"186",186,"07/05/21","10:30:00","2",1,"Taraxacum sp.","Apis mellifera","","no",NA,"","2021-05-07","2021-05-07 NA","Apis mellifera","Apis","mellifera","Apidae",4,126,2021,"Gorbea"
"187",187,"07/05/21","10:30:00","2",1,"Taraxacum sp.","Eristalis tenax","","no",NA,"","2021-05-07","2021-05-07 NA","Eristalis tenax","Eristalis","tenax","Syrphidae",4,126,2021,"Gorbea"
"188",188,"07/05/21","10:30:00","2",1,"Taraxacum sp.","Pieris napi","","no",NA,"","2021-05-07","2021-05-07 NA","Pieris napi","Pieris","napi","Lepidoptera",4,126,2021,"Gorbea"
"189",189,"07/05/21","13:00:00","2",2,"Taraxacum sp.","","","si",34,"","2021-05-07","2021-05-07 34","Platycheirus albimanus","Platycheirus","albimanus","Syrphidae",4,126,2021,"Gorbea"
"190",190,"07/05/21","13:00:00","2",2,"Taraxacum sp.","Apis mellifera","","no",NA,"","2021-05-07","2021-05-07 NA","Apis mellifera","Apis","mellifera","Apidae",4,126,2021,"Gorbea"
"191",191,"07/05/21","13:00:00","2",2,"Taraxacum sp.","Apis mellifera","","no",NA,"","2021-05-07","2021-05-07 NA","Apis mellifera","Apis","mellifera","Apidae",4,126,2021,"Gorbea"
"192",192,"07/05/21","13:00:00","2",2,"Bellis perennis","Eupeodes sp.","","no",NA,"","2021-05-07","2021-05-07 NA","Eupeodes sp.","Eupeodes","sp.","Syrphidae",4,126,2021,"Gorbea"
"193",193,"07/05/21","13:00:00","2",2,"Taraxacum sp.","Apis mellifera","","no",NA,"","2021-05-07","2021-05-07 NA","Apis mellifera","Apis","mellifera","Apidae",4,126,2021,"Gorbea"
"194",194,"07/05/21","13:00:00","2",2,"Pedicularis sylvatica subsp. sylvatica","Bombus pascuorum","","no",NA,"","2021-05-07","2021-05-07 NA","Bombus pascuorum","Bombus","pascuorum","Apidae",4,126,2021,"Gorbea"
"195",195,"07/05/21","13:00:00","2",2,"Taraxacum sp.","Apis mellifera","","no",NA,"","2021-05-07","2021-05-07 NA","Apis mellifera","Apis","mellifera","Apidae",4,126,2021,"Gorbea"
"196",196,"07/05/21","13:00:00","2",2,"Viola riviniana","Bombus pascuorum","","no",NA,"","2021-05-07","2021-05-07 NA","Bombus pascuorum","Bombus","pascuorum","Apidae",4,126,2021,"Gorbea"
"197",197,"07/05/21","13:00:00","2",2,"Taraxacum sp.","Bombus pascuorum","","no",NA,"","2021-05-07","2021-05-07 NA","Bombus pascuorum","Bombus","pascuorum","Apidae",4,126,2021,"Gorbea"
"198",198,"07/05/21","13:00:00","2",2,"Bellis perennis","Eristalis tenax","","no",NA,"","2021-05-07","2021-05-07 NA","Eristalis tenax","Eristalis","tenax","Syrphidae",4,126,2021,"Gorbea"
"199",199,"07/05/21","13:00:00","2",2,"Taraxacum sp.","Apis mellifera","","no",NA,"","2021-05-07","2021-05-07 NA","Apis mellifera","Apis","mellifera","Apidae",4,126,2021,"Gorbea"
"200",200,"07/05/21","13:00:00","2",2,"Taraxacum sp.","Apis mellifera","","no",NA,"","2021-05-07","2021-05-07 NA","Apis mellifera","Apis","mellifera","Apidae",4,126,2021,"Gorbea"
"201",201,"07/05/21","13:00:00","2",2,"Taraxacum sp.","Apis mellifera","","no",NA,"","2021-05-07","2021-05-07 NA","Apis mellifera","Apis","mellifera","Apidae",4,126,2021,"Gorbea"
"202",202,"07/05/21","13:00:00","2",2,"Taraxacum sp.","?=34","","no",NA,"","2021-05-07","2021-05-07 NA","Platycheirus albimanus","Platycheirus","albimanus","Syrphidae",4,126,2021,"Gorbea"
"203",203,"07/05/21","15:30:00","2",3,"Taraxacum sp.","Apis mellifera","","no",NA,"","2021-05-07","2021-05-07 NA","Apis mellifera","Apis","mellifera","Apidae",4,126,2021,"Gorbea"
"204",204,"07/05/21","15:30:00","2",3,"Bellis perennis","","","si",35,"","2021-05-07","2021-05-07 35","Lucilia silvarum","Lucilia","silvarum","Calliphoridae",4,126,2021,"Gorbea"
"205",205,"07/05/21","15:30:00","2",3,"Taraxacum sp.","Apis mellifera","","",NA,"","2021-05-07","2021-05-07 NA","Apis mellifera","Apis","mellifera","Apidae",4,126,2021,"Gorbea"
"206",206,"07/05/21","15:30:00","2",3,"Taraxacum sp.","Apis mellifera","","",NA,"","2021-05-07","2021-05-07 NA","Apis mellifera","Apis","mellifera","Apidae",4,126,2021,"Gorbea"
"207",207,"07/05/21","15:30:00","2",3,"Taraxacum sp.","Apis mellifera","","",NA,"","2021-05-07","2021-05-07 NA","Apis mellifera","Apis","mellifera","Apidae",4,126,2021,"Gorbea"
"208",208,"07/05/21","15:30:00","2",3,"Taraxacum sp.","Apis mellifera","","",NA,"","2021-05-07","2021-05-07 NA","Apis mellifera","Apis","mellifera","Apidae",4,126,2021,"Gorbea"
"209",209,"07/05/21","15:30:00","2",3,"Taraxacum sp.","Apis mellifera","","",NA,"","2021-05-07","2021-05-07 NA","Apis mellifera","Apis","mellifera","Apidae",4,126,2021,"Gorbea"
"210",210,"07/05/21","15:30:00","2",3,"Bellis perennis","Eupeodes sp.","","",NA,"","2021-05-07","2021-05-07 NA","Eupeodes sp.","Eupeodes","sp.","Syrphidae",4,126,2021,"Gorbea"
"211",211,"07/05/21","15:30:00","2",3,"Taraxacum sp.","Apis mellifera","","",NA,"","2021-05-07","2021-05-07 NA","Apis mellifera","Apis","mellifera","Apidae",4,126,2021,"Gorbea"
"212",212,"07/05/21","15:30:00","2",3,"Taraxacum sp.","Apis mellifera","","",NA,"","2021-05-07","2021-05-07 NA","Apis mellifera","Apis","mellifera","Apidae",4,126,2021,"Gorbea"
"213",213,"07/05/21","15:30:00","2",3,"Taraxacum sp.","Eristalis tenax","","",NA,"","2021-05-07","2021-05-07 NA","Eristalis tenax","Eristalis","tenax","Syrphidae",4,126,2021,"Gorbea"
"214",214,"07/05/21","15:30:00","2",3,"Taraxacum sp.","Apis mellifera","","",NA,"","2021-05-07","2021-05-07 NA","Apis mellifera","Apis","mellifera","Apidae",4,126,2021,"Gorbea"
"215",215,"07/05/21","15:30:00","2",3,"Taraxacum sp.","Apis mellifera","","",NA,"","2021-05-07","2021-05-07 NA","Apis mellifera","Apis","mellifera","Apidae",4,126,2021,"Gorbea"
"216",216,"07/05/21","15:30:00","2",3,"Taraxacum sp.","Apis mellifera","","",NA,"","2021-05-07","2021-05-07 NA","Apis mellifera","Apis","mellifera","Apidae",4,126,2021,"Gorbea"
"217",217,"07/05/21","15:30:00","2",3,"Taraxacum sp.","Apis mellifera","","",NA,"","2021-05-07","2021-05-07 NA","Apis mellifera","Apis","mellifera","Apidae",4,126,2021,"Gorbea"
"218",218,"07/05/21","15:30:00","2",3,"Bellis perennis","Pararge aegeria","","",NA,"","2021-05-07","2021-05-07 NA","Pararge aegeria","Pararge","aegeria","Lepidoptera",4,126,2021,"Gorbea"
"219",219,"10/05/21","10:00:00","4",1,"Ranunculus repens","Sphaerophoria scripta","hembra","no",NA,"","2021-05-10","2021-05-10 NA","Sphaerophoria scripta","Sphaerophoria","scripta","Syrphidae",2,129,2021,"Gorbea"
"220",220,"10/05/21","10:00:00","4",1,"Scilla verna","?=11","","no",NA,"","2021-05-10","2021-05-10 NA","Empis sp","Empis","sp","Empididae",2,129,2021,"Gorbea"
"221",221,"10/05/21","10:00:00","4",1,"Scilla verna","Eristalis tenax","","no",NA,"","2021-05-10","2021-05-10 NA","Eristalis tenax","Eristalis","tenax","Syrphidae",2,129,2021,"Gorbea"
"222",222,"10/05/21","13:00:00","4",2,"Bellis perennis","","","si",36,"","2021-05-10","2021-05-10 36","Empis sp","Empis","sp","Empididae",2,129,2021,"Gorbea"
"223",223,"10/05/21","13:00:00","4",2,"Bellis perennis","?=36","","no",NA,"","2021-05-10","2021-05-10 NA","Empis sp","Empis","sp","Empididae",2,129,2021,"Gorbea"
"224",224,"10/05/21","13:00:00","4",2,"Bellis perennis","?=36","","no",NA,"","2021-05-10","2021-05-10 NA","Empis sp","Empis","sp","Empididae",2,129,2021,"Gorbea"
"225",225,"10/05/21","13:00:00","4",2,"Bellis perennis","?=36","","no",NA,"","2021-05-10","2021-05-10 NA","Empis sp","Empis","sp","Empididae",2,129,2021,"Gorbea"
"226",226,"10/05/21","13:00:00","4",2,"Bellis perennis","?=36","","no",NA,"","2021-05-10","2021-05-10 NA","Empis sp","Empis","sp","Empididae",2,129,2021,"Gorbea"
"227",227,"10/05/21","13:00:00","4",2,"Bellis perennis","?=36","","no",NA,"","2021-05-10","2021-05-10 NA","Empis sp","Empis","sp","Empididae",2,129,2021,"Gorbea"
"228",228,"10/05/21","13:00:00","4",2,"Bellis perennis","?=36","","no",NA,"","2021-05-10","2021-05-10 NA","Empis sp","Empis","sp","Empididae",2,129,2021,"Gorbea"
"229",229,"10/05/21","13:00:00","4",2,"Bellis perennis","?=36","","no",NA,"","2021-05-10","2021-05-10 NA","Empis sp","Empis","sp","Empididae",2,129,2021,"Gorbea"
"230",230,"10/05/21","13:00:00","4",2,"Bellis perennis","?=36","","no",NA,"","2021-05-10","2021-05-10 NA","Empis sp","Empis","sp","Empididae",2,129,2021,"Gorbea"
"231",231,"10/05/21","13:00:00","4",2,"Bellis perennis","?=36","","no",NA,"","2021-05-10","2021-05-10 NA","Empis sp","Empis","sp","Empididae",2,129,2021,"Gorbea"
"232",232,"10/05/21","13:00:00","4",2,"Bellis perennis","?=36","","no",NA,"","2021-05-10","2021-05-10 NA","Empis sp","Empis","sp","Empididae",2,129,2021,"Gorbea"
"233",233,"10/05/21","13:00:00","4",2,"Scilla verna","?=36","","no",NA,"","2021-05-10","2021-05-10 NA","Empis sp","Empis","sp","Empididae",2,129,2021,"Gorbea"
"234",234,"10/05/21","13:00:00","4",2,"Scilla verna","","","si",37,"","2021-05-10","2021-05-10 37","Andrena bicolor","Andrena","bicolor","Andrenidae",2,129,2021,"Gorbea"
"235",235,"10/05/21","13:00:00","4",2,"Ranunculus repens","Eristalis tenax","","",NA,"","2021-05-10","2021-05-10 NA","Eristalis tenax","Eristalis","tenax","Syrphidae",2,129,2021,"Gorbea"
"236",236,"10/05/21","13:00:00","4",2,"Bellis perennis","Eristalis tenax","","",NA,"","2021-05-10","2021-05-10 NA","Eristalis tenax","Eristalis","tenax","Syrphidae",2,129,2021,"Gorbea"
"237",237,"10/05/21","15:30:00","4",3,"Scilla verna","?=36","","no",NA,"","2021-05-10","2021-05-10 NA","Empis sp","Empis","sp","Empididae",2,129,2021,"Gorbea"
"238",238,"10/05/21","15:30:00","4",3,"Scilla verna","?=36","","no",NA,"","2021-05-10","2021-05-10 NA","Empis sp","Empis","sp","Empididae",2,129,2021,"Gorbea"
"239",239,"10/05/21","15:30:00","4",3,"Scilla verna","?=36","","no",NA,"","2021-05-10","2021-05-10 NA","Empis sp","Empis","sp","Empididae",2,129,2021,"Gorbea"
"240",240,"10/05/21","15:30:00","4",3,"Scilla verna","?=36","","no",NA,"","2021-05-10","2021-05-10 NA","Empis sp","Empis","sp","Empididae",2,129,2021,"Gorbea"
"241",241,"10/05/21","15:30:00","4",3,"Potentilla erecta","Sphaerophoria scripta","macho","no",NA,"","2021-05-10","2021-05-10 NA","Sphaerophoria scripta","Sphaerophoria","scripta","Syrphidae",2,129,2021,"Gorbea"
"242",242,"10/05/21","15:30:00","4",3,"Taraxacum sp.","Apis mellifera","","no",NA,"","2021-05-10","2021-05-10 NA","Apis mellifera","Apis","mellifera","Apidae",2,129,2021,"Gorbea"
"243",243,"10/05/21","15:30:00","4",3,"Bellis perennis","?=36","","no",NA,"","2021-05-10","2021-05-10 NA","Empis sp","Empis","sp","Empididae",2,129,2021,"Gorbea"
"244",244,"10/05/21","15:30:00","4",3,"Bellis perennis","?=36","","no",NA,"","2021-05-10","2021-05-10 NA","Empis sp","Empis","sp","Empididae",2,129,2021,"Gorbea"
"245",245,"10/05/21","15:30:00","4",3,"Bellis perennis","?=36","","no",NA,"","2021-05-10","2021-05-10 NA","Empis sp","Empis","sp","Empididae",2,129,2021,"Gorbea"
"246",246,"10/05/21","15:30:00","4",3,"Bellis perennis","?=36","","no",NA,"","2021-05-10","2021-05-10 NA","Empis sp","Empis","sp","Empididae",2,129,2021,"Gorbea"
"247",247,"10/05/21","15:30:00","4",3,"Bellis perennis","?=36","","no",NA,"","2021-05-10","2021-05-10 NA","Empis sp","Empis","sp","Empididae",2,129,2021,"Gorbea"
"248",248,"10/05/21","15:30:00","4",3,"Taraxacum sp.","?=37","","no",NA,"","2021-05-10","2021-05-10 NA","Andrena bicolor","Andrena","bicolor","Andrenidae",2,129,2021,"Gorbea"
"249",249,"14/05/21","10:30:00","5",1,"Scilla verna","?=22","","no",NA,"Moito frío","2021-05-14","2021-05-14 NA","Empis sp","Empis","sp","Empididae",3,133,2021,"Gorbea"
"250",250,"14/05/21","10:30:00","5",1,"Ranunculus repens","coleopteros liña laranxa foto","","no",NA,"Moito frío","2021-05-14","2021-05-14 NA","coleopteros liña laranxa foto","coleopteros","liña laranxa foto","Coleoptera",3,133,2021,"Gorbea"
"251",251,"14/05/21","13:00:00","5",2,"Ranunculus repens","","","si",38,"","2021-05-14","2021-05-14 38","Myolepta sp","Myolepta","sp","Syrphidae",3,133,2021,"Gorbea"
"252",252,"14/05/21","13:00:00","5",2,"Pedicularis sylvatica subsp. sylvatica","Bombus pascuorum","","no",NA,"","2021-05-14","2021-05-14 NA","Bombus pascuorum","Bombus","pascuorum","Apidae",3,133,2021,"Gorbea"
"253",253,"14/05/21","13:00:00","5",2,"Scilla verna","?=22","","no",NA,"","2021-05-14","2021-05-14 NA","Empis sp","Empis","sp","Empididae",3,133,2021,"Gorbea"
"254",254,"14/05/21","15:30:00","5",3,"Scilla verna","?=22","","no",NA,"","2021-05-14","2021-05-14 NA","Empis sp","Empis","sp","Empididae",3,133,2021,"Gorbea"
"255",255,"14/05/21","15:30:00","5",3,"Potentilla erecta","?=38","","no",NA,"","2021-05-14","2021-05-14 NA","Myolepta sp","Myolepta","sp","Syrphidae",3,133,2021,"Gorbea"
"256",256,"14/05/21","15:30:00","5",3,"Ranunculus repens","?=C23","","no",NA,"","2021-05-14","2021-05-14 NA","Orthoptera","Orthoptera","","Orthoptera",3,133,2021,"Gorbea"
"257",257,"14/05/21","15:30:00","5",3,"Potentilla erecta","?=C23","","no",NA,"","2021-05-14","2021-05-14 NA","Orthoptera","Orthoptera","","Orthoptera",3,133,2021,"Gorbea"
"258",258,"14/05/21","15:30:00","5",3,"Scilla verna","?=22","","no",NA,"","2021-05-14","2021-05-14 NA","Empis sp","Empis","sp","Empididae",3,133,2021,"Gorbea"
"259",259,"14/05/21","15:30:00","5",3,"Polygala vulgaris","Pyrgus malvoides","","no",NA,"","2021-05-14","2021-05-14 NA","Pyrgus malvoides","Pyrgus","malvoides","Lepidoptera",3,133,2021,"Gorbea"
"260",260,"14/05/21","15:30:00","5",3,"Potentilla erecta","Sphaerophoria scripta","macho","no",NA,"","2021-05-14","2021-05-14 NA","Sphaerophoria scripta","Sphaerophoria","scripta","Syrphidae",3,133,2021,"Gorbea"
"261",261,"17/05/21","10:45:00","3",1,"Lathyrus linifolius","Bombus lapidarius","","no",NA,"","2021-05-17","2021-05-17 NA","Bombus lapidarius","Bombus","lapidarius","Apidae",4,136,2021,"Gorbea"
"262",262,"17/05/21","10:45:00","3",1,"Ranunculus repens","Sphaerophoria scripta","macho","no",NA,"","2021-05-17","2021-05-17 NA","Sphaerophoria scripta","Sphaerophoria","scripta","Syrphidae",4,136,2021,"Gorbea"
"263",263,"17/05/21","10:45:00","3",1,"Lathyrus linifolius","Bombus lapidarius","","no",NA,"","2021-05-17","2021-05-17 NA","Bombus lapidarius","Bombus","lapidarius","Apidae",4,136,2021,"Gorbea"
"264",264,"17/05/21","13:15:00","3",2,"Ranunculus repens","","","si",39,"","2021-05-17","2021-05-17 39","Lasioglossum sp","Lasioglossum","sp","Halictidae",4,136,2021,"Gorbea"
"265",265,"17/05/21","13:15:00","3",2,"Ranunculus repens","?=39","","no",NA,"","2021-05-17","2021-05-17 NA","Lasioglossum sp","Lasioglossum","sp","Halictidae",4,136,2021,"Gorbea"
"266",266,"17/05/21","13:15:00","3",2,"Bellis perennis","Sphaerophoria scripta","macho","no",NA,"","2021-05-17","2021-05-17 NA","Sphaerophoria scripta","Sphaerophoria","scripta","Syrphidae",4,136,2021,"Gorbea"
"267",267,"17/05/21","13:15:00","3",2,"Ranunculus repens","?=39","","no",NA,"","2021-05-17","2021-05-17 NA","Lasioglossum sp","Lasioglossum","sp","Halictidae",4,136,2021,"Gorbea"
"268",268,"17/05/21","13:15:00","3",2,"Ranunculus repens","?=39","","no",NA,"","2021-05-17","2021-05-17 NA","Lasioglossum sp","Lasioglossum","sp","Halictidae",4,136,2021,"Gorbea"
"269",269,"17/05/21","13:15:00","3",2,"Ranunculus repens","Sphaerophoria scripta","hembra","no",NA,"","2021-05-17","2021-05-17 NA","Sphaerophoria scripta","Sphaerophoria","scripta","Syrphidae",4,136,2021,"Gorbea"
"270",270,"17/05/21","13:15:00","3",2,"Bellis perennis","?=39","","no",NA,"","2021-05-17","2021-05-17 NA","Lasioglossum sp","Lasioglossum","sp","Halictidae",4,136,2021,"Gorbea"
"271",271,"17/05/21","13:15:00","3",2,"Ranunculus repens","Eristalis tenax","","no",NA,"","2021-05-17","2021-05-17 NA","Eristalis tenax","Eristalis","tenax","Syrphidae",4,136,2021,"Gorbea"
"272",272,"17/05/21","13:15:00","3",2,"Potentilla montana","","","si",40,"","2021-05-17","2021-05-17 40","Andrena minutuloides","Andrena","minutuloides","Andrenidae",4,136,2021,"Gorbea"
"273",273,"17/05/21","13:15:00","3",2,"Potentilla montana","?=40","","no",NA,"","2021-05-17","2021-05-17 NA","Andrena minutuloides","Andrena","minutuloides","Andrenidae",4,136,2021,"Gorbea"
"274",274,"17/05/21","13:15:00","3",2,"Ranunculus repens","Sphaerophoria scripta","","no",NA,"","2021-05-17","2021-05-17 NA","Sphaerophoria scripta","Sphaerophoria","scripta","Syrphidae",4,136,2021,"Gorbea"
"275",275,"17/05/21","13:15:00","3",2,"Bellis perennis","Sphaerophoria scripta","","no",NA,"","2021-05-17","2021-05-17 NA","Sphaerophoria scripta","Sphaerophoria","scripta","Syrphidae",4,136,2021,"Gorbea"
"276",276,"17/05/21","13:15:00","3",2,"Potentilla montana","?=40","","no",NA,"","2021-05-17","2021-05-17 NA","Andrena minutuloides","Andrena","minutuloides","Andrenidae",4,136,2021,"Gorbea"
"277",277,"17/05/21","13:15:00","3",2,"Bellis perennis","?=40","","no",NA,"","2021-05-17","2021-05-17 NA","Andrena minutuloides","Andrena","minutuloides","Andrenidae",4,136,2021,"Gorbea"
"278",278,"17/05/21","13:15:00","3",2,"Bellis perennis","?=40","","no",NA,"","2021-05-17","2021-05-17 NA","Andrena minutuloides","Andrena","minutuloides","Andrenidae",4,136,2021,"Gorbea"
"279",279,"17/05/21","13:15:00","3",2,"Ranunculus repens","?=39","","no",NA,"","2021-05-17","2021-05-17 NA","Lasioglossum sp","Lasioglossum","sp","Halictidae",4,136,2021,"Gorbea"
"280",280,"17/05/21","13:15:00","3",2,"Ranunculus repens","Sphaerophoria scripta","hembra","no",NA,"","2021-05-17","2021-05-17 NA","Sphaerophoria scripta","Sphaerophoria","scripta","Syrphidae",4,136,2021,"Gorbea"
"281",281,"17/05/21","15:45:00","3",3,"Ranunculus repens","?=39","","no",NA,"","2021-05-17","2021-05-17 NA","Lasioglossum sp","Lasioglossum","sp","Halictidae",4,136,2021,"Gorbea"
"282",282,"17/05/21","15:45:00","3",3,"Ranunculus repens","?=39","","no",NA,"","2021-05-17","2021-05-17 NA","Lasioglossum sp","Lasioglossum","sp","Halictidae",4,136,2021,"Gorbea"
"283",283,"17/05/21","15:45:00","3",3,"Ranunculus repens","?=39","","no",NA,"","2021-05-17","2021-05-17 NA","Lasioglossum sp","Lasioglossum","sp","Halictidae",4,136,2021,"Gorbea"
"284",284,"17/05/21","15:45:00","3",3,"Bellis perennis","?=39","","no",NA,"","2021-05-17","2021-05-17 NA","Lasioglossum sp","Lasioglossum","sp","Halictidae",4,136,2021,"Gorbea"
"285",285,"17/05/21","15:45:00","3",3,"Pilosella officinarum","?=91","","no",NA,"","2021-05-17","2021-05-17 NA","Chrysolina sp","Chrysolina","sp","Chrysomelidae",4,136,2021,"Gorbea"
"286",286,"17/05/21","15:45:00","3",3,"Pilosella officinarum","?=91","","no",NA,"","2021-05-17","2021-05-17 NA","Chrysolina sp","Chrysolina","sp","Chrysomelidae",4,136,2021,"Gorbea"
"287",287,"17/05/21","15:45:00","3",3,"Ranunculus repens","?=39","","no",NA,"","2021-05-17","2021-05-17 NA","Lasioglossum sp","Lasioglossum","sp","Halictidae",4,136,2021,"Gorbea"
"288",288,"17/05/21","15:45:00","3",3,"Bellis perennis","Sphaerophoria scripta","hembra","no",NA,"","2021-05-17","2021-05-17 NA","Sphaerophoria scripta","Sphaerophoria","scripta","Syrphidae",4,136,2021,"Gorbea"
"289",289,"17/05/21","15:45:00","3",3,"Ranunculus repens","?=91","","no",NA,"","2021-05-17","2021-05-17 NA","Chrysolina sp","Chrysolina","sp","Chrysomelidae",4,136,2021,"Gorbea"
"290",290,"17/05/21","15:45:00","3",3,"Ranunculus repens","?=39","","no",NA,"","2021-05-17","2021-05-17 NA","Lasioglossum sp","Lasioglossum","sp","Halictidae",4,136,2021,"Gorbea"
"291",291,"17/05/21","15:45:00","3",3,"Bellis perennis","?=40","","no",NA,"","2021-05-17","2021-05-17 NA","Andrena minutuloides","Andrena","minutuloides","Andrenidae",4,136,2021,"Gorbea"
"292",292,"17/05/21","15:45:00","3",3,"Ranunculus repens","Sphaerophoria scripta","hembra","no",NA,"","2021-05-17","2021-05-17 NA","Sphaerophoria scripta","Sphaerophoria","scripta","Syrphidae",4,136,2021,"Gorbea"
"293",293,"17/05/21","15:45:00","3",3,"Ranunculus repens","?=39","","no",NA,"","2021-05-17","2021-05-17 NA","Lasioglossum sp","Lasioglossum","sp","Halictidae",4,136,2021,"Gorbea"
"294",294,"17/05/21","15:45:00","3",3,"Ranunculus repens","?=39","","no",NA,"","2021-05-17","2021-05-17 NA","Lasioglossum sp","Lasioglossum","sp","Halictidae",4,136,2021,"Gorbea"
"295",295,"17/05/21","15:45:00","3",3,"Ranunculus repens","?=40","","no",NA,"","2021-05-17","2021-05-17 NA","Andrena minutuloides","Andrena","minutuloides","Andrenidae",4,136,2021,"Gorbea"
"296",296,"17/05/21","15:45:00","3",3,"Bellis perennis","Sphaerophoria scripta","macho","no",NA,"","2021-05-17","2021-05-17 NA","Sphaerophoria scripta","Sphaerophoria","scripta","Syrphidae",4,136,2021,"Gorbea"
"297",297,"17/05/21","15:45:00","3",3,"Bellis perennis","Sphaerophoria scripta","hembra","no",NA,"","2021-05-17","2021-05-17 NA","Sphaerophoria scripta","Sphaerophoria","scripta","Syrphidae",4,136,2021,"Gorbea"
"298",298,"17/05/21","15:45:00","3",3,"Bellis perennis","","","si",41,"","2021-05-17","2021-05-17 41","Platycheirus albimanus","Platycheirus","albimanus","Syrphidae",4,136,2021,"Gorbea"
"299",299,"17/05/21","15:45:00","3",3,"Bellis perennis","?=39","","no",NA,"","2021-05-17","2021-05-17 NA","Lasioglossum sp","Lasioglossum","sp","Halictidae",4,136,2021,"Gorbea"
"300",300,"17/05/21","15:45:00","3",3,"Ranunculus repens","?=39","","no",NA,"","2021-05-17","2021-05-17 NA","Lasioglossum sp","Lasioglossum","sp","Halictidae",4,136,2021,"Gorbea"
"301",301,"17/05/21","15:45:00","3",3,"Potentilla erecta","?=40","","no",NA,"","2021-05-17","2021-05-17 NA","Andrena minutuloides","Andrena","minutuloides","Andrenidae",4,136,2021,"Gorbea"
"302",302,"18/05/21","10:40:00","2",1,"Taraxacum sp.","","","si",42,"","2021-05-18","2021-05-18 42","Bombus sylvestris","Bombus","sylvestris","Apidae",5,137,2021,"Gorbea"
"303",303,"18/05/21","10:40:00","2",1,"Bellis perennis","Sphaerophoria scripta","hembra","no",NA,"","2021-05-18","2021-05-18 NA","Sphaerophoria scripta","Sphaerophoria","scripta","Syrphidae",5,137,2021,"Gorbea"
"304",304,"18/05/21","10:40:00","2",1,"Cardamine pratensis","?=26","","no",NA,"","2021-05-18","2021-05-18 NA","Andrena bicolor","Andrena","bicolor","Andrenidae",5,137,2021,"Gorbea"
"305",305,"18/05/21","10:40:00","2",1,"Potentilla sterilis","","","si",43,"","2021-05-18","2021-05-18 43","Empis sp","Empis","sp","Empididae",5,137,2021,"Gorbea"
"306",306,"18/05/21","10:40:00","2",1,"Taraxacum sp.","Apis mellifera","","no",NA,"","2021-05-18","2021-05-18 NA","Apis mellifera","Apis","mellifera","Apidae",5,137,2021,"Gorbea"
"307",307,"18/05/21","10:40:00","2",1,"Taraxacum sp.","Apis mellifera","","no",NA,"","2021-05-18","2021-05-18 NA","Apis mellifera","Apis","mellifera","Apidae",5,137,2021,"Gorbea"
"308",308,"18/05/21","10:40:00","2",1,"Taraxacum sp.","Apis mellifera","","no",NA,"","2021-05-18","2021-05-18 NA","Apis mellifera","Apis","mellifera","Apidae",5,137,2021,"Gorbea"
"309",309,"18/05/21","10:40:00","2",1,"Cardamine pratensis","Anthocharis cardamines","hembra","no",NA,"","2021-05-18","2021-05-18 NA","Anthocharis cardamines","Anthocharis","cardamines","Lepidoptera",5,137,2021,"Gorbea"
"310",310,"18/05/21","10:40:00","2",1,"Taraxacum sp.","Apis mellifera","","no",NA,"","2021-05-18","2021-05-18 NA","Apis mellifera","Apis","mellifera","Apidae",5,137,2021,"Gorbea"
"311",311,"18/05/21","10:40:00","2",1,"Cardamine pratensis","?=C42","","no",NA,"bombilidae","2021-05-18","2021-05-18 NA","Bombylius sp","Bombylius","sp","Bombyliidae",5,137,2021,"Gorbea"
"312",312,"18/05/21","10:40:00","2",1,"Ranunculus repens","Pyrgus malvoides","","no",NA,"","2021-05-18","2021-05-18 NA","Pyrgus malvoides","Pyrgus","malvoides","Lepidoptera",5,137,2021,"Gorbea"
"313",313,"18/05/21","13:40:00","2",2,"Taraxacum sp.","Apis mellifera","","no",NA,"","2021-05-18","2021-05-18 NA","Apis mellifera","Apis","mellifera","Apidae",5,137,2021,"Gorbea"
"314",314,"18/05/21","13:40:00","2",2,"Taraxacum sp.","Apis mellifera","","no",NA,"","2021-05-18","2021-05-18 NA","Apis mellifera","Apis","mellifera","Apidae",5,137,2021,"Gorbea"
"315",315,"18/05/21","13:40:00","2",2,"Taraxacum sp.","?=42","","no",NA,"","2021-05-18","2021-05-18 NA","Bombus sylvestris","Bombus","sylvestris","Apidae",5,137,2021,"Gorbea"
"316",316,"18/05/21","13:40:00","2",2,"Ranunculus repens","coleopteros liña laranxa foto","","no",NA,"","2021-05-18","2021-05-18 NA","coleopteros liña laranxa foto","coleopteros","liña laranxa foto","Coleoptera",5,137,2021,"Gorbea"
"317",317,"20/05/21","10:30:00","1",1,"Taraxacum sp.","Apis mellifera","","no",NA,"","2021-05-20","2021-05-20 NA","Apis mellifera","Apis","mellifera","Apidae",4,139,2021,"Gorbea"
"318",318,"20/05/21","10:30:00","1",1,"Taraxacum sp.","Apis mellifera","","no",NA,"","2021-05-20","2021-05-20 NA","Apis mellifera","Apis","mellifera","Apidae",4,139,2021,"Gorbea"
"319",319,"20/05/21","10:30:00","1",1,"Taraxacum sp.","Apis mellifera","","no",NA,"","2021-05-20","2021-05-20 NA","Apis mellifera","Apis","mellifera","Apidae",4,139,2021,"Gorbea"
"320",320,"20/05/21","10:30:00","1",1,"Taraxacum sp.","Apis mellifera","","no",NA,"","2021-05-20","2021-05-20 NA","Apis mellifera","Apis","mellifera","Apidae",4,139,2021,"Gorbea"
"321",321,"20/05/21","10:30:00","1",1,"Bellis perennis","Eupeodes sp.","","no",NA,"","2021-05-20","2021-05-20 NA","Eupeodes sp.","Eupeodes","sp.","Syrphidae",4,139,2021,"Gorbea"
"322",322,"20/05/21","10:30:00","1",1,"Bellis perennis","","","si",44,"","2021-05-20","2021-05-20 44","Lucilia caesar","Lucilia","caesar","Calliphoridae",4,139,2021,"Gorbea"
"323",323,"20/05/21","10:30:00","1",1,"Taraxacum sp.","Apis mellifera","","no",NA,"","2021-05-20","2021-05-20 NA","Apis mellifera","Apis","mellifera","Apidae",4,139,2021,"Gorbea"
"324",324,"20/05/21","10:30:00","1",1,"Taraxacum sp.","Apis mellifera","","no",NA,"","2021-05-20","2021-05-20 NA","Apis mellifera","Apis","mellifera","Apidae",4,139,2021,"Gorbea"
"325",325,"20/05/21","10:30:00","1",1,"Bellis perennis","?=44","","no",NA,"","2021-05-20","2021-05-20 NA","Lucilia caesar","Lucilia","caesar","Calliphoridae",4,139,2021,"Gorbea"
"326",326,"20/05/21","10:30:00","1",1,"Taraxacum sp.","Apis mellifera","","no",NA,"","2021-05-20","2021-05-20 NA","Apis mellifera","Apis","mellifera","Apidae",4,139,2021,"Gorbea"
"327",327,"20/05/21","10:30:00","1",1,"Taraxacum sp.","Apis mellifera","","no",NA,"","2021-05-20","2021-05-20 NA","Apis mellifera","Apis","mellifera","Apidae",4,139,2021,"Gorbea"
"328",328,"20/05/21","10:30:00","1",1,"Bellis perennis","?=44","","no",NA,"","2021-05-20","2021-05-20 NA","Lucilia caesar","Lucilia","caesar","Calliphoridae",4,139,2021,"Gorbea"
"329",329,"20/05/21","10:30:00","1",1,"Vicia pyrenaica","Bombus pascuorum","","no",NA,"","2021-05-20","2021-05-20 NA","Bombus pascuorum","Bombus","pascuorum","Apidae",4,139,2021,"Gorbea"
"330",330,"20/05/21","10:30:00","1",1,"Taraxacum sp.","Apis mellifera","","no",NA,"","2021-05-20","2021-05-20 NA","Apis mellifera","Apis","mellifera","Apidae",4,139,2021,"Gorbea"
"331",331,"20/05/21","10:30:00","1",1,"Taraxacum sp.","Eristalis tenax","","no",NA,"","2021-05-20","2021-05-20 NA","Eristalis tenax","Eristalis","tenax","Syrphidae",4,139,2021,"Gorbea"
"332",332,"20/05/21","10:30:00","1",1,"Taraxacum sp.","Apis mellifera","","no",NA,"","2021-05-20","2021-05-20 NA","Apis mellifera","Apis","mellifera","Apidae",4,139,2021,"Gorbea"
"333",333,"20/05/21","10:30:00","1",1,"Vicia pyrenaica","Bombus pascuorum","","no",NA,"","2021-05-20","2021-05-20 NA","Bombus pascuorum","Bombus","pascuorum","Apidae",4,139,2021,"Gorbea"
"334",334,"20/05/21","10:30:00","1",1,"Bellis perennis","Eristalis tenax","","no",NA,"","2021-05-20","2021-05-20 NA","Eristalis tenax","Eristalis","tenax","Syrphidae",4,139,2021,"Gorbea"
"335",335,"20/05/21","10:30:00","1",1,"Erysimum gorbeanum","?=26","","no",NA,"","2021-05-20","2021-05-20 NA","Andrena bicolor","Andrena","bicolor","Andrenidae",4,139,2021,"Gorbea"
"336",336,"20/05/21","10:30:00","1",1,"Taraxacum sp.","Apis mellifera","","no",NA,"","2021-05-20","2021-05-20 NA","Apis mellifera","Apis","mellifera","Apidae",4,139,2021,"Gorbea"
"337",337,"20/05/21","10:30:00","1",1,"Taraxacum sp.","Eristalis sp.","","no",NA,"","2021-05-20","2021-05-20 NA","Eristalis sp.","Eristalis","sp.","Syrphidae",4,139,2021,"Gorbea"
"338",338,"20/05/21","10:30:00","1",1,"Taraxacum sp.","Apis mellifera","","no",NA,"","2021-05-20","2021-05-20 NA","Apis mellifera","Apis","mellifera","Apidae",4,139,2021,"Gorbea"
"339",339,"20/05/21","10:30:00","1",1,"Vicia pyrenaica","Bombus pascuorum","","no",NA,"","2021-05-20","2021-05-20 NA","Bombus pascuorum","Bombus","pascuorum","Apidae",4,139,2021,"Gorbea"
"340",340,"20/05/21","13:30:00","1",2,"Veronica sp.","?=C42","","",NA,"","2021-05-20","2021-05-20 NA","Bombylius sp","Bombylius","sp","Bombyliidae",4,139,2021,"Gorbea"
"341",341,"20/05/21","13:30:00","1",2,"Scilla verna","","","",46,"","2021-05-20","2021-05-20 46","Empis sp","Empis","sp","Empididae",4,139,2021,"Gorbea"
"342",342,"20/05/21","13:30:00","1",2,"Vicia pyrenaica","","","",51,"","2021-05-20","2021-05-20 51","Eucera nigrescens","Eucera","nigrescens","Apidae",4,139,2021,"Gorbea"
"343",343,"20/05/21","13:30:00","1",2,"Erysimum gorbeanum","Sphaerophoria scripta","hembra","no",NA,"","2021-05-20","2021-05-20 NA","Sphaerophoria scripta","Sphaerophoria","scripta","Syrphidae",4,139,2021,"Gorbea"
"344",344,"20/05/21","13:30:00","1",2,"Bellis perennis","Sphaerophoria scripta","hembra","no",NA,"","2021-05-20","2021-05-20 NA","Sphaerophoria scripta","Sphaerophoria","scripta","Syrphidae",4,139,2021,"Gorbea"
"345",345,"20/05/21","13:30:00","1",2,"Taraxacum sp.","Apis mellifera","","no",NA,"","2021-05-20","2021-05-20 NA","Apis mellifera","Apis","mellifera","Apidae",4,139,2021,"Gorbea"
"346",346,"20/05/21","13:30:00","1",2,"Bellis perennis","Sphaerophoria scripta","hembra","no",NA,"","2021-05-20","2021-05-20 NA","Sphaerophoria scripta","Sphaerophoria","scripta","Syrphidae",4,139,2021,"Gorbea"
"347",347,"20/05/21","13:30:00","1",2,"Bellis perennis","Sphaerophoria scripta","hembra","no",NA,"","2021-05-20","2021-05-20 NA","Sphaerophoria scripta","Sphaerophoria","scripta","Syrphidae",4,139,2021,"Gorbea"
"348",348,"20/05/21","13:30:00","1",2,"Scilla verna","?=C23","","no",NA,"","2021-05-20","2021-05-20 NA","Orthoptera","Orthoptera","","Orthoptera",4,139,2021,"Gorbea"
"349",349,"20/05/21","13:30:00","1",2,"Taraxacum sp.","Apis mellifera","","no",NA,"","2021-05-20","2021-05-20 NA","Apis mellifera","Apis","mellifera","Apidae",4,139,2021,"Gorbea"
"350",350,"20/05/21","13:30:00","1",2,"Taraxacum sp.","Apis mellifera","","no",NA,"","2021-05-20","2021-05-20 NA","Apis mellifera","Apis","mellifera","Apidae",4,139,2021,"Gorbea"
"351",351,"20/05/21","13:30:00","1",2,"Taraxacum sp.","Apis mellifera","","no",NA,"","2021-05-20","2021-05-20 NA","Apis mellifera","Apis","mellifera","Apidae",4,139,2021,"Gorbea"
"352",352,"20/05/21","13:30:00","1",2,"Taraxacum sp.","Apis mellifera","","no",NA,"","2021-05-20","2021-05-20 NA","Apis mellifera","Apis","mellifera","Apidae",4,139,2021,"Gorbea"
"353",353,"20/05/21","13:30:00","1",2,"Vicia pyrenaica","Bombus pascuorum","","no",NA,"","2021-05-20","2021-05-20 NA","Bombus pascuorum","Bombus","pascuorum","Apidae",4,139,2021,"Gorbea"
"354",354,"20/05/21","13:30:00","1",2,"Ranunculus repens","?=39","","no",NA,"","2021-05-20","2021-05-20 NA","Lasioglossum sp","Lasioglossum","sp","Halictidae",4,139,2021,"Gorbea"
"355",355,"20/05/21","13:30:00","1",2,"Vicia pyrenaica","Bombus pascuorum","","no",NA,"","2021-05-20","2021-05-20 NA","Bombus pascuorum","Bombus","pascuorum","Apidae",4,139,2021,"Gorbea"
"356",356,"20/05/21","13:30:00","1",2,"Bellis perennis","Sphaerophoria scripta","macho","no",NA,"","2021-05-20","2021-05-20 NA","Sphaerophoria scripta","Sphaerophoria","scripta","Syrphidae",4,139,2021,"Gorbea"
"357",357,"20/05/21","13:30:00","1",2,"Bellis perennis","","","",48,"","2021-05-20","2021-05-20 48","Lasioglossum immunitum","Lasioglossum","immunitum","Halictidae",4,139,2021,"Gorbea"
"358",358,"20/05/21","16:00:00","1",3,"Veronica sp.","Lasiommata maera","","no",NA,"","2021-05-20","2021-05-20 NA","Lasiommata maera","Lasiommata","maera","Lepidoptera",4,139,2021,"Gorbea"
"359",359,"20/05/21","16:00:00","1",3,"Vicia pyrenaica","Bombus pascuorum","","no",NA,"","2021-05-20","2021-05-20 NA","Bombus pascuorum","Bombus","pascuorum","Apidae",4,139,2021,"Gorbea"
"360",360,"20/05/21","16:00:00","1",3,"Vicia pyrenaica","?=30","","no",NA,"","2021-05-20","2021-05-20 NA","Anthophora plumipes","Anthophora","plumipes","Apidae",4,139,2021,"Gorbea"
"361",361,"20/05/21","16:00:00","1",3,"Vicia pyrenaica","","","si",49,"","2021-05-20","2021-05-20 49","Eucera sp","Eucera","sp","Apidae",4,139,2021,"Gorbea"
"362",362,"20/05/21","16:00:00","1",3,"Vicia pyrenaica","?=C42","","no",NA,"","2021-05-20","2021-05-20 NA","Bombylius sp","Bombylius","sp","Bombyliidae",4,139,2021,"Gorbea"
"363",363,"20/05/21","16:00:00","1",3,"Bellis perennis","","","si",50,"","2021-05-20","2021-05-20 50","Eupeodes corollae","Eupeodes","corollae","Syrphidae",4,139,2021,"Gorbea"
"364",364,"20/05/21","16:00:00","1",3,"Erinus alpinus","?=C42","","no",NA,"","2021-05-20","2021-05-20 NA","Bombylius sp","Bombylius","sp","Bombyliidae",4,139,2021,"Gorbea"
"365",365,"20/05/21","16:00:00","1",3,"Vicia pyrenaica","?=47","","no",NA,"","2021-05-20","2021-05-20 NA","Bombus lapidarius","Bombus","lapidarius","Apidae",4,139,2021,"Gorbea"
"366",366,"20/05/21","16:00:00","1",3,"Erysimum gorbeanum","Vanessa cardui","","no",NA,"","2021-05-20","2021-05-20 NA","Vanessa cardui","Vanessa","cardui","Lepidoptera",4,139,2021,"Gorbea"
"367",367,"20/05/21","16:00:00","1",3,"Vicia pyrenaica","Bombus pascuorum","","no",NA,"","2021-05-20","2021-05-20 NA","Bombus pascuorum","Bombus","pascuorum","Apidae",4,139,2021,"Gorbea"
"368",368,"20/05/21","16:00:00","1",3,"Vicia pyrenaica","?=30","","no",NA,"","2021-05-20","2021-05-20 NA","Anthophora plumipes","Anthophora","plumipes","Apidae",4,139,2021,"Gorbea"
"369",369,"20/05/21","16:00:00","1",3,"Erysimum gorbeanum","Macroglossum stellatarum","","no",NA,"","2021-05-20","2021-05-20 NA","Macroglossum stellatarum","Macroglossum","stellatarum","Lepidoptera",4,139,2021,"Gorbea"
"370",370,"25/05/21","13:30:00","5",2,"Potentilla erecta","","","si",51,"","2021-05-25","2021-05-25 51","Myolepta sp","Myolepta","sp","Syrphidae",4,144,2021,"Gorbea"
"371",371,"25/05/21","13:30:00","5",2,"Scilla verna","?=11","","no",NA,"","2021-05-25","2021-05-25 NA","Empis sp","Empis","sp","Empididae",4,144,2021,"Gorbea"
"372",372,"25/05/21","13:30:00","5",2,"Scilla verna","?=11","","no",NA,"","2021-05-25","2021-05-25 NA","Empis sp","Empis","sp","Empididae",4,144,2021,"Gorbea"
"373",373,"25/05/21","13:30:00","5",2,"Scilla verna","?=11","","no",NA,"","2021-05-25","2021-05-25 NA","Empis sp","Empis","sp","Empididae",4,144,2021,"Gorbea"
"374",374,"25/05/21","13:30:00","5",2,"Scorzonera humilis","?=51","","no",NA,"","2021-05-25","2021-05-25 NA","Myolepta sp","Myolepta","sp","Syrphidae",4,144,2021,"Gorbea"
"375",375,"25/05/21","13:30:00","5",2,"Potentilla erecta","?=52","","no",NA,"","2021-05-25","2021-05-25 NA","Eupeodes corollae","Eupeodes","corollae","Syrphidae",4,144,2021,"Gorbea"
"376",376,"25/05/21","13:30:00","5",2,"Scorzonera humilis","?=52","","no",NA,"","2021-05-25","2021-05-25 NA","Eupeodes corollae","Eupeodes","corollae","Syrphidae",4,144,2021,"Gorbea"
"377",377,"25/05/21","13:30:00","5",2,"Ranunculus repens","?=51","","no",NA,"","2021-05-25","2021-05-25 NA","Myolepta sp","Myolepta","sp","Syrphidae",4,144,2021,"Gorbea"
"378",378,"25/05/21","13:30:00","5",2,"Ranunculus repens","?=52","","no",NA,"","2021-05-25","2021-05-25 NA","Eupeodes corollae","Eupeodes","corollae","Syrphidae",4,144,2021,"Gorbea"
"379",379,"25/05/21","15:30:00","5",3,"Ranunculus repens","?=51","","no",NA,"","2021-05-25","2021-05-25 NA","Myolepta sp","Myolepta","sp","Syrphidae",4,144,2021,"Gorbea"
"380",380,"25/05/21","15:30:00","5",3,"Ranunculus repens","?=52","","no",NA,"","2021-05-25","2021-05-25 NA","Eupeodes corollae","Eupeodes","corollae","Syrphidae",4,144,2021,"Gorbea"
"381",381,"25/05/21","15:30:00","5",3,"Ranunculus repens","?=52","","no",NA,"","2021-05-25","2021-05-25 NA","Eupeodes corollae","Eupeodes","corollae","Syrphidae",4,144,2021,"Gorbea"
"382",382,"25/05/21","15:30:00","5",3,"Pedicularis sylvatica subsp. sylvatica","Bombus terrestris","","no",NA,"","2021-05-25","2021-05-25 NA","Bombus terrestris","Bombus","terrestris","Apidae",4,144,2021,"Gorbea"
"383",383,"25/05/21","15:30:00","5",3,"Ranunculus repens","?=52","","no",NA,"","2021-05-25","2021-05-25 NA","Eupeodes corollae","Eupeodes","corollae","Syrphidae",4,144,2021,"Gorbea"
"384",384,"26/05/21","10:45:00","3",1,"Ranunculus repens","Episyrphus balteatus","","no",NA,"","2021-05-26","2021-05-26 NA","Episyrphus balteatus","Episyrphus","balteatus","Syrphidae",5,145,2021,"Gorbea"
"385",385,"26/05/21","10:45:00","3",1,"Pedicularis sylvatica subsp. sylvatica","Bombus lapidarius","","no",NA,"","2021-05-26","2021-05-26 NA","Bombus lapidarius","Bombus","lapidarius","Apidae",5,145,2021,"Gorbea"
"386",386,"26/05/21","13:30:00","3",2,"Ranunculus repens","?=40","","no",NA,"","2021-05-26","2021-05-26 NA","Andrena minutuloides","Andrena","minutuloides","Andrenidae",5,145,2021,"Gorbea"
"387",387,"26/05/21","13:30:00","3",2,"Ranunculus repens","?=54","","no",NA,"","2021-05-26","2021-05-26 NA","Lasioglossum immunitum","Lasioglossum","immunitum","Halictidae",5,145,2021,"Gorbea"
"388",388,"26/05/21","13:30:00","3",2,"Bellis perennis","Sphaerophoria scripta","hembra","no",NA,"","2021-05-26","2021-05-26 NA","Sphaerophoria scripta","Sphaerophoria","scripta","Syrphidae",5,145,2021,"Gorbea"
"389",389,"26/05/21","13:30:00","3",2,"Potentilla erecta","?=40","","no",NA,"","2021-05-26","2021-05-26 NA","Andrena minutuloides","Andrena","minutuloides","Andrenidae",5,145,2021,"Gorbea"
"390",390,"26/05/21","13:30:00","3",2,"Potentilla montana","?=40","","no",NA,"","2021-05-26","2021-05-26 NA","Andrena minutuloides","Andrena","minutuloides","Andrenidae",5,145,2021,"Gorbea"
"391",391,"26/05/21","13:30:00","3",2,"Ranunculus repens","Sphaerophoria scripta","hembra","no",NA,"","2021-05-26","2021-05-26 NA","Sphaerophoria scripta","Sphaerophoria","scripta","Syrphidae",5,145,2021,"Gorbea"
"392",392,"26/05/21","13:30:00","3",2,"Ranunculus repens","?=54","","no",NA,"","2021-05-26","2021-05-26 NA","Lasioglossum immunitum","Lasioglossum","immunitum","Halictidae",5,145,2021,"Gorbea"
"393",393,"26/05/21","13:30:00","3",2,"Ranunculus repens","?=54","","no",NA,"","2021-05-26","2021-05-26 NA","Lasioglossum immunitum","Lasioglossum","immunitum","Halictidae",5,145,2021,"Gorbea"
"394",394,"26/05/21","13:30:00","3",2,"Bellis perennis","Sphaerophoria scripta","hembra","no",NA,"","2021-05-26","2021-05-26 NA","Sphaerophoria scripta","Sphaerophoria","scripta","Syrphidae",5,145,2021,"Gorbea"
"395",395,"26/05/21","13:30:00","3",2,"Bellis perennis","Sphaerophoria scripta","hembra","no",NA,"","2021-05-26","2021-05-26 NA","Sphaerophoria scripta","Sphaerophoria","scripta","Syrphidae",5,145,2021,"Gorbea"
"396",396,"26/05/21","13:30:00","3",2,"Ranunculus repens","?=54","","no",NA,"","2021-05-26","2021-05-26 NA","Lasioglossum immunitum","Lasioglossum","immunitum","Halictidae",5,145,2021,"Gorbea"
"397",397,"26/05/21","13:30:00","3",2,"Ranunculus repens","?=54","","no",NA,"","2021-05-26","2021-05-26 NA","Lasioglossum immunitum","Lasioglossum","immunitum","Halictidae",5,145,2021,"Gorbea"
"398",398,"26/05/21","13:30:00","3",2,"Ranunculus repens","?=40","","no",NA,"","2021-05-26","2021-05-26 NA","Andrena minutuloides","Andrena","minutuloides","Andrenidae",5,145,2021,"Gorbea"
"399",399,"26/05/21","13:30:00","3",2,"Ranunculus repens","","","si",53,"","2021-05-26","2021-05-26 53","Melanostoma scalare","Melanostoma","scalare","Syrphidae",5,145,2021,"Gorbea"
"400",400,"26/05/21","13:30:00","3",2,"Pedicularis sylvatica subsp. sylvatica","Bombus lapidarius","","no",NA,"","2021-05-26","2021-05-26 NA","Bombus lapidarius","Bombus","lapidarius","Apidae",5,145,2021,"Gorbea"
"401",401,"26/05/21","13:30:00","3",2,"Helianthemum nummularium","","","si",54,"","2021-05-26","2021-05-26 54","Lasioglossum immunitum","Lasioglossum","immunitum","Halictidae",5,145,2021,"Gorbea"
"402",402,"26/05/21","13:30:00","3",2,"Vicia pyrenaica","Bombus pascuorum","","no",NA,"","2021-05-26","2021-05-26 NA","Bombus pascuorum","Bombus","pascuorum","Apidae",5,145,2021,"Gorbea"
"403",403,"26/05/21","13:30:00","3",2,"Bellis perennis","","","si",55,"no mesmo tarro","2021-05-26","2021-05-26 55","Lucilia caesar","Lucilia","caesar","Calliphoridae",5,145,2021,"Gorbea"
"404",404,"26/05/21","13:30:00","3",2,"Bellis perennis","Sphaerophoria scripta","macho","no",NA,"","2021-05-26","2021-05-26 NA","Sphaerophoria scripta","Sphaerophoria","scripta","Syrphidae",5,145,2021,"Gorbea"
"405",405,"26/05/21","16:00:00","3",3,"Ranunculus repens","?=91","","no",NA,"","2021-05-26","2021-05-26 NA","Chrysolina sp","Chrysolina","sp","Chrysomelidae",5,145,2021,"Gorbea"
"406",406,"26/05/21","16:00:00","3",3,"Ranunculus repens","?=40","","no",NA,"","2021-05-26","2021-05-26 NA","Andrena minutuloides","Andrena","minutuloides","Andrenidae",5,145,2021,"Gorbea"
"407",407,"26/05/21","16:00:00","3",3,"Ranunculus repens","?=54","","no",NA,"","2021-05-26","2021-05-26 NA","Lasioglossum immunitum","Lasioglossum","immunitum","Halictidae",5,145,2021,"Gorbea"
"408",408,"26/05/21","16:00:00","3",3,"Pilosella officinarum","?=54","","no",NA,"","2021-05-26","2021-05-26 NA","Lasioglossum immunitum","Lasioglossum","immunitum","Halictidae",5,145,2021,"Gorbea"
"409",409,"26/05/21","16:00:00","3",3,"Hypocrepis comosa","Apis mellifera","","no",NA,"","2021-05-26","2021-05-26 NA","Apis mellifera","Apis","mellifera","Apidae",5,145,2021,"Gorbea"
"410",410,"26/05/21","16:00:00","3",3,"Lotus corniculatus","?=54","","no",NA,"","2021-05-26","2021-05-26 NA","Lasioglossum immunitum","Lasioglossum","immunitum","Halictidae",5,145,2021,"Gorbea"
"411",411,"26/05/21","16:00:00","3",3,"Ranunculus repens","?=40","","no",NA,"","2021-05-26","2021-05-26 NA","Andrena minutuloides","Andrena","minutuloides","Andrenidae",5,145,2021,"Gorbea"
"412",412,"26/05/21","16:00:00","3",3,"Ranunculus repens","?=40","","no",NA,"","2021-05-26","2021-05-26 NA","Andrena minutuloides","Andrena","minutuloides","Andrenidae",5,145,2021,"Gorbea"
"413",413,"26/05/21","16:00:00","3",3,"Bellis perennis","?=54","","no",NA,"","2021-05-26","2021-05-26 NA","Lasioglossum immunitum","Lasioglossum","immunitum","Halictidae",5,145,2021,"Gorbea"
"414",414,"26/05/21","16:00:00","3",3,"Bellis perennis","","","si",58,"","2021-05-26","2021-05-26 58","Eupeodes corollae","Eupeodes","corollae","Syrphidae",5,145,2021,"Gorbea"
"415",415,"26/05/21","16:00:00","3",3,"Ranunculus repens","?=54","","no",NA,"","2021-05-26","2021-05-26 NA","Lasioglossum immunitum","Lasioglossum","immunitum","Halictidae",5,145,2021,"Gorbea"
"416",416,"26/05/21","16:00:00","3",3,"Potentilla erecta","?=54","","no",NA,"","2021-05-26","2021-05-26 NA","Lasioglossum immunitum","Lasioglossum","immunitum","Halictidae",5,145,2021,"Gorbea"
"417",417,"26/05/21","16:00:00","3",3,"Potentilla erecta","Sphaerophoria scripta","macho","no",NA,"","2021-05-26","2021-05-26 NA","Sphaerophoria scripta","Sphaerophoria","scripta","Syrphidae",5,145,2021,"Gorbea"
"418",418,"26/05/21","16:00:00","3",3,"Ranunculus repens","?=54","","no",NA,"","2021-05-26","2021-05-26 NA","Lasioglossum immunitum","Lasioglossum","immunitum","Halictidae",5,145,2021,"Gorbea"
"419",419,"26/05/21","16:00:00","3",3,"Ranunculus repens","?=54","","no",NA,"","2021-05-26","2021-05-26 NA","Lasioglossum immunitum","Lasioglossum","immunitum","Halictidae",5,145,2021,"Gorbea"
"420",420,"26/05/21","16:00:00","3",3,"Ranunculus repens","?=54","","no",NA,"","2021-05-26","2021-05-26 NA","Lasioglossum immunitum","Lasioglossum","immunitum","Halictidae",5,145,2021,"Gorbea"
"421",421,"26/05/21","16:00:00","3",3,"Bellis perennis","Sphaerophoria scripta","hembra","no",NA,"","2021-05-26","2021-05-26 NA","Sphaerophoria scripta","Sphaerophoria","scripta","Syrphidae",5,145,2021,"Gorbea"
"422",422,"26/05/21","16:00:00","3",3,"Lathyrus linifolius","Bombus lapidarius","","no",NA,"","2021-05-26","2021-05-26 NA","Bombus lapidarius","Bombus","lapidarius","Apidae",5,145,2021,"Gorbea"
"423",423,"26/05/21","16:00:00","3",3,"Thymus praecox subsp. polytrichus","?=54","","no",NA,"","2021-05-26","2021-05-26 NA","Lasioglossum immunitum","Lasioglossum","immunitum","Halictidae",5,145,2021,"Gorbea"
"424",424,"26/05/21","16:00:00","3",3,"Ranunculus repens","?=54","","no",NA,"","2021-05-26","2021-05-26 NA","Lasioglossum immunitum","Lasioglossum","immunitum","Halictidae",5,145,2021,"Gorbea"
"425",425,"26/05/21","16:00:00","3",3,"Bellis perennis","?=55","","no",NA,"","2021-05-26","2021-05-26 NA","Lucilia caesar","Lucilia","caesar","Calliphoridae",5,145,2021,"Gorbea"
"426",426,"27/05/21","10:30:00","4",1,"Ranunculus repens","?=48","","no",NA,"","2021-05-27","2021-05-27 NA","Lasioglossum immunitum","Lasioglossum","immunitum","Halictidae",3,146,2021,"Gorbea"
"427",427,"27/05/21","10:30:00","4",1,"Taraxacum sp.","?=48","","no",NA,"","2021-05-27","2021-05-27 NA","Lasioglossum immunitum","Lasioglossum","immunitum","Halictidae",3,146,2021,"Gorbea"
"428",428,"27/05/21","10:30:00","4",1,"Polygala vulgaris","Macroglossum stellatarum","","no",NA,"","2021-05-27","2021-05-27 NA","Macroglossum stellatarum","Macroglossum","stellatarum","Lepidoptera",3,146,2021,"Gorbea"
"429",429,"27/05/21","10:30:00","4",1,"Veronica officinalis","?=48","","no",NA,"","2021-05-27","2021-05-27 NA","Lasioglossum immunitum","Lasioglossum","immunitum","Halictidae",3,146,2021,"Gorbea"
"430",430,"27/05/21","10:30:00","4",1,"Veronica officinalis","Eupeodes sp.","","no",NA,"","2021-05-27","2021-05-27 NA","Eupeodes sp.","Eupeodes","sp.","Syrphidae",3,146,2021,"Gorbea"
"431",431,"27/05/21","10:30:00","4",1,"Veronica officinalis","Eupeodes sp.","","no",NA,"","2021-05-27","2021-05-27 NA","Eupeodes sp.","Eupeodes","sp.","Syrphidae",3,146,2021,"Gorbea"
"432",432,"27/05/21","10:30:00","4",1,"Bellis perennis","Sphaerophoria scripta","hembra","no",NA,"","2021-05-27","2021-05-27 NA","Sphaerophoria scripta","Sphaerophoria","scripta","Syrphidae",3,146,2021,"Gorbea"
"433",433,"27/05/21","10:30:00","4",1,"Ranunculus repens","?=C23","","no",NA,"","2021-05-27","2021-05-27 NA","Orthoptera","Orthoptera","","Orthoptera",3,146,2021,"Gorbea"
"434",434,"27/05/21","10:30:00","4",1,"Ranunculus repens","Oedemera nobilis","hembra","no",NA,"","2021-05-27","2021-05-27 NA","Oedemera nobilis","Oedemera","nobilis","Oedemeridae",3,146,2021,"Gorbea"
"435",435,"27/05/21","10:30:00","4",1,"Ranunculus repens","?=59","","no",NA,"","2021-05-27","2021-05-27 NA","Diptera","Diptera","","Diptera",3,146,2021,"Gorbea"
"436",436,"27/05/21","10:30:00","4",1,"Ranunculus repens","?=59","","no",NA,"","2021-05-27","2021-05-27 NA","Diptera","Diptera","","Diptera",3,146,2021,"Gorbea"
"437",437,"27/05/21","10:30:00","4",1,"Ranunculus repens","","","si",60,"","2021-05-27","2021-05-27 60","Andrena nitida","Andrena","nitida","Andrenidae",3,146,2021,"Gorbea"
"438",438,"27/05/21","10:30:00","4",1,"Ranunculus repens","?=59","","no",NA,"","2021-05-27","2021-05-27 NA","Diptera","Diptera","","Diptera",3,146,2021,"Gorbea"
"439",439,"27/05/21","13:15:00","4",2,"Potentilla erecta","","","si",61,"","2021-05-27","2021-05-27 61","Lasioglossum punctatissimum","Lasioglossum","punctatissimum","Halictidae",3,146,2021,"Gorbea"
"440",440,"27/05/21","13:15:00","4",2,"Bellis perennis","Eupeodes sp.","","no",NA,"","2021-05-27","2021-05-27 NA","Eupeodes sp.","Eupeodes","sp.","Syrphidae",3,146,2021,"Gorbea"
"441",441,"27/05/21","13:15:00","4",2,"Potentilla erecta","?=61","","no",NA,"","2021-05-27","2021-05-27 NA","Lasioglossum punctatissimum","Lasioglossum","punctatissimum","Halictidae",3,146,2021,"Gorbea"
"442",442,"27/05/21","13:15:00","4",2,"Potentilla erecta","?=61","","no",NA,"","2021-05-27","2021-05-27 NA","Lasioglossum punctatissimum","Lasioglossum","punctatissimum","Halictidae",3,146,2021,"Gorbea"
"443",443,"27/05/21","13:15:00","4",2,"Bellis perennis","Sphaerophoria scripta","macho","no",NA,"","2021-05-27","2021-05-27 NA","Sphaerophoria scripta","Sphaerophoria","scripta","Syrphidae",3,146,2021,"Gorbea"
"444",444,"27/05/21","13:15:00","4",2,"Potentilla erecta","Sphaerophoria scripta","macho","no",NA,"","2021-05-27","2021-05-27 NA","Sphaerophoria scripta","Sphaerophoria","scripta","Syrphidae",3,146,2021,"Gorbea"
"445",445,"27/05/21","13:15:00","4",2,"Polygala vulgaris","Pyrgus sp.","","no",NA,"","2021-05-27","2021-05-27 NA","Pyrgus sp.","Pyrgus","sp.","Lepidoptera",3,146,2021,"Gorbea"
"446",446,"27/05/21","13:15:00","4",2,"Ranunculus repens","Sphaerophoria scripta","macho","no",NA,"","2021-05-27","2021-05-27 NA","Sphaerophoria scripta","Sphaerophoria","scripta","Syrphidae",3,146,2021,"Gorbea"
"447",447,"27/05/21","13:15:00","4",2,"Bellis perennis","Sphaerophoria scripta","macho","no",NA,"","2021-05-27","2021-05-27 NA","Sphaerophoria scripta","Sphaerophoria","scripta","Syrphidae",3,146,2021,"Gorbea"
"448",448,"27/05/21","13:15:00","4",2,"Potentilla erecta","?=62","","no",NA,"","2021-05-27","2021-05-27 NA","Formicidae","Formicidae","","Formicidae",3,146,2021,"Gorbea"
"449",449,"27/05/21","13:15:00","4",2,"Potentilla erecta","?=62","","no",NA,"","2021-05-27","2021-05-27 NA","Formicidae","Formicidae","","Formicidae",3,146,2021,"Gorbea"
"450",450,"27/05/21","13:15:00","4",2,"Potentilla erecta","?=62","","no",NA,"","2021-05-27","2021-05-27 NA","Formicidae","Formicidae","","Formicidae",3,146,2021,"Gorbea"
"451",451,"27/05/21","13:15:00","4",2,"Polygala vulgaris","","","si",63,"","2021-05-27","2021-05-27 63","Bombus sylvestris","Bombus","sylvestris","Apidae",3,146,2021,"Gorbea"
"452",452,"27/05/21","16:00:00","4",3,"Bellis perennis","Sphaerophoria scripta","macho","no",NA,"","2021-05-27","2021-05-27 NA","Sphaerophoria scripta","Sphaerophoria","scripta","Syrphidae",3,146,2021,"Gorbea"
"453",453,"27/05/21","16:00:00","4",3,"Bellis perennis","Sphaerophoria scripta","macho","no",NA,"","2021-05-27","2021-05-27 NA","Sphaerophoria scripta","Sphaerophoria","scripta","Syrphidae",3,146,2021,"Gorbea"
"454",454,"27/05/21","16:00:00","4",3,"Polygala vulgaris","","","si",64,"","2021-05-27","2021-05-27 64","Melanostoma scalare","Melanostoma","scalare","Syrphidae",3,146,2021,"Gorbea"
"455",455,"27/05/21","16:00:00","4",3,"Ranunculus repens","","","si",65,"","2021-05-27","2021-05-27 65","Eupeodes corollae","Eupeodes","corollae","Syrphidae",3,146,2021,"Gorbea"
"456",456,"27/05/21","16:00:00","4",3,"Potentilla erecta","?=62","","no",NA,"","2021-05-27","2021-05-27 NA","Formicidae","Formicidae","","Formicidae",3,146,2021,"Gorbea"
"457",457,"27/05/21","16:00:00","4",3,"Ranunculus repens","Sphaerophoria scripta","macho","no",NA,"","2021-05-27","2021-05-27 NA","Sphaerophoria scripta","Sphaerophoria","scripta","Syrphidae",3,146,2021,"Gorbea"
"458",458,"28/05/21","10:50:00","5",1,"Taraxacum sp.","?=48","","no",NA,"","2021-05-28","2021-05-28 NA","Lasioglossum immunitum","Lasioglossum","immunitum","Halictidae",5,147,2021,"Gorbea"
"459",459,"28/05/21","10:50:00","5",1,"Taraxacum sp.","?=48","","no",NA,"","2021-05-28","2021-05-28 NA","Lasioglossum immunitum","Lasioglossum","immunitum","Halictidae",5,147,2021,"Gorbea"
"460",460,"28/05/21","10:50:00","5",1,"Bellis perennis","Sphaerophoria scripta","hembra","no",NA,"","2021-05-28","2021-05-28 NA","Sphaerophoria scripta","Sphaerophoria","scripta","Syrphidae",5,147,2021,"Gorbea"
"461",461,"28/05/21","10:50:00","5",1,"Bellis perennis","?=C56","","no",NA,"","2021-05-28","2021-05-28 NA","Lucilia caesar","Lucilia","caesar","Calliphoridae",5,147,2021,"Gorbea"
"462",462,"28/05/21","13:30:00","5",2,"Bellis perennis","Sphaerophoria scripta","macho","no",NA,"","2021-05-28","2021-05-28 NA","Sphaerophoria scripta","Sphaerophoria","scripta","Syrphidae",5,147,2021,"Gorbea"
"463",463,"28/05/21","13:30:00","5",2,"Bellis perennis","Sphaerophoria scripta","macho","no",NA,"","2021-05-28","2021-05-28 NA","Sphaerophoria scripta","Sphaerophoria","scripta","Syrphidae",5,147,2021,"Gorbea"
"464",464,"28/05/21","13:30:00","5",2,"Bellis perennis","Sphaerophoria scripta","macho","no",NA,"","2021-05-28","2021-05-28 NA","Sphaerophoria scripta","Sphaerophoria","scripta","Syrphidae",5,147,2021,"Gorbea"
"465",465,"28/05/21","13:30:00","5",2,"Bellis perennis","?=C56","","no",NA,"","2021-05-28","2021-05-28 NA","Lucilia caesar","Lucilia","caesar","Calliphoridae",5,147,2021,"Gorbea"
"466",466,"28/05/21","13:30:00","5",2,"Bellis perennis","Sphaerophoria scripta","hembra","no",NA,"","2021-05-28","2021-05-28 NA","Sphaerophoria scripta","Sphaerophoria","scripta","Syrphidae",5,147,2021,"Gorbea"
"467",467,"28/05/21","13:30:00","5",2,"Bellis perennis","Sphaerophoria scripta","hembra","no",NA,"","2021-05-28","2021-05-28 NA","Sphaerophoria scripta","Sphaerophoria","scripta","Syrphidae",5,147,2021,"Gorbea"
"468",468,"28/05/21","13:30:00","5",2,"Bellis perennis","Sphaerophoria scripta","hembra","no",NA,"","2021-05-28","2021-05-28 NA","Sphaerophoria scripta","Sphaerophoria","scripta","Syrphidae",5,147,2021,"Gorbea"
"469",469,"28/05/21","13:30:00","5",2,"Myosotis lamottiana","Sphaerophoria scripta","macho","no",NA,"","2021-05-28","2021-05-28 NA","Sphaerophoria scripta","Sphaerophoria","scripta","Syrphidae",5,147,2021,"Gorbea"
"470",470,"28/05/21","13:30:00","5",2,"Bellis perennis","?=C56","","no",NA,"","2021-05-28","2021-05-28 NA","Lucilia caesar","Lucilia","caesar","Calliphoridae",5,147,2021,"Gorbea"
"471",471,"28/05/21","13:30:00","5",2,"Ranunculus repens","Eupeodes sp.","","",NA,"","2021-05-28","2021-05-28 NA","Eupeodes sp.","Eupeodes","sp.","Syrphidae",5,147,2021,"Gorbea"
"472",472,"28/05/21","13:30:00","5",2,"Bellis perennis","Sphaerophoria scripta","hembra","no",NA,"","2021-05-28","2021-05-28 NA","Sphaerophoria scripta","Sphaerophoria","scripta","Syrphidae",5,147,2021,"Gorbea"
"473",473,"28/05/21","13:30:00","5",2,"Bellis perennis","Sphaerophoria scripta","macho","no",NA,"","2021-05-28","2021-05-28 NA","Sphaerophoria scripta","Sphaerophoria","scripta","Syrphidae",5,147,2021,"Gorbea"
"474",474,"28/05/21","13:30:00","5",2,"Bellis perennis","?=C56","","no",NA,"","2021-05-28","2021-05-28 NA","Lucilia caesar","Lucilia","caesar","Calliphoridae",5,147,2021,"Gorbea"
"475",475,"28/05/21","13:30:00","5",2,"Taraxacum sp.","?=48","","no",NA,"","2021-05-28","2021-05-28 NA","Lasioglossum immunitum","Lasioglossum","immunitum","Halictidae",5,147,2021,"Gorbea"
"476",476,"28/05/21","13:30:00","5",2,"Taraxacum sp.","","","si",67,"","2021-05-28","2021-05-28 67","Sphegina sp","Sphegina","sp","Syrphidae",5,147,2021,"Gorbea"
"477",477,"28/05/21","13:30:00","5",2,"Bellis perennis","?=C56","","no",NA,"","2021-05-28","2021-05-28 NA","Lucilia caesar","Lucilia","caesar","Calliphoridae",5,147,2021,"Gorbea"
"478",478,"28/05/21","13:30:00","5",2,"Bellis perennis","Sphaerophoria scripta","macho","no",NA,"","2021-05-28","2021-05-28 NA","Sphaerophoria scripta","Sphaerophoria","scripta","Syrphidae",5,147,2021,"Gorbea"
"479",479,"28/05/21","13:30:00","5",2,"Bellis perennis","","","si",68,"","2021-05-28","2021-05-28 68","Eupeodes corollae","Eupeodes","corollae","Syrphidae",5,147,2021,"Gorbea"
"480",480,"28/05/21","13:30:00","5",2,"Bellis perennis","?=68","","no",NA,"","2021-05-28","2021-05-28 NA","Eupeodes corollae","Eupeodes","corollae","Syrphidae",5,147,2021,"Gorbea"
"481",481,"28/05/21","13:30:00","5",2,"Bellis perennis","?=C56","","no",NA,"","2021-05-28","2021-05-28 NA","Lucilia caesar","Lucilia","caesar","Calliphoridae",5,147,2021,"Gorbea"
"482",482,"28/05/21","13:30:00","5",2,"Taraxacum sp.","?=48","","no",NA,"","2021-05-28","2021-05-28 NA","Lasioglossum immunitum","Lasioglossum","immunitum","Halictidae",5,147,2021,"Gorbea"
"483",483,"28/05/21","13:30:00","5",2,"Bellis perennis","Episyrphus balteatus","","no",NA,"","2021-05-28","2021-05-28 NA","Episyrphus balteatus","Episyrphus","balteatus","Syrphidae",5,147,2021,"Gorbea"
"484",484,"28/05/21","16:00:00","5",3,"Ranunculus repens","","","si",69,"el transecto 3 solo duró 20 min, comenzó a llover a cachón","2021-05-28","2021-05-28 69","Pyrrhocoris sp","Pyrrhocoris","sp","Pyrrhocoridae",5,147,2021,"Gorbea"
"485",485,"28/05/21","16:00:00","5",3,"Bellis perennis","?=C56","","no",NA,"","2021-05-28","2021-05-28 NA","Lucilia caesar","Lucilia","caesar","Calliphoridae",5,147,2021,"Gorbea"
"486",486,"28/05/21","16:00:00","5",3,"Bellis perennis","Sphaerophoria scripta","hembra","no",NA,"","2021-05-28","2021-05-28 NA","Sphaerophoria scripta","Sphaerophoria","scripta","Syrphidae",5,147,2021,"Gorbea"
"487",487,"28/05/21","16:00:00","5",3,"Bellis perennis","Sphaerophoria scripta","macho","no",NA,"","2021-05-28","2021-05-28 NA","Sphaerophoria scripta","Sphaerophoria","scripta","Syrphidae",5,147,2021,"Gorbea"
"488",488,"31/05/21","10:30:00","1",1,"Bellis perennis","Sphaerophoria scripta","macho","no",NA,"","2021-05-31","2021-05-31 NA","Sphaerophoria scripta","Sphaerophoria","scripta","Syrphidae",5,150,2021,"Gorbea"
"489",489,"31/05/21","10:30:00","1",1,"Bellis perennis","Sphaerophoria scripta","macho","no",NA,"","2021-05-31","2021-05-31 NA","Sphaerophoria scripta","Sphaerophoria","scripta","Syrphidae",5,150,2021,"Gorbea"
"490",490,"31/05/21","10:30:00","1",1,"Bellis perennis","Sphaerophoria scripta","macho","no",NA,"","2021-05-31","2021-05-31 NA","Sphaerophoria scripta","Sphaerophoria","scripta","Syrphidae",5,150,2021,"Gorbea"
"491",491,"31/05/21","10:30:00","1",1,"Bellis perennis","Sphaerophoria scripta","macho","no",NA,"","2021-05-31","2021-05-31 NA","Sphaerophoria scripta","Sphaerophoria","scripta","Syrphidae",5,150,2021,"Gorbea"
"492",492,"31/05/21","10:30:00","1",1,"Bellis perennis","Sphaerophoria scripta","macho","no",NA,"","2021-05-31","2021-05-31 NA","Sphaerophoria scripta","Sphaerophoria","scripta","Syrphidae",5,150,2021,"Gorbea"
"493",493,"31/05/21","10:30:00","1",1,"Bellis perennis","Sphaerophoria scripta","macho","no",NA,"","2021-05-31","2021-05-31 NA","Sphaerophoria scripta","Sphaerophoria","scripta","Syrphidae",5,150,2021,"Gorbea"
"494",494,"31/05/21","10:30:00","1",1,"Bellis perennis","Sphaerophoria scripta","macho","no",NA,"","2021-05-31","2021-05-31 NA","Sphaerophoria scripta","Sphaerophoria","scripta","Syrphidae",5,150,2021,"Gorbea"
"495",495,"31/05/21","10:30:00","1",1,"Bellis perennis","Sphaerophoria scripta","macho","no",NA,"","2021-05-31","2021-05-31 NA","Sphaerophoria scripta","Sphaerophoria","scripta","Syrphidae",5,150,2021,"Gorbea"
"496",496,"31/05/21","10:30:00","1",1,"Bellis perennis","Sphaerophoria scripta","macho","no",NA,"","2021-05-31","2021-05-31 NA","Sphaerophoria scripta","Sphaerophoria","scripta","Syrphidae",5,150,2021,"Gorbea"
"497",497,"31/05/21","10:30:00","1",1,"Bellis perennis","Sphaerophoria scripta","macho","no",NA,"","2021-05-31","2021-05-31 NA","Sphaerophoria scripta","Sphaerophoria","scripta","Syrphidae",5,150,2021,"Gorbea"
"498",498,"31/05/21","10:30:00","1",1,"Bellis perennis","Sphaerophoria scripta","macho","no",NA,"","2021-05-31","2021-05-31 NA","Sphaerophoria scripta","Sphaerophoria","scripta","Syrphidae",5,150,2021,"Gorbea"
"499",499,"31/05/21","10:30:00","1",1,"Bellis perennis","Sphaerophoria scripta","macho","no",NA,"","2021-05-31","2021-05-31 NA","Sphaerophoria scripta","Sphaerophoria","scripta","Syrphidae",5,150,2021,"Gorbea"
"500",500,"31/05/21","10:30:00","1",1,"Bellis perennis","Sphaerophoria scripta","macho","no",NA,"","2021-05-31","2021-05-31 NA","Sphaerophoria scripta","Sphaerophoria","scripta","Syrphidae",5,150,2021,"Gorbea"
"501",501,"31/05/21","10:30:00","1",1,"Bellis perennis","Sphaerophoria scripta","macho","no",NA,"","2021-05-31","2021-05-31 NA","Sphaerophoria scripta","Sphaerophoria","scripta","Syrphidae",5,150,2021,"Gorbea"
"502",502,"31/05/21","10:30:00","1",1,"Bellis perennis","Sphaerophoria scripta","macho","no",NA,"","2021-05-31","2021-05-31 NA","Sphaerophoria scripta","Sphaerophoria","scripta","Syrphidae",5,150,2021,"Gorbea"
"503",503,"31/05/21","10:30:00","1",1,"Bellis perennis","Eupeodes sp.","","no",NA,"","2021-05-31","2021-05-31 NA","Eupeodes sp.","Eupeodes","sp.","Syrphidae",5,150,2021,"Gorbea"
"504",504,"31/05/21","10:30:00","1",1,"Taraxacum sp.","?=48","","no",NA,"","2021-05-31","2021-05-31 NA","Lasioglossum immunitum","Lasioglossum","immunitum","Halictidae",5,150,2021,"Gorbea"
"505",505,"31/05/21","10:30:00","1",1,"Bellis perennis","Sphaerophoria scripta","hembra","no",NA,"","2021-05-31","2021-05-31 NA","Sphaerophoria scripta","Sphaerophoria","scripta","Syrphidae",5,150,2021,"Gorbea"
"506",506,"31/05/21","10:30:00","1",1,"Bellis perennis","Sphaerophoria scripta","hembra","no",NA,"","2021-05-31","2021-05-31 NA","Sphaerophoria scripta","Sphaerophoria","scripta","Syrphidae",5,150,2021,"Gorbea"
"507",507,"31/05/21","10:30:00","1",1,"Bellis perennis","Sphaerophoria scripta","hembra","no",NA,"","2021-05-31","2021-05-31 NA","Sphaerophoria scripta","Sphaerophoria","scripta","Syrphidae",5,150,2021,"Gorbea"
"508",508,"31/05/21","10:30:00","1",1,"Bellis perennis","Sphaerophoria scripta","hembra","no",NA,"","2021-05-31","2021-05-31 NA","Sphaerophoria scripta","Sphaerophoria","scripta","Syrphidae",5,150,2021,"Gorbea"
"509",509,"31/05/21","10:30:00","1",1,"Bellis perennis","Sphaerophoria scripta","hembra","no",NA,"","2021-05-31","2021-05-31 NA","Sphaerophoria scripta","Sphaerophoria","scripta","Syrphidae",5,150,2021,"Gorbea"
"510",510,"31/05/21","10:30:00","1",1,"Bellis perennis","Sphaerophoria scripta","hembra","no",NA,"","2021-05-31","2021-05-31 NA","Sphaerophoria scripta","Sphaerophoria","scripta","Syrphidae",5,150,2021,"Gorbea"
"511",511,"31/05/21","10:30:00","1",1,"Bellis perennis","Sphaerophoria scripta","hembra","no",NA,"","2021-05-31","2021-05-31 NA","Sphaerophoria scripta","Sphaerophoria","scripta","Syrphidae",5,150,2021,"Gorbea"
"512",512,"31/05/21","10:30:00","1",1,"Taraxacum sp.","Eristalis tenax","","no",NA,"","2021-05-31","2021-05-31 NA","Eristalis tenax","Eristalis","tenax","Syrphidae",5,150,2021,"Gorbea"
"513",513,"31/05/21","10:30:00","1",1,"Taraxacum sp.","Sphaerophoria scripta","macho","no",NA,"","2021-05-31","2021-05-31 NA","Sphaerophoria scripta","Sphaerophoria","scripta","Syrphidae",5,150,2021,"Gorbea"
"514",514,"31/05/21","10:30:00","1",1,"Taraxacum sp.","Sphaerophoria scripta","macho","no",NA,"","2021-05-31","2021-05-31 NA","Sphaerophoria scripta","Sphaerophoria","scripta","Syrphidae",5,150,2021,"Gorbea"
"515",515,"31/05/21","10:30:00","1",1,"Taraxacum sp.","Sphaerophoria scripta","macho","no",NA,"","2021-05-31","2021-05-31 NA","Sphaerophoria scripta","Sphaerophoria","scripta","Syrphidae",5,150,2021,"Gorbea"
"516",516,"31/05/21","10:30:00","1",1,"Taraxacum sp.","Apis mellifera","","no",NA,"","2021-05-31","2021-05-31 NA","Apis mellifera","Apis","mellifera","Apidae",5,150,2021,"Gorbea"
"517",517,"31/05/21","10:30:00","1",1,"Taraxacum sp.","Apis mellifera","","no",NA,"","2021-05-31","2021-05-31 NA","Apis mellifera","Apis","mellifera","Apidae",5,150,2021,"Gorbea"
"518",518,"31/05/21","10:30:00","1",1,"Vicia pyrenaica","","","si",70,"","2021-05-31","2021-05-31 70","Eucera nigrescens","Eucera","nigrescens","Apidae",5,150,2021,"Gorbea"
"519",519,"31/05/21","10:30:00","1",1,"Vicia pyrenaica","?=70","","no",NA,"","2021-05-31","2021-05-31 NA","Eucera nigrescens","Eucera","nigrescens","Apidae",5,150,2021,"Gorbea"
"520",520,"31/05/21","10:30:00","1",1,"Vicia pyrenaica","?=70","","no",NA,"","2021-05-31","2021-05-31 NA","Eucera nigrescens","Eucera","nigrescens","Apidae",5,150,2021,"Gorbea"
"521",521,"31/05/21","10:30:00","1",1,"Ranunculus repens","","","si",71,"","2021-05-31","2021-05-31 71","Melanostoma scalare","Melanostoma","scalare","Syrphidae",5,150,2021,"Gorbea"
"522",522,"31/05/21","10:30:00","1",1,"Vicia pyrenaica","?=70","","no",NA,"","2021-05-31","2021-05-31 NA","Eucera nigrescens","Eucera","nigrescens","Apidae",5,150,2021,"Gorbea"
"523",523,"31/05/21","10:30:00","1",1,"Vicia pyrenaica","?=70","","no",NA,"","2021-05-31","2021-05-31 NA","Eucera nigrescens","Eucera","nigrescens","Apidae",5,150,2021,"Gorbea"
"524",524,"31/05/21","10:30:00","1",1,"Vicia pyrenaica","","","si",72,"","2021-05-31","2021-05-31 72","Bombus pascuorum","Bombus","pascuorum","Apidae",5,150,2021,"Gorbea"
"525",525,"31/05/21","10:30:00","1",1,"Vicia pyrenaica","?=70","","no",NA,"","2021-05-31","2021-05-31 NA","Eucera nigrescens","Eucera","nigrescens","Apidae",5,150,2021,"Gorbea"
"526",526,"31/05/21","13:30:00","1",2,"Vicia pyrenaica","Macroglossum stellatarum","","no",NA,"","2021-05-31","2021-05-31 NA","Macroglossum stellatarum","Macroglossum","stellatarum","Lepidoptera",5,150,2021,"Gorbea"
"527",527,"31/05/21","13:30:00","1",2,"Bellis perennis","Macroglossum stellatarum","","no",NA,"","2021-05-31","2021-05-31 NA","Macroglossum stellatarum","Macroglossum","stellatarum","Lepidoptera",5,150,2021,"Gorbea"
"528",528,"31/05/21","13:30:00","1",2,"Bellis perennis","Sphaerophoria scripta","hembra","no",NA,"","2021-05-31","2021-05-31 NA","Sphaerophoria scripta","Sphaerophoria","scripta","Syrphidae",5,150,2021,"Gorbea"
"529",529,"31/05/21","13:30:00","1",2,"Bellis perennis","Sphaerophoria scripta","hembra","no",NA,"","2021-05-31","2021-05-31 NA","Sphaerophoria scripta","Sphaerophoria","scripta","Syrphidae",5,150,2021,"Gorbea"
"530",530,"31/05/21","13:30:00","1",2,"Bellis perennis","Sphaerophoria scripta","hembra","no",NA,"","2021-05-31","2021-05-31 NA","Sphaerophoria scripta","Sphaerophoria","scripta","Syrphidae",5,150,2021,"Gorbea"
"531",531,"31/05/21","13:30:00","1",2,"Bellis perennis","Sphaerophoria scripta","hembra","no",NA,"","2021-05-31","2021-05-31 NA","Sphaerophoria scripta","Sphaerophoria","scripta","Syrphidae",5,150,2021,"Gorbea"
"532",532,"31/05/21","13:30:00","1",2,"Bellis perennis","Sphaerophoria scripta","hembra","no",NA,"","2021-05-31","2021-05-31 NA","Sphaerophoria scripta","Sphaerophoria","scripta","Syrphidae",5,150,2021,"Gorbea"
"533",533,"31/05/21","13:30:00","1",2,"Bellis perennis","Sphaerophoria scripta","hembra","no",NA,"","2021-05-31","2021-05-31 NA","Sphaerophoria scripta","Sphaerophoria","scripta","Syrphidae",5,150,2021,"Gorbea"
"534",534,"31/05/21","13:30:00","1",2,"Bellis perennis","Sphaerophoria scripta","hembra","no",NA,"","2021-05-31","2021-05-31 NA","Sphaerophoria scripta","Sphaerophoria","scripta","Syrphidae",5,150,2021,"Gorbea"
"535",535,"31/05/21","13:30:00","1",2,"Bellis perennis","Sphaerophoria scripta","hembra","no",NA,"","2021-05-31","2021-05-31 NA","Sphaerophoria scripta","Sphaerophoria","scripta","Syrphidae",5,150,2021,"Gorbea"
"536",536,"31/05/21","13:30:00","1",2,"Bellis perennis","Sphaerophoria scripta","hembra","no",NA,"","2021-05-31","2021-05-31 NA","Sphaerophoria scripta","Sphaerophoria","scripta","Syrphidae",5,150,2021,"Gorbea"
"537",537,"31/05/21","13:30:00","1",2,"Bellis perennis","Sphaerophoria scripta","macho","no",NA,"","2021-05-31","2021-05-31 NA","Sphaerophoria scripta","Sphaerophoria","scripta","Syrphidae",5,150,2021,"Gorbea"
