"","Bosque","Codigo","Periodo","Dia","Transecto","Hora","Planta","Polinizador","Pollinator_id","Pollinator_genus","Pollinator_sps","Pollinator_family","Fecha2","julian"
"1","Pinar Puebla","PP",1,"19.2.2020",1,"10:15","Cistus ladanifer","apis mellifera","Apis mellifera","Apis","mellifera","Apidae",2020-02-19,49
"2","Pinar Puebla","PP",1,"19.2.2020",1,"10:15","Cistus ladanifer","apis mellifera","Apis mellifera","Apis","mellifera","Apidae",2020-02-19,49
"3","Pinar Puebla","PP",1,"19.2.2020",1,"10:15","Rosmarinus officinalis","apis mellifera","Apis mellifera","Apis","mellifera","Apidae",2020-02-19,49
"4","Pinar Puebla","PP",1,"19.2.2020",1,"10:15","Rosmarinus officinalis","apis mellifera","Apis mellifera","Apis","mellifera","Apidae",2020-02-19,49
"5","Pinar Puebla","PP",1,"19.2.2020",1,"10:15","Rosmarinus officinalis","apis mellifera","Apis mellifera","Apis","mellifera","Apidae",2020-02-19,49
"6","Pinar Puebla","PP",1,"19.2.2020",1,"10:15","Rosmarinus officinalis","apis mellifera","Apis mellifera","Apis","mellifera","Apidae",2020-02-19,49
"7","Pinar Puebla","PP",1,"19.2.2020",1,"10:15","Rosmarinus officinalis","apis mellifera","Apis mellifera","Apis","mellifera","Apidae",2020-02-19,49
"8","Pinar Puebla","PP",1,"19.2.2020",1,"10:15","Cistus salvifolius","Callophrys rubi","Callophrys rubi","Callophrys","rubi","Lepidoptera",2020-02-19,49
"9","Pinar Puebla","PP",1,"19.2.2020",1,"10:15","Rosmarinus officinalis","apis mellifera","Apis mellifera","Apis","mellifera","Apidae",2020-02-19,49
"10","Pinar Puebla","PP",1,"19.2.2020",1,"10:15","Rosmarinus officinalis","apis mellifera","Apis mellifera","Apis","mellifera","Apidae",2020-02-19,49
"11","Pinar Puebla","PP",1,"19.2.2020",1,"10:15","Rosmarinus officinalis","apis mellifera","Apis mellifera","Apis","mellifera","Apidae",2020-02-19,49
"12","Pinar Puebla","PP",1,"19.2.2020",1,"10:15","Rosmarinus officinalis","apis mellifera","Apis mellifera","Apis","mellifera","Apidae",2020-02-19,49
"13","Pinar Puebla","PP",1,"19.2.2020",1,"10:15","Rosmarinus officinalis","apis mellifera","Apis mellifera","Apis","mellifera","Apidae",2020-02-19,49
"14","Pinar Puebla","PP",1,"19.2.2020",1,"10:15","Rosmarinus officinalis","apis mellifera","Apis mellifera","Apis","mellifera","Apidae",2020-02-19,49
"15","Pinar Puebla","PP",1,"19.2.2020",1,"10:15","Rosmarinus officinalis","apis mellifera","Apis mellifera","Apis","mellifera","Apidae",2020-02-19,49
"16","Pinar Puebla","PP",1,"19.2.2020",1,"10:15","Rosmarinus officinalis","clalicodoma sicula","Chalicodoma sicula","Chalicodoma","sicula","Megachilidae",2020-02-19,49
"17","Pinar Puebla","PP",1,"19.2.2020",1,"10:15","Rosmarinus officinalis","sirfido","Syrphidae 1","Syrphidae","1","Syrphidae",2020-02-19,49
"18","Pinar Puebla","PP",1,"19.2.2020",1,"10:15","Rosmarinus officinalis","mariposa arlequin (Zerynthia rumina)","Zerynthia rumina","Zerynthia","rumina","Lepidoptera",2020-02-19,49
"19","Pinar Puebla","PP",1,"19.2.2020",1,"10:15","Rosmarinus officinalis","apis mellifera","Apis mellifera","Apis","mellifera","Apidae",2020-02-19,49
"20","Pinar Puebla","PP",1,"19.2.2020",2,"13:05","Cistus salvifolius","coleoptero","Tropinota squalida","Tropinota","squalida","Scarabaeidae",2020-02-19,49
"21","Pinar Puebla","PP",1,"19.2.2020",2,"13:05","Rosmarinus officinalis","apis mellifera","Apis mellifera","Apis","mellifera","Apidae",2020-02-19,49
"22","Pinar Puebla","PP",1,"19.2.2020",2,"13:05","Rosmarinus officinalis","apis mellifera","Apis mellifera","Apis","mellifera","Apidae",2020-02-19,49
"23","Pinar Puebla","PP",1,"19.2.2020",2,"13:05","Rosmarinus officinalis","apis mellifera","Apis mellifera","Apis","mellifera","Apidae",2020-02-19,49
"24","Pinar Puebla","PP",1,"19.2.2020",2,"13:05","Rosmarinus officinalis","apis mellifera","Apis mellifera","Apis","mellifera","Apidae",2020-02-19,49
"25","Pinar Puebla","PP",1,"19.2.2020",2,"13:05","Rosmarinus officinalis","apis mellifera","Apis mellifera","Apis","mellifera","Apidae",2020-02-19,49
"26","Pinar Puebla","PP",1,"19.2.2020",2,"13:05","Rosmarinus officinalis","apis mellifera","Apis mellifera","Apis","mellifera","Apidae",2020-02-19,49
"27","Pinar Puebla","PP",1,"19.2.2020",2,"13:05","Rosmarinus officinalis","apis mellifera","Apis mellifera","Apis","mellifera","Apidae",2020-02-19,49
"28","Pinar Puebla","PP",1,"19.2.2020",2,"13:05","Rosmarinus officinalis","apis mellifera","Apis mellifera","Apis","mellifera","Apidae",2020-02-19,49
"29","Pinar Puebla","PP",1,"19.2.2020",2,"13:05","Rosmarinus officinalis","apis mellifera","Apis mellifera","Apis","mellifera","Apidae",2020-02-19,49
"30","Pinar Puebla","PP",1,"19.2.2020",2,"13:05","Rosmarinus officinalis","apis mellifera","Apis mellifera","Apis","mellifera","Apidae",2020-02-19,49
"31","Pinar Puebla","PP",1,"19.2.2020",2,"13:05","Rosmarinus officinalis","apis mellifera","Apis mellifera","Apis","mellifera","Apidae",2020-02-19,49
"32","Pinar Puebla","PP",1,"19.2.2020",2,"13:05","Rosmarinus officinalis","apis mellifera","Apis mellifera","Apis","mellifera","Apidae",2020-02-19,49
"33","Pinar Puebla","PP",1,"19.2.2020",2,"13:05","Rosmarinus officinalis","Glaucopsyche alexis","Glaucopsyche alexis","Glaucopsyche","alexis","Lepidoptera",2020-02-19,49
"34","Pinar Puebla","PP",1,"19.2.2020",2,"13:05","Rosmarinus officinalis","apis mellifera","Apis mellifera","Apis","mellifera","Apidae",2020-02-19,49
"35","Pinar Puebla","PP",1,"19.2.2020",2,"13:05","Rosmarinus officinalis","apis mellifera","Apis mellifera","Apis","mellifera","Apidae",2020-02-19,49
"36","Pinar Puebla","PP",1,"19.2.2020",2,"13:05","Rosmarinus officinalis","apis mellifera","Apis mellifera","Apis","mellifera","Apidae",2020-02-19,49
"37","Pinar Puebla","PP",1,"19.2.2020",2,"13:05","Rosmarinus officinalis","apis mellifera","Apis mellifera","Apis","mellifera","Apidae",2020-02-19,49
"38","Pinar Puebla","PP",1,"19.2.2020",2,"13:05","Rosmarinus officinalis","apis mellifera","Apis mellifera","Apis","mellifera","Apidae",2020-02-19,49
"39","Pinar Puebla","PP",1,"19.2.2020",2,"13:05","Rosmarinus officinalis","apis mellifera","Apis mellifera","Apis","mellifera","Apidae",2020-02-19,49
"40","Pinar Puebla","PP",1,"19.2.2020",2,"13:05","Rosmarinus officinalis","apis mellifera","Apis mellifera","Apis","mellifera","Apidae",2020-02-19,49
"41","Pinar Puebla","PP",1,"19.2.2020",2,"13:05","Rosmarinus officinalis","apis mellifera","Apis mellifera","Apis","mellifera","Apidae",2020-02-19,49
"42","Pinar Puebla","PP",1,"19.2.2020",2,"13:05","Rosmarinus officinalis","apis mellifera","Apis mellifera","Apis","mellifera","Apidae",2020-02-19,49
"43","Pinar Puebla","PP",1,"19.2.2020",2,"13:05","Rosmarinus officinalis","apis mellifera","Apis mellifera","Apis","mellifera","Apidae",2020-02-19,49
"44","Pinar Puebla","PP",1,"19.2.2020",2,"13:05","Rosmarinus officinalis","apis mellifera","Apis mellifera","Apis","mellifera","Apidae",2020-02-19,49
"45","Pinar Puebla","PP",1,"19.2.2020",2,"13:05","Rosmarinus officinalis","apis mellifera","Apis mellifera","Apis","mellifera","Apidae",2020-02-19,49
"46","Pinar Puebla","PP",1,"19.2.2020",2,"13:05","Rosmarinus officinalis","apis mellifera","Apis mellifera","Apis","mellifera","Apidae",2020-02-19,49
"47","Pinar Puebla","PP",1,"19.2.2020",2,"13:05","Rosmarinus officinalis","apis mellifera","Apis mellifera","Apis","mellifera","Apidae",2020-02-19,49
"48","Pinar Puebla","PP",1,"19.2.2020",2,"13:05","Rosmarinus officinalis","apis mellifera","Apis mellifera","Apis","mellifera","Apidae",2020-02-19,49
"49","Pinar Puebla","PP",1,"19.2.2020",2,"13:05","Rosmarinus officinalis","apis mellifera","Apis mellifera","Apis","mellifera","Apidae",2020-02-19,49
"50","Pinar Puebla","PP",1,"19.2.2020",2,"13:05","Rosmarinus officinalis","apis mellifera","Apis mellifera","Apis","mellifera","Apidae",2020-02-19,49
"51","Pinar Puebla","PP",1,"19.2.2020",2,"13:05","Rosmarinus officinalis","apis mellifera","Apis mellifera","Apis","mellifera","Apidae",2020-02-19,49
"52","Pinar Puebla","PP",1,"19.2.2020",2,"13:05","Rosmarinus officinalis","anthofora","Anthophora","Anthophora","","Apidae",2020-02-19,49
"53","Pinar Puebla","PP",1,"19.2.2020",2,"13:05","Rosmarinus officinalis","apis mellifera","Apis mellifera","Apis","mellifera","Apidae",2020-02-19,49
"54","Pinar Puebla","PP",1,"19.2.2020",2,"13:05","Rosmarinus officinalis","apis mellifera","Apis mellifera","Apis","mellifera","Apidae",2020-02-19,49
"55","Pinar Puebla","PP",1,"19.2.2020",2,"13:05","Rosmarinus officinalis","apis mellifera","Apis mellifera","Apis","mellifera","Apidae",2020-02-19,49
"56","Pinar Puebla","PP",1,"19.2.2020",2,"13:05","Rosmarinus officinalis","apis mellifera","Apis mellifera","Apis","mellifera","Apidae",2020-02-19,49
"57","Pinar Puebla","PP",1,"19.2.2020",2,"13:05","Rosmarinus officinalis","apis mellifera","Apis mellifera","Apis","mellifera","Apidae",2020-02-19,49
"58","Pinar Puebla","PP",1,"19.2.2020",2,"13:05","Rosmarinus officinalis","apis mellifera","Apis mellifera","Apis","mellifera","Apidae",2020-02-19,49
"59","Pinar Puebla","PP",1,"19.2.2020",2,"13:05","Rosmarinus officinalis","apis mellifera","Apis mellifera","Apis","mellifera","Apidae",2020-02-19,49
"60","Pinar Puebla","PP",1,"19.2.2020",2,"13:05","Rosmarinus officinalis","apis mellifera","Apis mellifera","Apis","mellifera","Apidae",2020-02-19,49
"61","Pinar Puebla","PP",1,"19.2.2020",2,"13:05","Rosmarinus officinalis","apis mellifera","Apis mellifera","Apis","mellifera","Apidae",2020-02-19,49
"62","Pinar Puebla","PP",1,"19.2.2020",2,"13:05","Rosmarinus officinalis","apis mellifera","Apis mellifera","Apis","mellifera","Apidae",2020-02-19,49
"63","Pinar Puebla","PP",1,"19.2.2020",2,"13:05","Rosmarinus officinalis","apis mellifera","Apis mellifera","Apis","mellifera","Apidae",2020-02-19,49
"64","Pinar Puebla","PP",1,"19.2.2020",2,"13:05","Rosmarinus officinalis","apis mellifera","Apis mellifera","Apis","mellifera","Apidae",2020-02-19,49
"65","Pinar Puebla","PP",1,"19.2.2020",2,"13:05","Rosmarinus officinalis","apis mellifera","Apis mellifera","Apis","mellifera","Apidae",2020-02-19,49
"66","Pinar Puebla","PP",1,"19.2.2020",2,"13:05","Rosmarinus officinalis","apis mellifera","Apis mellifera","Apis","mellifera","Apidae",2020-02-19,49
"67","Pinar Puebla","PP",1,"19.2.2020",2,"13:05","Rosmarinus officinalis","apis mellifera","Apis mellifera","Apis","mellifera","Apidae",2020-02-19,49
"68","Pinar Puebla","PP",1,"19.2.2020",2,"13:05","Rosmarinus officinalis","apis mellifera","Apis mellifera","Apis","mellifera","Apidae",2020-02-19,49
"69","Pinar Puebla","PP",1,"19.2.2020",2,"13:05","Rosmarinus officinalis","clalicodoma sicula","Chalicodoma sicula","Chalicodoma","sicula","Megachilidae",2020-02-19,49
"70","Pinar Puebla","PP",1,"19.2.2020",3,"16:30","Lavandula stoechas","xylocopa cantabrita","Xylocopa cantabrita","Xylocopa","cantabrita","Apidae",2020-02-19,49
"71","Pinar Puebla","PP",1,"19.2.2020",3,"16:30","Rosmarinus officinalis","apis mellifera","Apis mellifera","Apis","mellifera","Apidae",2020-02-19,49
"72","Pinar Puebla","PP",1,"19.2.2020",3,"16:30","Rosmarinus officinalis","apis mellifera","Apis mellifera","Apis","mellifera","Apidae",2020-02-19,49
"73","Pinar Puebla","PP",1,"19.2.2020",3,"16:30","Rosmarinus officinalis","apis mellifera","Apis mellifera","Apis","mellifera","Apidae",2020-02-19,49
"74","Pinar Puebla","PP",1,"19.2.2020",3,"16:30","Rosmarinus officinalis","anthofora","Anthophora","Anthophora","","Apidae",2020-02-19,49
"75","Pinar Puebla","PP",1,"19.2.2020",3,"16:30","Rosmarinus officinalis","xylocopa cantabrita","Xylocopa cantabrita","Xylocopa","cantabrita","Apidae",2020-02-19,49
"76","Pinar Puebla","PP",1,"19.2.2020",3,"16:30","Rosmarinus officinalis","xylocopa cantabrita","Xylocopa cantabrita","Xylocopa","cantabrita","Apidae",2020-02-19,49
"77","Pinar Puebla","PP",1,"19.2.2020",3,"16:30","Rosmarinus officinalis","apis mellifera","Apis mellifera","Apis","mellifera","Apidae",2020-02-19,49
"78","Pinar Puebla","PP",1,"19.2.2020",3,"16:30","Rosmarinus officinalis","apis mellifera","Apis mellifera","Apis","mellifera","Apidae",2020-02-19,49
"79","Pinar Puebla","PP",1,"19.2.2020",3,"16:30","Rosmarinus officinalis","apis mellifera","Apis mellifera","Apis","mellifera","Apidae",2020-02-19,49
"80","Pinar Puebla","PP",1,"19.2.2020",3,"16:30","Rosmarinus officinalis","apis mellifera","Apis mellifera","Apis","mellifera","Apidae",2020-02-19,49
"81","Pinar Puebla","PP",1,"19.2.2020",3,"16:30","Rosmarinus officinalis","apis mellifera","Apis mellifera","Apis","mellifera","Apidae",2020-02-19,49
"82","Pinar Puebla","PP",1,"19.2.2020",3,"16:30","Rosmarinus officinalis","apis mellifera","Apis mellifera","Apis","mellifera","Apidae",2020-02-19,49
"83","Pinar Puebla","PP",1,"19.2.2020",3,"16:30","Rosmarinus officinalis","apis mellifera","Apis mellifera","Apis","mellifera","Apidae",2020-02-19,49
"84","Pinar Puebla","PP",1,"19.2.2020",3,"16:30","Rosmarinus officinalis","apis mellifera","Apis mellifera","Apis","mellifera","Apidae",2020-02-19,49
"85","Pinar Puebla","PP",1,"19.2.2020",3,"16:30","Rosmarinus officinalis","apis mellifera","Apis mellifera","Apis","mellifera","Apidae",2020-02-19,49
"86","Pinar Puebla","PP",1,"19.2.2020",3,"16:30","Rosmarinus officinalis","apis mellifera","Apis mellifera","Apis","mellifera","Apidae",2020-02-19,49
"87","Pinar Puebla","PP",1,"19.2.2020",3,"16:30","Rosmarinus officinalis","apis mellifera","Apis mellifera","Apis","mellifera","Apidae",2020-02-19,49
"88","Pinar Puebla","PP",1,"19.2.2020",3,"16:30","Rosmarinus officinalis","apis mellifera","Apis mellifera","Apis","mellifera","Apidae",2020-02-19,49
"89","Pinar Puebla","PP",1,"19.2.2020",3,"16:30","Rosmarinus officinalis","xylocopa cantabrita","Xylocopa cantabrita","Xylocopa","cantabrita","Apidae",2020-02-19,49
"90","Pinar Puebla","PP",1,"19.2.2020",3,"16:30","Rosmarinus officinalis","mariposa arlequin (Zerynthia rumina)","Zerynthia rumina","Zerynthia","rumina","Lepidoptera",2020-02-19,49
"91","Pinar Puebla","PP",1,"19.2.2020",3,"16:30","Rosmarinus officinalis","apis mellifera","Apis mellifera","Apis","mellifera","Apidae",2020-02-19,49
"92","Pinar Puebla","PP",1,"19.2.2020",3,"16:30","Rosmarinus officinalis","apis mellifera","Apis mellifera","Apis","mellifera","Apidae",2020-02-19,49
"93","Pinar Puebla","PP",1,"19.2.2020",3,"16:30","Rosmarinus officinalis","apis mellifera","Apis mellifera","Apis","mellifera","Apidae",2020-02-19,49
"94","Pinar Puebla","PP",1,"19.2.2020",3,"16:30","Rosmarinus officinalis","apis mellifera","Apis mellifera","Apis","mellifera","Apidae",2020-02-19,49
"95","Pinar Puebla","PP",1,"19.2.2020",3,"16:30","Rosmarinus officinalis","apis mellifera","Apis mellifera","Apis","mellifera","Apidae",2020-02-19,49
"96","Pinar Puebla","PP",1,"19.2.2020",3,"16:30","Rosmarinus officinalis","apis mellifera","Apis mellifera","Apis","mellifera","Apidae",2020-02-19,49
"97","Pinar Puebla","PP",1,"19.2.2020",3,"16:30","Rosmarinus officinalis","apis mellifera","Apis mellifera","Apis","mellifera","Apidae",2020-02-19,49
"98","Pinar Puebla","PP",1,"19.2.2020",3,"16:30","Rosmarinus officinalis","apis mellifera","Apis mellifera","Apis","mellifera","Apidae",2020-02-19,49
"99","Pinar Puebla","PP",1,"19.2.2020",3,"16:30","Rosmarinus officinalis","apis mellifera","Apis mellifera","Apis","mellifera","Apidae",2020-02-19,49
"100","Pinar Puebla","PP",1,"19.2.2020",3,"16:30","Rosmarinus officinalis","apis mellifera","Apis mellifera","Apis","mellifera","Apidae",2020-02-19,49
"101","Pinar Puebla","PP",1,"19.2.2020",3,"16:30","Rosmarinus officinalis","apis mellifera","Apis mellifera","Apis","mellifera","Apidae",2020-02-19,49
"102","Pinar Puebla","PP",1,"19.2.2020",3,"16:30","Rosmarinus officinalis","apis mellifera","Apis mellifera","Apis","mellifera","Apidae",2020-02-19,49
"103","Pinar Puebla","PP",1,"19.2.2020",3,"16:30","Rosmarinus officinalis","apis mellifera","Apis mellifera","Apis","mellifera","Apidae",2020-02-19,49
"104","Pinar Puebla","PP",1,"19.2.2020",3,"16:30","Rosmarinus officinalis","apis mellifera","Apis mellifera","Apis","mellifera","Apidae",2020-02-19,49
"105","Pinar Puebla","PP",1,"19.2.2020",3,"16:30","Rosmarinus officinalis","mariposa arlequin (Zerynthia rumina)","Zerynthia rumina","Zerynthia","rumina","Lepidoptera",2020-02-19,49
"106","Pinar Puebla","PP",1,"19.2.2020",3,"16:30","Rosmarinus officinalis","xylocopa cantabrita","Xylocopa cantabrita","Xylocopa","cantabrita","Apidae",2020-02-19,49
"107","Pinar Puebla","PP",1,"19.2.2020",3,"16:30","Rosmarinus officinalis","apis mellifera","Apis mellifera","Apis","mellifera","Apidae",2020-02-19,49
"108","Pinar Puebla","PP",1,"19.2.2020",3,"16:30","Rosmarinus officinalis","apis mellifera","Apis mellifera","Apis","mellifera","Apidae",2020-02-19,49
"109","Pinar Puebla","PP",1,"19.2.2020",3,"16:30","Rosmarinus officinalis","apis mellifera","Apis mellifera","Apis","mellifera","Apidae",2020-02-19,49
"110","Pinar Puebla","PP",1,"19.2.2020",3,"16:30","Rosmarinus officinalis","apis mellifera","Apis mellifera","Apis","mellifera","Apidae",2020-02-19,49
"111","Pinar Puebla","PP",1,"19.2.2020",3,"16:30","Rosmarinus officinalis","apis mellifera","Apis mellifera","Apis","mellifera","Apidae",2020-02-19,49
"112","Pinar Puebla","PP",1,"19.2.2020",3,"16:30","Rosmarinus officinalis","apis mellifera","Apis mellifera","Apis","mellifera","Apidae",2020-02-19,49
"113","Pinar Hinojos","PH",1,"20.2.2020",1,"10:05","Halimium commutatum","apis mellifera","Apis mellifera","Apis","mellifera","Apidae",2020-02-20,50
"114","Pinar Hinojos","PH",1,"20.2.2020",1,"10:05","Halimium commutatum","mosca","Platycheirus  sp","Platycheirus"," sp","Syrphidae",2020-02-20,50
"115","Pinar Hinojos","PH",1,"20.2.2020",1,"10:05","Halimium commutatum","sirfido","Syrphidae 1","Syrphidae","1","Syrphidae",2020-02-20,50
"116","Pinar Hinojos","PH",1,"20.2.2020",1,"10:05","Halimium commutatum","mosca","Platycheirus  sp","Platycheirus"," sp","Syrphidae",2020-02-20,50
"117","Pinar Hinojos","PH",1,"20.2.2020",2,"12:45","Halimium commutatum","mosca peque–a","mosca peque–a","mosca","peque–a","mosca",2020-02-20,50
"118","Pinar Hinojos","PH",1,"20.2.2020",2,"12:45","Halimium commutatum","mosca","Platycheirus  albimanus","Platycheirus"," albimanus","Syrphidae",2020-02-20,50
"119","Pinar Hinojos","PH",1,"20.2.2020",2,"12:45","Halimium commutatum","mosca","Platycheirus  albimanus","Platycheirus"," albimanus","Syrphidae",2020-02-20,50
"120","Pinar Hinojos","PH",1,"20.2.2020",2,"12:45","Halimium commutatum","sirfido","Episyrphus balteatus","Episyrphus","balteatus","Syrphidae",2020-02-20,50
"121","Pinar Hinojos","PH",1,"20.2.2020",2,"12:45","Halimium commutatum","mosca","Platycheirus  albimanus","Platycheirus"," albimanus","Syrphidae",2020-02-20,50
"122","Pinar Hinojos","PH",1,"20.2.2020",2,"12:45","Halimium commutatum","sirfido","Episyrphus balteatus","Episyrphus","balteatus","Syrphidae",2020-02-20,50
"123","Pinar Hinojos","PH",1,"20.2.2020",2,"12:45","Halimium commutatum","mosca","Platycheirus  sp","Platycheirus"," sp","Syrphidae",2020-02-20,50
"124","Pinar Hinojos","PH",1,"20.2.2020",2,"12:45","Halimium commutatum","sirfido","Syrphidae 1","Syrphidae","1","Syrphidae",2020-02-20,50
"125","Pinar Hinojos","PH",1,"20.2.2020",2,"12:45","Halimium commutatum","mosca","Platycheirus  albimanus","Platycheirus"," albimanus","Syrphidae",2020-02-20,50
"126","Pinar Hinojos","PH",1,"20.2.2020",2,"12:45","Halimium commutatum","mosca","Platycheirus  albimanus","Platycheirus"," albimanus","Syrphidae",2020-02-20,50
"127","Pinar Hinojos","PH",1,"20.2.2020",2,"12:45","Halimium commutatum","mosca","Platycheirus  albimanus","Platycheirus"," albimanus","Syrphidae",2020-02-20,50
"128","Pinar Hinojos","PH",1,"20.2.2020",2,"12:45","Halimium commutatum","mosca","Platycheirus  albimanus","Platycheirus"," albimanus","Syrphidae",2020-02-20,50
"129","Pinar Hinojos","PH",1,"20.2.2020",2,"12:45","Halimium commutatum","mosca","Platycheirus  albimanus","Platycheirus"," albimanus","Syrphidae",2020-02-20,50
"130","Pinar Hinojos","PH",1,"20.2.2020",2,"12:45","Halimium commutatum","mosca","Platycheirus  albimanus","Platycheirus"," albimanus","Syrphidae",2020-02-20,50
"131","Pinar Hinojos","PH",1,"20.2.2020",2,"12:45","Halimium commutatum","sirfido","Episyrphus balteatus","Episyrphus","balteatus","Syrphidae",2020-02-20,50
"132","Pinar Hinojos","PH",1,"20.2.2020",2,"12:45","Halimium commutatum","sirfido","Episyrphus balteatus","Episyrphus","balteatus","Syrphidae",2020-02-20,50
"133","Pinar Hinojos","PH",1,"20.2.2020",2,"12:45","Halimium commutatum","sirfido","Episyrphus balteatus","Episyrphus","balteatus","Syrphidae",2020-02-20,50
"134","Pinar Hinojos","PH",1,"20.2.2020",2,"12:45","Halimium commutatum","sirfido","Episyrphus balteatus","Episyrphus","balteatus","Syrphidae",2020-02-20,50
"135","Pinar Hinojos","PH",1,"20.2.2020",2,"12:45","Halimium commutatum","mosca","Platycheirus  albimanus","Platycheirus"," albimanus","Syrphidae",2020-02-20,50
"136","Pinar Hinojos","PH",1,"20.2.2020",2,"12:45","Halimium commutatum","mosca","Platycheirus  albimanus","Platycheirus"," albimanus","Syrphidae",2020-02-20,50
"137","Pinar Hinojos","PH",1,"20.2.2020",2,"12:45","Halimium commutatum","mosca","Platycheirus  albimanus","Platycheirus"," albimanus","Syrphidae",2020-02-20,50
"138","Pinar Hinojos","PH",1,"20.2.2020",2,"12:45","Halimium commutatum","mosca","Platycheirus  albimanus","Platycheirus"," albimanus","Syrphidae",2020-02-20,50
"139","Pinar Hinojos","PH",1,"20.2.2020",2,"12:45","Halimium commutatum","mosca","Platycheirus  albimanus","Platycheirus"," albimanus","Syrphidae",2020-02-20,50
"140","Pinar Hinojos","PH",1,"20.2.2020",2,"12:45","Halimium commutatum","mosca","Platycheirus  albimanus","Platycheirus"," albimanus","Syrphidae",2020-02-20,50
"141","Pinar Hinojos","PH",1,"20.2.2020",2,"12:45","Halimium commutatum","apis mellifera","Apis mellifera","Apis","mellifera","Apidae",2020-02-20,50
"142","Pinar Hinojos","PH",1,"20.2.2020",2,"12:45","Halimium commutatum","mosca","Platycheirus  albimanus","Platycheirus"," albimanus","Syrphidae",2020-02-20,50
"143","Pinar Hinojos","PH",1,"20.2.2020",2,"12:45","Halimium commutatum","mosca","Platycheirus  albimanus","Platycheirus"," albimanus","Syrphidae",2020-02-20,50
"144","Pinar Hinojos","PH",1,"20.2.2020",2,"12:45","Halimium commutatum","mosca","Platycheirus  albimanus","Platycheirus"," albimanus","Syrphidae",2020-02-20,50
"145","Pinar Hinojos","PH",1,"20.2.2020",2,"12:45","Halimium commutatum","mosca","Platycheirus  albimanus","Platycheirus"," albimanus","Syrphidae",2020-02-20,50
"146","Pinar Hinojos","PH",1,"20.2.2020",2,"12:45","Halimium commutatum","mosca","Dilophus  sp","Dilophus"," sp","Bibionidae",2020-02-20,50
"147","Pinar Hinojos","PH",1,"20.2.2020",3,"16:30","Romulea bulbocodium","sirfido","Episyrphus balteatus","Episyrphus","balteatus","Syrphidae",2020-02-20,50
"148","Pinar Hinojos","PH",1,"20.2.2020",3,"16:30","Romulea bulbocodium","polilla marron mediana","polilla marron mediana","polilla","marron mediana","Lepidoptera",2020-02-20,50
"149","Pinar Hinojos","PH",1,"20.2.2020",3,"16:30","Halimium commutatum","sirfido","Episyrphus balteatus","Episyrphus","balteatus","Syrphidae",2020-02-20,50
"150","Villamanrique Chaparral","VC",1,"21.2.2020",1,"11:30","Asphodelus fistulosus","apis mellifera","Apis mellifera","Apis","mellifera","Apidae",2020-02-21,51
"151","Villamanrique Chaparral","VC",1,"21.2.2020",1,"11:30","Asphodelus fistulosus","apis mellifera","Apis mellifera","Apis","mellifera","Apidae",2020-02-21,51
"152","Villamanrique Chaparral","VC",1,"21.2.2020",1,"11:30","Asphodelus fistulosus","xylocopa cantabrita","Xylocopa cantabrita","Xylocopa","cantabrita","Apidae",2020-02-21,51
"153","Villamanrique Chaparral","VC",1,"21.2.2020",1,"11:30","Rosmarinus officinalis","apis mellifera","Apis mellifera","Apis","mellifera","Apidae",2020-02-21,51
"154","Villamanrique Chaparral","VC",1,"21.2.2020",1,"11:30","Rosmarinus officinalis","apis mellifera","Apis mellifera","Apis","mellifera","Apidae",2020-02-21,51
"155","Villamanrique Chaparral","VC",1,"21.2.2020",1,"11:30","Rosmarinus officinalis","apis mellifera","Apis mellifera","Apis","mellifera","Apidae",2020-02-21,51
"156","Villamanrique Chaparral","VC",1,"21.2.2020",1,"11:30","Rosmarinus officinalis","apis mellifera","Apis mellifera","Apis","mellifera","Apidae",2020-02-21,51
"157","Villamanrique Chaparral","VC",1,"21.2.2020",1,"11:30","Rosmarinus officinalis","apis mellifera","Apis mellifera","Apis","mellifera","Apidae",2020-02-21,51
"158","Villamanrique Chaparral","VC",1,"21.2.2020",1,"11:30","Rosmarinus officinalis","apis mellifera","Apis mellifera","Apis","mellifera","Apidae",2020-02-21,51
"159","Villamanrique Chaparral","VC",1,"21.2.2020",2,"14:00","Rosmarinus officinalis","apis mellifera","Apis mellifera","Apis","mellifera","Apidae",2020-02-21,51
"160","Villamanrique Chaparral","VC",1,"21.2.2020",2,"14:00","Rosmarinus officinalis","apis mellifera","Apis mellifera","Apis","mellifera","Apidae",2020-02-21,51
"161","Villamanrique Chaparral","VC",1,"21.2.2020",2,"14:00","Narcissus papyraceus","xylocopa cantabrita","Xylocopa cantabrita","Xylocopa","cantabrita","Apidae",2020-02-21,51
"162","Villamanrique Chaparral","VC",1,"21.2.2020",2,"14:00","Rosmarinus officinalis","apis mellifera","Apis mellifera","Apis","mellifera","Apidae",2020-02-21,51
"163","Villamanrique Chaparral","VC",1,"21.2.2020",2,"14:00","Rosmarinus officinalis","apis mellifera","Apis mellifera","Apis","mellifera","Apidae",2020-02-21,51
"164","Villamanrique Chaparral","VC",1,"21.2.2020",2,"14:00","Rosmarinus officinalis","apis mellifera","Apis mellifera","Apis","mellifera","Apidae",2020-02-21,51
"165","Villamanrique Chaparral","VC",1,"21.2.2020",2,"14:00","Rosmarinus officinalis","Pieris rapae","Pieris rapae","Pieris","rapae","Lepidoptera",2020-02-21,51
"166","Villamanrique Chaparral","VC",1,"21.2.2020",2,"14:00","Asphodelus fistulosus","antophora","Anthophora","Anthophora","","Apidae",2020-02-21,51
"167","Villamanrique Chaparral","VC",1,"21.2.2020",3,"16:15","Rosmarinus officinalis","apis mellifera","Apis mellifera","Apis","mellifera","Apidae",2020-02-21,51
"168","Villamanrique Chaparral","VC",1,"21.2.2020",3,"16:15","Rosmarinus officinalis","apis mellifera","Apis mellifera","Apis","mellifera","Apidae",2020-02-21,51
"169","Villamanrique Chaparral","VC",1,"21.2.2020",3,"16:15","Rosmarinus officinalis","apis mellifera","Apis mellifera","Apis","mellifera","Apidae",2020-02-21,51
"170","Villamanrique Chaparral","VC",1,"21.2.2020",3,"16:15","Rosmarinus officinalis","apis mellifera","Apis mellifera","Apis","mellifera","Apidae",2020-02-21,51
"171","Villamanrique Chaparral","VC",1,"21.2.2020",3,"16:15","Rosmarinus officinalis","apis mellifera","Apis mellifera","Apis","mellifera","Apidae",2020-02-21,51
"172","Villamanrique Chaparral","VC",1,"21.2.2020",3,"16:15","Rosmarinus officinalis","apis mellifera","Apis mellifera","Apis","mellifera","Apidae",2020-02-21,51
"173","Villamanrique Chaparral","VC",1,"21.2.2020",3,"16:15","Rosmarinus officinalis","apis mellifera","Apis mellifera","Apis","mellifera","Apidae",2020-02-21,51
"174","Villamanrique Chaparral","VC",1,"21.2.2020",3,"16:15","Rosmarinus officinalis","mosca peque–a","mosca peque–a","mosca","peque–a","mosca",2020-02-21,51
"175","Villamanrique Chaparral","VC",1,"21.2.2020",3,"16:15","Rosmarinus officinalis","abeja","Anthophora  retusa","Anthophora"," retusa","Apidae",2020-02-21,51
"176","Villamanrique Chaparral","VC",1,"21.2.2020",3,"16:15","Rosmarinus officinalis","mariposa arlequin (Zerynthia rumina)","Zerynthia rumina","Zerynthia","rumina","Lepidoptera",2020-02-21,51
"177","Villamanrique Chaparral","VC",1,"21.2.2020",3,"16:15","Rosmarinus officinalis","coleoptero","Tropinota  squalida","Tropinota"," squalida","Scarabaeidae",2020-02-21,51
"178","Villamanrique Chaparral","VC",1,"21.2.2020",3,"16:15","Asphodelus fistulosus","coleoptero como VCT3.1","Tropinota  squalida","Tropinota"," squalida","Scarabaeidae",2020-02-21,51
"179","Villamanrique Chaparral","VC",1,"21.2.2020",3,"16:15","Rosmarinus officinalis","apis mellifera","Apis mellifera","Apis","mellifera","Apidae",2020-02-21,51
"180","Villamanrique Chaparral","VC",1,"21.2.2020",3,"16:15","Rosmarinus officinalis","apis mellifera","Apis mellifera","Apis","mellifera","Apidae",2020-02-21,51
"181","Villamanrique Chaparral","VC",1,"21.2.2020",3,"16:15","Rosmarinus officinalis","apis mellifera","Apis mellifera","Apis","mellifera","Apidae",2020-02-21,51
"182","Villamanrique Chaparral","VC",1,"21.2.2020",3,"16:15","Rosmarinus officinalis","apis mellifera","Apis mellifera","Apis","mellifera","Apidae",2020-02-21,51
"183","Villamanrique Chaparral","VC",1,"21.2.2020",3,"16:15","Rosmarinus officinalis","apis mellifera","Apis mellifera","Apis","mellifera","Apidae",2020-02-21,51
"184","Villamanrique Chaparral","VC",1,"21.2.2020",3,"16:15","Narcissus papyraceus","sirfido rayas amarillas","Syrphidae 2","Syrphidae","2","Syrphidae",2020-02-21,51
"185","Villamanrique Chaparral","VC",1,"21.2.2020",3,"16:15","Rosmarinus officinalis","coleoptero como VCT3.1","Tropinota  squalida","Tropinota"," squalida","Scarabaeidae",2020-02-21,51
"186","Villamanrique Chaparral","VC",1,"21.2.2020",3,"16:15","Rosmarinus officinalis","apis mellifera","Apis mellifera","Apis","mellifera","Apidae",2020-02-21,51
"187","Villamanrique Chaparral","VC",1,"21.2.2020",3,"16:15","Rosmarinus officinalis","apis mellifera","Apis mellifera","Apis","mellifera","Apidae",2020-02-21,51
"188","Villamanrique Chaparral","VC",1,"21.2.2020",3,"16:15","Rosmarinus officinalis","apis mellifera","Apis mellifera","Apis","mellifera","Apidae",2020-02-21,51
"189","Villamanrique Chaparral","VC",1,"21.2.2020",3,"16:15","Rosmarinus officinalis","apis mellifera","Apis mellifera","Apis","mellifera","Apidae",2020-02-21,51
"190","Villamanrique Chaparral","VC",1,"21.2.2020",3,"16:15","Rosmarinus officinalis","apis mellifera","Apis mellifera","Apis","mellifera","Apidae",2020-02-21,51
"191","Villamanrique Sur","VS",1,"25.2.2020",1,"11:00","Rosmarinus officinalis","apis mellifera","Apis mellifera","Apis","mellifera","Apidae",2020-02-25,55
"192","Villamanrique Sur","VS",1,"25.2.2020",1,"11:00","Rosmarinus officinalis","apis mellifera","Apis mellifera","Apis","mellifera","Apidae",2020-02-25,55
"193","Villamanrique Sur","VS",1,"25.2.2020",1,"11:00","Rosmarinus officinalis","apis mellifera","Apis mellifera","Apis","mellifera","Apidae",2020-02-25,55
"194","Villamanrique Sur","VS",1,"25.2.2020",2,"13:10","Rosmarinus officinalis","apis mellifera","Apis mellifera","Apis","mellifera","Apidae",2020-02-25,55
"195","Villamanrique Sur","VS",1,"25.2.2020",3,"16:00","Rosmarinus officinalis","apis mellifera","Apis mellifera","Apis","mellifera","Apidae",2020-02-25,55
"196","Villamanrique Sur","VS",1,"25.2.2020",3,"16:00","Rosmarinus officinalis","apis mellifera","Apis mellifera","Apis","mellifera","Apidae",2020-02-25,55
"197","Villamanrique Sur","VS",1,"25.2.2020",3,"16:00","Rosmarinus officinalis","apis mellifera","Apis mellifera","Apis","mellifera","Apidae",2020-02-25,55
"199","Pinar Aznalcazar","PA",1,"26.2.2020",2,"13:12","Rosmarinus officinalis","apis mellifera","Apis mellifera","Apis","mellifera","Apidae",2020-02-26,56
"200","Pinar Aznalcazar","PA",1,"26.2.2021",2,"13:12","Rosmarinus officinalis","apis mellifera","Apis mellifera","Apis","mellifera","Apidae",2021-02-26,56
"201","Pinar Aznalcazar","PA",1,"26.2.2022",2,"13:12","Rosmarinus officinalis","apis mellifera","Apis mellifera","Apis","mellifera","Apidae",2022-02-26,56
"202","Pinar Aznalcazar","PA",1,"26.2.2023",2,"13:12","Rosmarinus officinalis","apis mellifera","Apis mellifera","Apis","mellifera","Apidae",2023-02-26,56
"203","Pinar Aznalcazar","PA",1,"26.2.2024",2,"13:12","Rosmarinus officinalis","sirfido","Syrphidae 1","Syrphidae","1","Syrphidae",2024-02-26,56
"204","Pinar Aznalcazar","PA",1,"26.2.2025",2,"13:12","Rosmarinus officinalis","eucera","Eucera","Eucera","","Apidae",2025-02-26,56
"205","Pinar Aznalcazar","PA",1,"26.2.2026",2,"13:12","Rosmarinus officinalis","avispa","Nomada  agrestis","Nomada"," agrestis","Apidae",2026-02-26,56
"206","Pinar Aznalcazar","PA",1,"26.2.2027",2,"13:12","Rosmarinus officinalis","apis mellifera","Apis mellifera","Apis","mellifera","Apidae",2027-02-26,56
"207","Pinar Aznalcazar","PA",1,"26.2.2028",2,"13:12","Rosmarinus officinalis","apis mellifera","Apis mellifera","Apis","mellifera","Apidae",2028-02-26,56
"208","Pinar Aznalcazar","PA",1,"26.2.2029",2,"13:12","Rosmarinus officinalis","apis mellifera","Apis mellifera","Apis","mellifera","Apidae",2029-02-26,56
"209","Pinar Aznalcazar","PA",1,"26.2.2030",2,"13:12","Rosmarinus officinalis","mariposa arlequin (Zerynthia rumina)","Zerynthia rumina","Zerynthia","rumina","Lepidoptera",2030-02-26,56
"210","Pinar Aznalcazar","PA",1,"26.2.2031",2,"13:12","Rosmarinus officinalis","abeja roja","Chalicodoma sicula","Chalicodoma","sicula","Megachilidae",2031-02-26,56
"211","Pinar Aznalcazar","PA",1,"26.2.2032",3,"16:10","Rosmarinus officinalis","apis mellifera","Apis mellifera","Apis","mellifera","Apidae",2032-02-26,56
"212","Pinar Aznalcazar","PA",1,"26.2.2032",3,"16:10","Rosmarinus officinalis","apis mellifera","Apis mellifera","Apis","mellifera","Apidae",2032-02-26,56
"213","Pinar Aznalcazar","PA",1,"26.2.2032",3,"16:10","Rosmarinus officinalis","apis mellifera","Apis mellifera","Apis","mellifera","Apidae",2032-02-26,56
"214","Pinar Aznalcazar","PA",1,"26.2.2032",3,"16:10","Rosmarinus officinalis","apis mellifera","Apis mellifera","Apis","mellifera","Apidae",2032-02-26,56
"215","Pinar Aznalcazar","PA",1,"26.2.2032",3,"16:10","Rosmarinus officinalis","abeja","Andrena Trachandrena sp","Andrena","Trachandrena sp","Andrenidae",2032-02-26,56
"216","Pinar Aznalcazar","PA",1,"26.2.2032",3,"16:10","Rosmarinus officinalis","apis mellifera","Apis mellifera","Apis","mellifera","Apidae",2032-02-26,56
"217","Pinar Aznalcazar","PA",1,"26.2.2032",3,"16:10","Rosmarinus officinalis","apis mellifera","Apis mellifera","Apis","mellifera","Apidae",2032-02-26,56
"218","Pinar Aznalcazar","PA",1,"26.2.2032",3,"16:10","Rosmarinus officinalis","apis mellifera","Apis mellifera","Apis","mellifera","Apidae",2032-02-26,56
"219","Pinar Aznalcazar","PA",1,"26.2.2032",3,"16:10","Rosmarinus officinalis","apis mellifera","Apis mellifera","Apis","mellifera","Apidae",2032-02-26,56
"220","Pinar Aznalcazar","PA",1,"26.2.2032",3,"16:10","Rosmarinus officinalis","apis mellifera","Apis mellifera","Apis","mellifera","Apidae",2032-02-26,56
"221","Pinar Aznalcazar","PA",1,"26.2.2032",3,"16:10","Rosmarinus officinalis","apis mellifera","Apis mellifera","Apis","mellifera","Apidae",2032-02-26,56
"222","Pinar Aznalcazar","PA",1,"26.2.2032",3,"16:10","Rosmarinus officinalis","abeja","Nomada  agrestis","Nomada"," agrestis","Apidae",2032-02-26,56
"223","Pinar Aznalcazar","PA",1,"26.2.2032",3,"16:10","Rosmarinus officinalis","abeja=PAT3.1","Andrena Trachandrena sp","Andrena","Trachandrena sp","Andrenidae",2032-02-26,56
"224","Pinar Aznalcazar","PA",1,"26.2.2032",3,"16:10","Rosmarinus officinalis","abeja=PAT3.1","Andrena Trachandrena sp","Andrena","Trachandrena sp","Andrenidae",2032-02-26,56
"225","Pinar Puebla","PP",2,"27.2.2020",1,"9:50","Cistus salvifolius","apis mellifera","Apis mellifera","Apis","mellifera","Apidae",2020-02-27,57
"226","Pinar Puebla","PP",2,"27.2.2020",1,"9:50","Rosmarinus officinalis","apis mellifera","Apis mellifera","Apis","mellifera","Apidae",2020-02-27,57
"227","Pinar Puebla","PP",2,"27.2.2020",1,"9:50","Rosmarinus officinalis","apis mellifera","Apis mellifera","Apis","mellifera","Apidae",2020-02-27,57
"228","Pinar Puebla","PP",2,"27.2.2020",1,"9:50","Rosmarinus officinalis","apis mellifera","Apis mellifera","Apis","mellifera","Apidae",2020-02-27,57
"229","Pinar Puebla","PP",2,"27.2.2020",1,"9:50","Rosmarinus officinalis","apis mellifera","Apis mellifera","Apis","mellifera","Apidae",2020-02-27,57
"230","Pinar Puebla","PP",2,"27.2.2020",1,"9:50","Rosmarinus officinalis","apis mellifera","Apis mellifera","Apis","mellifera","Apidae",2020-02-27,57
"231","Pinar Puebla","PP",2,"27.2.2020",1,"9:50","Cistus salvifolius","apis mellifera","Apis mellifera","Apis","mellifera","Apidae",2020-02-27,57
"232","Pinar Puebla","PP",2,"27.2.2020",1,"9:50","Cistus salvifolius","apis mellifera","Apis mellifera","Apis","mellifera","Apidae",2020-02-27,57
"233","Pinar Puebla","PP",2,"27.2.2020",1,"9:50","Rosmarinus officinalis","apis mellifera","Apis mellifera","Apis","mellifera","Apidae",2020-02-27,57
"234","Pinar Puebla","PP",2,"27.2.2020",1,"9:50","Rosmarinus officinalis","apis mellifera","Apis mellifera","Apis","mellifera","Apidae",2020-02-27,57
"235","Pinar Puebla","PP",2,"27.2.2020",1,"9:50","Rosmarinus officinalis","apis mellifera","Apis mellifera","Apis","mellifera","Apidae",2020-02-27,57
"236","Pinar Puebla","PP",2,"27.2.2020",1,"9:50","Rosmarinus officinalis","apis mellifera","Apis mellifera","Apis","mellifera","Apidae",2020-02-27,57
"237","Pinar Puebla","PP",2,"27.2.2020",1,"9:50","Rosmarinus officinalis","mariposa arlequin (Zerynthia rumina)","Zerynthia rumina","Zerynthia","rumina","Lepidoptera",2020-02-27,57
"238","Pinar Puebla","PP",2,"27.2.2020",1,"9:50","Rosmarinus officinalis","xylocopa cantabrita","Xylocopa cantabrita","Xylocopa","cantabrita","Apidae",2020-02-27,57
"239","Pinar Puebla","PP",2,"27.2.2020",1,"9:50","Rosmarinus officinalis","xylocopa cantabrita","Xylocopa cantabrita","Xylocopa","cantabrita","Apidae",2020-02-27,57
"240","Pinar Puebla","PP",2,"27.2.2020",1,"9:50","Rosmarinus officinalis","xylocopa cantabrita","Xylocopa cantabrita","Xylocopa","cantabrita","Apidae",2020-02-27,57
"241","Pinar Puebla","PP",2,"27.2.2020",1,"9:50","Cistus salvifolius","sirfido","Episyrphus balteatus","Episyrphus","balteatus","Syrphidae",2020-02-27,57
"242","Pinar Puebla","PP",2,"27.2.2020",1,"9:50","Anemone palmata","sirfido=PPT1.1","Episyrphus balteatus","Episyrphus","balteatus","Syrphidae",2020-02-27,57
"243","Pinar Puebla","PP",2,"27.2.2020",1,"9:50","Cistus salvifolius","eucera","Eucera","Eucera","","Apidae",2020-02-27,57
"244","Pinar Puebla","PP",2,"27.2.2020",1,"9:50","Rosmarinus officinalis","apis mellifera","Apis mellifera","Apis","mellifera","Apidae",2020-02-27,57
"245","Pinar Puebla","PP",2,"27.2.2020",1,"9:50","Rosmarinus officinalis","apis mellifera","Apis mellifera","Apis","mellifera","Apidae",2020-02-27,57
"246","Pinar Puebla","PP",2,"27.2.2020",1,"9:50","Rosmarinus officinalis","apis mellifera","Apis mellifera","Apis","mellifera","Apidae",2020-02-27,57
"247","Pinar Puebla","PP",2,"27.2.2020",1,"9:50","Rosmarinus officinalis","apis mellifera","Apis mellifera","Apis","mellifera","Apidae",2020-02-27,57
"248","Pinar Puebla","PP",2,"27.2.2020",1,"9:50","Rosmarinus officinalis","apis mellifera","Apis mellifera","Apis","mellifera","Apidae",2020-02-27,57
"249","Pinar Puebla","PP",2,"27.2.2020",1,"9:50","Cistus salvifolius","apis mellifera","Apis mellifera","Apis","mellifera","Apidae",2020-02-27,57
"250","Pinar Puebla","PP",2,"27.2.2020",2,"14:00","Cistus salvifolius","laseoglosum","Andrena Trachandrena sp","Andrena","Trachandrena sp","Andrenidae",2020-02-27,57
"251","Pinar Puebla","PP",2,"27.2.2020",2,"14:00","Cistus salvifolius","laseoglosum=PPT2.1","Andrena Trachandrena sp","Andrena","Trachandrena sp","Andrenidae",2020-02-27,57
"252","Pinar Puebla","PP",2,"27.2.2020",2,"14:00","Lavandula stoechas","anthofora","Anthophora","Anthophora","","Apidae",2020-02-27,57
"253","Pinar Puebla","PP",2,"27.2.2020",2,"14:00","Lavandula stoechas","anthofora","Anthophora","Anthophora","","Apidae",2020-02-27,57
"254","Pinar Puebla","PP",2,"27.2.2020",2,"14:00","Cistus salvifolius","apis mellifera","Apis mellifera","Apis","mellifera","Apidae",2020-02-27,57
"255","Pinar Puebla","PP",2,"27.2.2020",2,"14:00","Cistus salvifolius","apis mellifera","Apis mellifera","Apis","mellifera","Apidae",2020-02-27,57
"256","Pinar Puebla","PP",2,"27.2.2020",2,"14:00","Rosmarinus officinalis","apis mellifera","Apis mellifera","Apis","mellifera","Apidae",2020-02-27,57
"257","Pinar Puebla","PP",2,"27.2.2020",2,"14:00","Cistus salvifolius","apis mellifera","Apis mellifera","Apis","mellifera","Apidae",2020-02-27,57
"258","Pinar Puebla","PP",2,"27.2.2020",2,"14:00","Rosmarinus officinalis","apis mellifera","Apis mellifera","Apis","mellifera","Apidae",2020-02-27,57
"259","Pinar Puebla","PP",2,"27.2.2020",2,"14:00","Rosmarinus officinalis","apis mellifera","Apis mellifera","Apis","mellifera","Apidae",2020-02-27,57
"260","Pinar Puebla","PP",2,"27.2.2020",2,"14:00","Rosmarinus officinalis","apis mellifera","Apis mellifera","Apis","mellifera","Apidae",2020-02-27,57
"261","Pinar Puebla","PP",2,"27.2.2020",2,"14:00","Rosmarinus officinalis","apis mellifera","Apis mellifera","Apis","mellifera","Apidae",2020-02-27,57
"262","Pinar Puebla","PP",2,"27.2.2020",2,"14:00","Rosmarinus officinalis","apis mellifera","Apis mellifera","Apis","mellifera","Apidae",2020-02-27,57
"263","Pinar Puebla","PP",2,"27.2.2020",2,"14:00","Rosmarinus officinalis","apis mellifera","Apis mellifera","Apis","mellifera","Apidae",2020-02-27,57
"264","Pinar Puebla","PP",2,"27.2.2020",2,"14:00","Rosmarinus officinalis","apis mellifera","Apis mellifera","Apis","mellifera","Apidae",2020-02-27,57
"265","Pinar Puebla","PP",2,"27.2.2020",2,"14:00","Rosmarinus officinalis","apis mellifera","Apis mellifera","Apis","mellifera","Apidae",2020-02-27,57
"266","Pinar Puebla","PP",2,"27.2.2020",2,"14:00","Rosmarinus officinalis","apis mellifera","Apis mellifera","Apis","mellifera","Apidae",2020-02-27,57
"267","Pinar Puebla","PP",2,"27.2.2020",2,"14:00","Rosmarinus officinalis","apis mellifera","Apis mellifera","Apis","mellifera","Apidae",2020-02-27,57
"268","Pinar Puebla","PP",2,"27.2.2020",2,"14:00","Rosmarinus officinalis","apis mellifera","Apis mellifera","Apis","mellifera","Apidae",2020-02-27,57
"269","Pinar Puebla","PP",2,"27.2.2020",2,"14:00","Rosmarinus officinalis","apis mellifera","Apis mellifera","Apis","mellifera","Apidae",2020-02-27,57
"270","Pinar Puebla","PP",2,"27.2.2020",2,"14:00","Rosmarinus officinalis","apis mellifera","Apis mellifera","Apis","mellifera","Apidae",2020-02-27,57
"271","Pinar Puebla","PP",2,"27.2.2020",2,"14:00","Rosmarinus officinalis","apis mellifera","Apis mellifera","Apis","mellifera","Apidae",2020-02-27,57
"272","Pinar Puebla","PP",2,"27.2.2020",2,"14:00","Rosmarinus officinalis","xylocopa cantabrita","Xylocopa cantabrita","Xylocopa","cantabrita","Apidae",2020-02-27,57
"273","Pinar Puebla","PP",2,"27.2.2020",2,"14:00","Rosmarinus officinalis","xylocopa cantabrita","Xylocopa cantabrita","Xylocopa","cantabrita","Apidae",2020-02-27,57
"274","Pinar Puebla","PP",2,"27.2.2020",2,"14:00","Rosmarinus officinalis","xylocopa cantabrita","Xylocopa cantabrita","Xylocopa","cantabrita","Apidae",2020-02-27,57
"275","Pinar Puebla","PP",2,"27.2.2020",2,"14:00","Rosmarinus officinalis","apis mellifera","Apis mellifera","Apis","mellifera","Apidae",2020-02-27,57
"276","Pinar Puebla","PP",2,"27.2.2020",2,"14:00","Rosmarinus officinalis","xylocopa cantabrita","Xylocopa cantabrita","Xylocopa","cantabrita","Apidae",2020-02-27,57
"277","Pinar Puebla","PP",2,"27.2.2020",2,"14:00","Rosmarinus officinalis","apis mellifera","Apis mellifera","Apis","mellifera","Apidae",2020-02-27,57
"278","Pinar Puebla","PP",2,"27.2.2020",2,"14:00","Rosmarinus officinalis","apis mellifera","Apis mellifera","Apis","mellifera","Apidae",2020-02-27,57
"279","Pinar Puebla","PP",2,"27.2.2020",2,"14:00","Asphodelus fistulosus","xylocopa cantabrita","Xylocopa cantabrita","Xylocopa","cantabrita","Apidae",2020-02-27,57
"280","Pinar Puebla","PP",2,"27.2.2020",2,"14:00","Cistus salvifolius","xylocopa cantabrita","Xylocopa cantabrita","Xylocopa","cantabrita","Apidae",2020-02-27,57
"281","Pinar Puebla","PP",2,"27.2.2020",2,"14:00","Anemone palmata","apis mellifera","Apis mellifera","Apis","mellifera","Apidae",2020-02-27,57
"282","Pinar Puebla","PP",2,"27.2.2020",2,"14:00","Rosmarinus officinalis","apis mellifera","Apis mellifera","Apis","mellifera","Apidae",2020-02-27,57
"283","Pinar Puebla","PP",2,"27.2.2020",2,"14:00","Rosmarinus officinalis","apis mellifera","Apis mellifera","Apis","mellifera","Apidae",2020-02-27,57
"284","Pinar Puebla","PP",2,"27.2.2020",2,"14:00","Rosmarinus officinalis","apis mellifera","Apis mellifera","Apis","mellifera","Apidae",2020-02-27,57
"285","Pinar Puebla","PP",2,"27.2.2020",2,"14:00","Rosmarinus officinalis","apis mellifera","Apis mellifera","Apis","mellifera","Apidae",2020-02-27,57
"286","Pinar Puebla","PP",2,"27.2.2020",2,"14:00","Rosmarinus officinalis","apis mellifera","Apis mellifera","Apis","mellifera","Apidae",2020-02-27,57
"287","Pinar Puebla","PP",2,"27.2.2020",2,"14:00","Rosmarinus officinalis","apis mellifera","Apis mellifera","Apis","mellifera","Apidae",2020-02-27,57
"288","Pinar Puebla","PP",2,"27.2.2020",2,"14:00","Rosmarinus officinalis","apis mellifera","Apis mellifera","Apis","mellifera","Apidae",2020-02-27,57
"289","Pinar Puebla","PP",2,"27.2.2020",2,"14:00","Rosmarinus officinalis","apis mellifera","Apis mellifera","Apis","mellifera","Apidae",2020-02-27,57
"290","Pinar Puebla","PP",2,"27.2.2020",2,"14:00","Rosmarinus officinalis","apis mellifera","Apis mellifera","Apis","mellifera","Apidae",2020-02-27,57
"291","Pinar Puebla","PP",2,"27.2.2020",2,"14:00","Rosmarinus officinalis","apis mellifera","Apis mellifera","Apis","mellifera","Apidae",2020-02-27,57
"292","Pinar Puebla","PP",2,"27.2.2020",2,"14:00","Rosmarinus officinalis","apis mellifera","Apis mellifera","Apis","mellifera","Apidae",2020-02-27,57
"293","Pinar Puebla","PP",2,"27.2.2020",2,"14:00","Rosmarinus officinalis","laseoglosum","Lasioglossum","Lasioglossum","","Halictidae",2020-02-27,57
"294","Pinar Puebla","PP",2,"27.2.2020",2,"14:00","Cistus salvifolius","apis mellifera","Apis mellifera","Apis","mellifera","Apidae",2020-02-27,57
"295","Pinar Puebla","PP",2,"27.2.2020",2,"14:00","Rosmarinus officinalis","laseoglosum","Lasioglossum","Lasioglossum","","Halictidae",2020-02-27,57
"296","Pinar Puebla","PP",2,"27.2.2020",2,"14:00","Rosmarinus officinalis","apis mellifera","Apis mellifera","Apis","mellifera","Apidae",2020-02-27,57
"297","Pinar Puebla","PP",2,"27.2.2020",2,"14:00","Rosmarinus officinalis","apis mellifera","Apis mellifera","Apis","mellifera","Apidae",2020-02-27,57
"298","Pinar Puebla","PP",2,"27.2.2020",2,"14:00","Rosmarinus officinalis","apis mellifera","Apis mellifera","Apis","mellifera","Apidae",2020-02-27,57
"299","Pinar Puebla","PP",2,"27.2.2020",2,"14:00","Rosmarinus officinalis","apis mellifera","Apis mellifera","Apis","mellifera","Apidae",2020-02-27,57
"300","Pinar Puebla","PP",2,"27.2.2020",2,"14:00","Rosmarinus officinalis","apis mellifera","Apis mellifera","Apis","mellifera","Apidae",2020-02-27,57
"301","Pinar Puebla","PP",2,"27.2.2020",3,"16:50","Rosmarinus officinalis","apis mellifera","Apis mellifera","Apis","mellifera","Apidae",2020-02-27,57
"302","Pinar Puebla","PP",2,"27.2.2020",3,"16:50","Lavandula stoechas","anthofora","Anthophora","Anthophora","","Apidae",2020-02-27,57
"303","Pinar Puebla","PP",2,"27.2.2020",3,"16:50","Rosmarinus officinalis","apis mellifera","Apis mellifera","Apis","mellifera","Apidae",2020-02-27,57
"304","Pinar Puebla","PP",2,"27.2.2020",3,"16:50","Rosmarinus officinalis","apis mellifera","Apis mellifera","Apis","mellifera","Apidae",2020-02-27,57
"305","Pinar Puebla","PP",2,"27.2.2020",3,"16:50","Rosmarinus officinalis","sirfido","Syrphidae 1","Syrphidae","1","Syrphidae",2020-02-27,57
"306","Pinar Puebla","PP",2,"27.2.2020",3,"16:50","Rosmarinus officinalis","apis mellifera","Apis mellifera","Apis","mellifera","Apidae",2020-02-27,57
"307","Pinar Puebla","PP",2,"27.2.2020",3,"16:50","Rosmarinus officinalis","apis mellifera","Apis mellifera","Apis","mellifera","Apidae",2020-02-27,57
"308","Pinar Puebla","PP",2,"27.2.2020",3,"16:50","Rosmarinus officinalis","apis mellifera","Apis mellifera","Apis","mellifera","Apidae",2020-02-27,57
"309","Pinar Puebla","PP",2,"27.2.2020",3,"16:50","Rosmarinus officinalis","apis mellifera","Apis mellifera","Apis","mellifera","Apidae",2020-02-27,57
"310","Pinar Puebla","PP",2,"27.2.2020",3,"16:50","Rosmarinus officinalis","apis mellifera","Apis mellifera","Apis","mellifera","Apidae",2020-02-27,57
"311","Pinar Puebla","PP",2,"27.2.2020",3,"16:50","Rosmarinus officinalis","apis mellifera","Apis mellifera","Apis","mellifera","Apidae",2020-02-27,57
"312","Pinar Puebla","PP",2,"27.2.2020",3,"16:50","Rosmarinus officinalis","apis mellifera","Apis mellifera","Apis","mellifera","Apidae",2020-02-27,57
"313","Pinar Puebla","PP",2,"27.2.2020",3,"16:50","Rosmarinus officinalis","apis mellifera","Apis mellifera","Apis","mellifera","Apidae",2020-02-27,57
"314","Pinar Puebla","PP",2,"27.2.2020",3,"16:50","Rosmarinus officinalis","apis mellifera","Apis mellifera","Apis","mellifera","Apidae",2020-02-27,57
"315","Pinar Puebla","PP",2,"27.2.2020",3,"16:50","Rosmarinus officinalis","apis mellifera","Apis mellifera","Apis","mellifera","Apidae",2020-02-27,57
"316","Pinar Puebla","PP",2,"27.2.2020",3,"16:50","Rosmarinus officinalis","apis mellifera","Apis mellifera","Apis","mellifera","Apidae",2020-02-27,57
"317","Pinar Puebla","PP",2,"27.2.2020",3,"16:50","Rosmarinus officinalis","apis mellifera","Apis mellifera","Apis","mellifera","Apidae",2020-02-27,57
"318","Pinar Hinojos","PH",2,"28.02.20",1,"9:45","Halimium calycinum","mosca","Dilophus  sp","Dilophus"," sp","Bibionidae",2020-02-28,58
"319","Pinar Hinojos","PH",2,"28.02.20",1,"9:45","Halimium calycinum","mosca=PHt1.1","Dilophus  sp","Dilophus"," sp","Bibionidae",2020-02-28,58
"320","Pinar Hinojos","PH",2,"28.02.20",1,"9:45","Halimium calycinum","mosca=PHt1.1","Dilophus  sp","Dilophus"," sp","Bibionidae",2020-02-28,58
"321","Pinar Hinojos","PH",2,"28.02.20",2,"13:00","Halimium calycinum","mosca","Platycheirus  sp","Platycheirus"," sp","Syrphidae",2020-02-28,58
"322","Pinar Hinojos","PH",2,"28.02.20",2,"13:00","Halimium calycinum","episyrphus balteatus","Episyrphus balteatus","Episyrphus","balteatus","Syrphidae",2020-02-28,58
"323","Pinar Hinojos","PH",2,"28.02.20",2,"13:00","Halimium calycinum","mosca gris puntos negros","mosca gris puntos negros","mosca","gris puntos negros","mosca",2020-02-28,58
"324","Pinar Hinojos","PH",2,"28.02.20",2,"13:00","Anemone palmata","coleoptero peludo","Tropinota squalida","Tropinota","squalida","Scarabaeidae",2020-02-28,58
"325","Pinar Hinojos","PH",2,"28.02.20",3,"16:30","Genista hirsuta","apis mellifera","Apis mellifera","Apis","mellifera","Apidae",2020-02-28,58
"326","Pinar Hinojos","PH",2,"28.02.20",3,"16:30","Halimium calycinum","episyrphus balteatus","Episyrphus balteatus","Episyrphus","balteatus","Syrphidae",2020-02-28,58
"327","Villamanrique Chaparral","VC",2,"3.3.2020",1,"10:07","Rosmarinus officinalis","abeja","Myathropa  florea","Myathropa"," florea","Syrphidae",2020-03-03,62
"328","Villamanrique Chaparral","VC",2,"3.3.2020",1,"10:07","Rosmarinus officinalis","apis mellifera","Apis mellifera","Apis","mellifera","Apidae",2020-03-03,62
"329","Villamanrique Chaparral","VC",2,"3.3.2020",1,"10:07","Rosmarinus officinalis","apis mellifera","Apis mellifera","Apis","mellifera","Apidae",2020-03-03,62
"330","Villamanrique Chaparral","VC",2,"3.3.2020",1,"10:07","Rosmarinus officinalis","apis mellifera","Apis mellifera","Apis","mellifera","Apidae",2020-03-03,62
"331","Villamanrique Chaparral","VC",2,"3.3.2020",1,"10:07","Rosmarinus officinalis","apis mellifera","Apis mellifera","Apis","mellifera","Apidae",2020-03-03,62
"332","Villamanrique Chaparral","VC",2,"3.3.2020",1,"10:07","Rosmarinus officinalis","apis mellifera","Apis mellifera","Apis","mellifera","Apidae",2020-03-03,62
"333","Villamanrique Chaparral","VC",2,"3.3.2020",1,"10:07","Rosmarinus officinalis","apis mellifera","Apis mellifera","Apis","mellifera","Apidae",2020-03-03,62
"334","Villamanrique Chaparral","VC",2,"3.3.2020",1,"10:07","Rosmarinus officinalis","apis mellifera","Apis mellifera","Apis","mellifera","Apidae",2020-03-03,62
"335","Villamanrique Chaparral","VC",2,"3.3.2020",2,"12:50","Rosmarinus officinalis","apis mellifera","Apis mellifera","Apis","mellifera","Apidae",2020-03-03,62
"336","Villamanrique Chaparral","VC",2,"3.3.2020",2,"12:50","Rosmarinus officinalis","apis mellifera","Apis mellifera","Apis","mellifera","Apidae",2020-03-03,62
"337","Villamanrique Chaparral","VC",2,"3.3.2020",2,"12:50","Rosmarinus officinalis","Coenonympha pamphilus","Coenonympha pamphilus","Coenonympha","pamphilus","Lepidoptera",2020-03-03,62
"338","Villamanrique Chaparral","VC",2,"3.3.2020",2,"12:50","Asphodelus fistulosus","eucera","Eucera  caspica","Eucera"," caspica","Apidae",2020-03-03,62
"339","Villamanrique Chaparral","VC",2,"3.3.2020",2,"12:50","Asphodelus fistulosus","eucera","Eucera","Eucera","","Apidae",2020-03-03,62
"340","Villamanrique Chaparral","VC",2,"3.3.2020",2,"12:50","Asphodelus fistulosus","eucera","Eucera","Eucera","","Apidae",2020-03-03,62
"341","Villamanrique Chaparral","VC",2,"3.3.2020",2,"12:50","Rosmarinus officinalis","abeja rojoza","Osmia  bicornis","Osmia"," bicornis","Megachilidae",2020-03-03,62
"342","Villamanrique Chaparral","VC",2,"3.3.2020",2,"12:50","Rosmarinus officinalis","apis mellifera","Apis mellifera","Apis","mellifera","Apidae",2020-03-03,62
"343","Villamanrique Chaparral","VC",2,"3.3.2020",2,"12:50","Rosmarinus officinalis","abeja=VCT2.2","Osmia  bicornis","Osmia"," bicornis","Megachilidae",2020-03-03,62
"344","Villamanrique Chaparral","VC",2,"3.3.2020",2,"12:50","Rosmarinus officinalis","abeja=VCT2.2","Osmia  bicornis","Osmia"," bicornis","Megachilidae",2020-03-03,62
"345","Villamanrique Chaparral","VC",2,"3.3.2020",2,"12:50","Rosmarinus officinalis","abeja=VCT2.2","Osmia  bicornis","Osmia"," bicornis","Megachilidae",2020-03-03,62
"346","Villamanrique Chaparral","VC",2,"3.3.2020",2,"12:50","Rosmarinus officinalis","Callophrys rubi","Callophrys rubi","Callophrys","rubi","Lepidoptera",2020-03-03,62
"347","Villamanrique Chaparral","VC",2,"3.3.2020",2,"12:50","Rosmarinus officinalis","apis mellifera","Apis mellifera","Apis","mellifera","Apidae",2020-03-03,62
"348","Villamanrique Chaparral","VC",2,"3.3.2020",2,"12:50","Rosmarinus officinalis","apis mellifera","Apis mellifera","Apis","mellifera","Apidae",2020-03-03,62
"349","Villamanrique Chaparral","VC",2,"3.3.2020",2,"12:50","Rosmarinus officinalis","episyrphus balteatus","Episyrphus balteatus","Episyrphus","balteatus","Syrphidae",2020-03-03,62
"350","Villamanrique Chaparral","VC",2,"3.3.2020",3,"16:10","Rosmarinus officinalis","apis mellifera","Apis mellifera","Apis","mellifera","Apidae",2020-03-03,62
"351","Villamanrique Chaparral","VC",2,"3.3.2020",3,"16:10","Rosmarinus officinalis","apis mellifera","Apis mellifera","Apis","mellifera","Apidae",2020-03-03,62
"352","Villamanrique Chaparral","VC",2,"3.3.2020",3,"16:10","Asphodelus fistulosus","apis mellifera","Apis mellifera","Apis","mellifera","Apidae",2020-03-03,62
"353","Villamanrique Sur","VS",2,"4.3.2020",1,"10:10","Rosmarinus officinalis","apis mellifera","Apis mellifera","Apis","mellifera","Apidae",2020-03-04,63
"354","Villamanrique Sur","VS",2,"4.3.2020",2,"13:30","Rosmarinus officinalis","Callophrys rubi","Callophrys rubi","Callophrys","rubi","Lepidoptera",2020-03-04,63
"355","Villamanrique Sur","VS",2,"4.3.2020",2,"13:30","Rosmarinus officinalis","apis mellifera","Apis mellifera","Apis","mellifera","Apidae",2020-03-04,63
"356","Villamanrique Sur","VS",2,"4.3.2020",2,"13:30","Rosmarinus officinalis","apis mellifera","Apis mellifera","Apis","mellifera","Apidae",2020-03-04,63
"357","Villamanrique Sur","VS",2,"4.3.2020",2,"13:30","Rosmarinus officinalis","abeja","Lasioglossum  albocinctum","Lasioglossum"," albocinctum","Halictidae",2020-03-04,63
"358","Villamanrique Sur","VS",2,"4.3.2020",2,"13:30","Cistus salvifolius","coleoptero peludo","Tropinota squalida","Tropinota","squalida","Scarabaeidae",2020-03-04,63
"359","Villamanrique Sur","VS",2,"4.3.2020",2,"13:30","Rosmarinus officinalis","apis mellifera","Apis mellifera","Apis","mellifera","Apidae",2020-03-04,63
"360","Villamanrique Sur","VS",2,"4.3.2020",2,"13:30","Rosmarinus officinalis","mariposa arlequin (Zerynthia rumina)","Zerynthia rumina","Zerynthia","rumina","Lepidoptera",2020-03-04,63
"361","Villamanrique Sur","VS",2,"4.3.2020",2,"13:30","Rosmarinus officinalis","apis mellifera","Apis mellifera","Apis","mellifera","Apidae",2020-03-04,63
"362","Villamanrique Sur","VS",2,"4.3.2020",2,"13:30","Rosmarinus officinalis","apis mellifera","Apis mellifera","Apis","mellifera","Apidae",2020-03-04,63
"363","Villamanrique Sur","VS",2,"4.3.2020",3,"16:15","Cistus salvifolius","coleoptero peludo","Tropinota squalida","Tropinota","squalida","Scarabaeidae",2020-03-04,63
"364","Villamanrique Sur","VS",2,"4.3.2020",3,"13:30","Cistus salvifolius","eucera","Eucera","Eucera","","Apidae",2020-03-04,63
"365","Villamanrique Sur","VS",2,"4.3.2020",3,"13:30","Rosmarinus officinalis","apis mellifera","Apis mellifera","Apis","mellifera","Apidae",2020-03-04,63
"366","Villamanrique Sur","VS",2,"4.3.2020",3,"13:30","Rosmarinus officinalis","apis mellifera","Apis mellifera","Apis","mellifera","Apidae",2020-03-04,63
"367","Pinar Aznalcazar","PA",2,"10.3.2020",1,"9:50","Rosmarinus officinalis","apis mellifera","Apis mellifera","Apis","mellifera","Apidae",2020-03-10,69
"368","Pinar Aznalcazar","PA",2,"10.3.2020",1,"9:50","Rosmarinus officinalis","apis mellifera","Apis mellifera","Apis","mellifera","Apidae",2020-03-10,69
"369","Pinar Aznalcazar","PA",2,"10.3.2020",1,"9:50","Cistus albidus","apis mellifera","Apis mellifera","Apis","mellifera","Apidae",2020-03-10,69
"370","Pinar Aznalcazar","PA",2,"10.3.2020",1,"9:50","Rosmarinus officinalis","apis mellifera","Apis mellifera","Apis","mellifera","Apidae",2020-03-10,69
"371","Pinar Aznalcazar","PA",2,"10.3.2020",2,"13:10","Rosmarinus officinalis","apis mellifera","Apis mellifera","Apis","mellifera","Apidae",2020-03-10,69
"372","Pinar Aznalcazar","PA",2,"10.3.2020",2,"13:10","Rosmarinus officinalis","apis mellifera","Apis mellifera","Apis","mellifera","Apidae",2020-03-10,69
"373","Pinar Aznalcazar","PA",2,"10.3.2020",2,"13:10","Rosmarinus officinalis","apis mellifera","Apis mellifera","Apis","mellifera","Apidae",2020-03-10,69
"374","Pinar Aznalcazar","PA",2,"10.3.2020",2,"13:10","Rosmarinus officinalis","apis mellifera","Apis mellifera","Apis","mellifera","Apidae",2020-03-10,69
"375","Pinar Aznalcazar","PA",2,"10.3.2020",2,"13:10","Rosmarinus officinalis","mariposa arlequin (Zerynthia rumina)","Zerynthia rumina","Zerynthia","rumina","Lepidoptera",2020-03-10,69
"376","Pinar Aznalcazar","PA",2,"10.3.2020",2,"13:10","Rosmarinus officinalis","apis mellifera","Apis mellifera","Apis","mellifera","Apidae",2020-03-10,69
"377","Pinar Aznalcazar","PA",2,"10.3.2020",2,"13:10","Rosmarinus officinalis","abeja","Osmia  submicans","Osmia"," submicans","Megachilidae",2020-03-10,69
"378","Pinar Aznalcazar","PA",2,"10.3.2020",3,"16:50","Rosmarinus officinalis","xylocopa cantabrita","Xylocopa cantabrita","Xylocopa","cantabrita","Apidae",2020-03-10,69
"379","Pinar Aznalcazar","PA",2,"10.3.2020",3,"16:50","Rosmarinus officinalis","apis mellifera","Apis mellifera","Apis","mellifera","Apidae",2020-03-10,69
"380","Pinar Aznalcazar","PA",2,"10.3.2020",3,"16:50","Rosmarinus officinalis","apis mellifera","Apis mellifera","Apis","mellifera","Apidae",2020-03-10,69
"381","Pinar Aznalcazar","PA",2,"10.3.2020",3,"16:50","Rosmarinus officinalis","apis mellifera","Apis mellifera","Apis","mellifera","Apidae",2020-03-10,69
"382","Pinar Aznalcazar","PA",2,"10.3.2020",3,"16:50","Rosmarinus officinalis","apis mellifera","Apis mellifera","Apis","mellifera","Apidae",2020-03-10,69
"383","Pinar Aznalcazar","PA",2,"10.3.2020",3,"16:50","Rosmarinus officinalis","mosca","Empis  sp","Empis"," sp","Empididae",2020-03-10,69
"384","Pinar Aznalcazar","PA",2,"10.3.2020",3,"16:50","Rosmarinus officinalis","Mosca=PAT3.1","Empis  sp","Empis"," sp","Empididae",2020-03-10,69
"385","Pinar Aznalcazar","PA",2,"10.3.2020",3,"16:50","Rosmarinus officinalis","Mosca=PAT3.2","Empis  sp","Empis"," sp","Empididae",2020-03-10,69
"386","Pinar Aznalcazar","PA",2,"10.3.2020",3,"16:50","Rosmarinus officinalis","Mosca=PAT3.3","Empis  sp","Empis"," sp","Empididae",2020-03-10,69
"387","Pinar Aznalcazar","PA",2,"10.3.2020",3,"16:50","Rosmarinus officinalis","Mosca=PAT3.4","Empis  sp","Empis"," sp","Empididae",2020-03-10,69
"388","Pinar Aznalcazar","PA",2,"10.3.2020",3,"16:50","Rosmarinus officinalis","apis mellifera","Apis mellifera","Apis","mellifera","Apidae",2020-03-10,69
"389","Pinar Aznalcazar","PA",2,"10.3.2020",3,"16:50","Rosmarinus officinalis","apis mellifera","Apis mellifera","Apis","mellifera","Apidae",2020-03-10,69
"390","Pinar Aznalcazar","PA",2,"10.3.2020",3,"16:50","Rosmarinus officinalis","apis mellifera","Apis mellifera","Apis","mellifera","Apidae",2020-03-10,69
"391","Pinar Aznalcazar","PA",2,"10.3.2020",3,"16:50","Rosmarinus officinalis","mosca=PAT3.1","Empis  sp","Empis"," sp","Empididae",2020-03-10,69
"392","Pinar Aznalcazar","PA",2,"10.3.2020",3,"16:50","Rosmarinus officinalis","apis mellifera","Apis mellifera","Apis","mellifera","Apidae",2020-03-10,69
"393","Pinar Puebla","PP",3,"11.3.2020",1,"9:45","Cistus salvifolius","apis mellifera","Apis mellifera","Apis","mellifera","Apidae",2020-03-11,70
"394","Pinar Puebla","PP",3,"11.3.2020",1,"9:45","Cistus salvifolius","apis mellifera","Apis mellifera","Apis","mellifera","Apidae",2020-03-11,70
"395","Pinar Puebla","PP",3,"11.3.2020",1,"9:45","Cistus salvifolius","apis mellifera","Apis mellifera","Apis","mellifera","Apidae",2020-03-11,70
"396","Pinar Puebla","PP",3,"11.3.2020",1,"9:45","Genista hirsuta","xylocopa cantabrita","Xylocopa cantabrita","Xylocopa","cantabrita","Apidae",2020-03-11,70
"397","Pinar Puebla","PP",3,"11.3.2020",1,"9:45","Cistus salvifolius","sirfido grande","Syrphidae 3","Syrphidae","3","Syrphidae",2020-03-11,70
"398","Pinar Puebla","PP",3,"11.3.2020",1,"9:45","Cistus ladanifer","apis mellifera","Apis mellifera","Apis","mellifera","Apidae",2020-03-11,70
"399","Pinar Puebla","PP",3,"11.3.2020",1,"9:45","Cistus ladanifer","apis mellifera","Apis mellifera","Apis","mellifera","Apidae",2020-03-11,70
"400","Pinar Puebla","PP",3,"11.3.2020",1,"9:45","Cistus salvifolius","xylocopa cantabrita","Xylocopa cantabrita","Xylocopa","cantabrita","Apidae",2020-03-11,70
"401","Pinar Puebla","PP",3,"11.3.2020",1,"9:45","Rosmarinus officinalis","episyrphus balteatus","Episyrphus balteatus","Episyrphus","balteatus","Syrphidae",2020-03-11,70
"402","Pinar Puebla","PP",3,"11.3.2020",1,"9:45","Rosmarinus officinalis","xylocopa cantabrita","Xylocopa cantabrita","Xylocopa","cantabrita","Apidae",2020-03-11,70
"403","Pinar Puebla","PP",3,"11.3.2020",1,"9:45","Rosmarinus officinalis","bombilido","Bombylidae 2","Bombylidae","2","Bombylidae",2020-03-11,70
"404","Pinar Puebla","PP",3,"11.3.2020",1,"9:45","Cistus salvifolius","episyrphus balteatus","Episyrphus balteatus","Episyrphus","balteatus","Syrphidae",2020-03-11,70
"405","Pinar Puebla","PP",3,"11.3.2020",1,"9:45","Cistus salvifolius","mosca","Calliphora  sp","Calliphora"," sp","Calliphoridae",2020-03-11,70
"406","Pinar Puebla","PP",3,"11.3.2020",1,"9:45","Cistus salvifolius","apis mellifera","Apis mellifera","Apis","mellifera","Apidae",2020-03-11,70
"407","Pinar Puebla","PP",3,"11.3.2020",1,"9:45","Cistus salvifolius","apis mellifera","Apis mellifera","Apis","mellifera","Apidae",2020-03-11,70
"408","Pinar Puebla","PP",3,"11.3.2020",1,"9:45","Cistus ladanifer","mosca=PPT1.1","Calliphora  sp","Calliphora"," sp","Calliphoridae",2020-03-11,70
"409","Pinar Puebla","PP",3,"11.3.2020",1,"9:45","Cistus ladanifer","apis mellifera","Apis mellifera","Apis","mellifera","Apidae",2020-03-11,70
"410","Pinar Puebla","PP",3,"11.3.2020",1,"9:45","Cistus ladanifer","episyrphus balteatus","Episyrphus balteatus","Episyrphus","balteatus","Syrphidae",2020-03-11,70
"411","Pinar Puebla","PP",3,"11.3.2020",1,"9:45","Cistus salvifolius","eucera","Eucera","Eucera","","Apidae",2020-03-11,70
"412","Pinar Puebla","PP",3,"11.3.2020",2,"13:20","Lavandula stoechas","xylocopa cantabrita","Xylocopa cantabrita","Xylocopa","cantabrita","Apidae",2020-03-11,70
"413","Pinar Puebla","PP",3,"11.3.2020",2,"13:20","Lavandula stoechas","eucera","Eucera","Eucera","","Apidae",2020-03-11,70
"414","Pinar Puebla","PP",3,"11.3.2020",2,"13:20","Lavandula stoechas","xylocopa cantabrita","Xylocopa cantabrita","Xylocopa","cantabrita","Apidae",2020-03-11,70
"415","Pinar Puebla","PP",3,"11.3.2020",2,"13:20","Cistus salvifolius","bombilido","Bombylius  torquatus","Bombylius"," torquatus","Bombylidae",2020-03-11,70
"416","Pinar Puebla","PP",3,"11.3.2020",2,"13:20","Cistus salvifolius","avispa","avispa","avispa","","avispa",2020-03-11,70
"417","Pinar Puebla","PP",3,"11.3.2020",2,"13:20","Cistus salvifolius","apis mellifera","Apis mellifera","Apis","mellifera","Apidae",2020-03-11,70
"418","Pinar Puebla","PP",3,"11.3.2020",2,"13:20","Rosmarinus officinalis","apis mellifera","Apis mellifera","Apis","mellifera","Apidae",2020-03-11,70
"419","Pinar Puebla","PP",3,"11.3.2020",2,"13:20","Rosmarinus officinalis","apis mellifera","Apis mellifera","Apis","mellifera","Apidae",2020-03-11,70
"420","Pinar Puebla","PP",3,"11.3.2020",2,"13:20","Rosmarinus officinalis","apis mellifera","Apis mellifera","Apis","mellifera","Apidae",2020-03-11,70
"421","Pinar Puebla","PP",3,"11.3.2020",2,"13:20","Rosmarinus officinalis","apis mellifera","Apis mellifera","Apis","mellifera","Apidae",2020-03-11,70
"422","Pinar Puebla","PP",3,"11.3.2020",2,"13:20","Rosmarinus officinalis","apis mellifera","Apis mellifera","Apis","mellifera","Apidae",2020-03-11,70
"423","Pinar Puebla","PP",3,"11.3.2020",2,"13:20","Rosmarinus officinalis","laseoglosum","Lasioglossum","Lasioglossum","","Halictidae",2020-03-11,70
"424","Pinar Puebla","PP",3,"11.3.2020",2,"13:20","Cistus ladanifer","xylocopa cantabrita","Xylocopa cantabrita","Xylocopa","cantabrita","Apidae",2020-03-11,70
"425","Pinar Puebla","PP",3,"11.3.2020",2,"13:20","Cistus salvifolius","apis mellifera","Apis mellifera","Apis","mellifera","Apidae",2020-03-11,70
"426","Pinar Puebla","PP",3,"11.3.2020",2,"13:20","Rosmarinus officinalis","apis mellifera","Apis mellifera","Apis","mellifera","Apidae",2020-03-11,70
"427","Pinar Puebla","PP",3,"11.3.2020",2,"13:20","Rosmarinus officinalis","apis mellifera","Apis mellifera","Apis","mellifera","Apidae",2020-03-11,70
"428","Pinar Puebla","PP",3,"11.3.2020",2,"13:20","Rosmarinus officinalis","apis mellifera","Apis mellifera","Apis","mellifera","Apidae",2020-03-11,70
"429","Pinar Puebla","PP",3,"11.3.2020",2,"13:20","Lavandula stoechas","apis mellifera","Apis mellifera","Apis","mellifera","Apidae",2020-03-11,70
"430","Pinar Puebla","PP",3,"11.3.2020",2,"13:20","Lavandula stoechas","Callophrys rubi","Callophrys rubi","Callophrys","rubi","Lepidoptera",2020-03-11,70
"431","Pinar Puebla","PP",3,"11.3.2020",2,"13:20","Lavandula stoechas","episyrphus balteatus","Episyrphus balteatus","Episyrphus","balteatus","Syrphidae",2020-03-11,70
"432","Pinar Puebla","PP",3,"11.3.2020",2,"13:20","Lavandula stoechas","anthofora","Anthophora","Anthophora","","Apidae",2020-03-11,70
"433","Pinar Puebla","PP",3,"11.3.2020",3,"16:35","Lavandula stoechas","xylocopa cantabrita","Xylocopa cantabrita","Xylocopa","cantabrita","Apidae",2020-03-11,70
"434","Pinar Puebla","PP",3,"11.3.2020",3,"16:35","Cistus salvifolius","apis mellifera","Apis mellifera","Apis","mellifera","Apidae",2020-03-11,70
"435","Pinar Puebla","PP",3,"11.3.2020",3,"16:35","Rosmarinus officinalis","apis mellifera","Apis mellifera","Apis","mellifera","Apidae",2020-03-11,70
"436","Pinar Puebla","PP",3,"11.3.2020",3,"16:35","Rosmarinus officinalis","apis mellifera","Apis mellifera","Apis","mellifera","Apidae",2020-03-11,70
"437","Pinar Puebla","PP",3,"11.3.2020",3,"16:35","Rosmarinus officinalis","apis mellifera","Apis mellifera","Apis","mellifera","Apidae",2020-03-11,70
"438","Pinar Puebla","PP",3,"11.3.2020",3,"16:35","Rosmarinus officinalis","apis mellifera","Apis mellifera","Apis","mellifera","Apidae",2020-03-11,70
"440","Pinar Puebla","PP",3,"19.4.2020",2,"12:45","Cistus salvifolius","coleoptero peludo","Tropinota squalida","Tropinota","squalida","Scarabaeidae",2020-04-19,109
"441","Pinar Puebla","PP",3,"19.4.2020",2,"12:45","Cistus salvifolius","coleoptero peludo","Tropinota squalida","Tropinota","squalida","Scarabaeidae",2020-04-19,109
"442","Pinar Puebla","PP",3,"19.4.2020",2,"12:45","Cistus salvifolius","coleoptero peludo","Tropinota squalida","Tropinota","squalida","Scarabaeidae",2020-04-19,109
"443","Pinar Puebla","PP",3,"19.4.2020",2,"12:45","Cistus salvifolius","coleoptero peludo","Tropinota squalida","Tropinota","squalida","Scarabaeidae",2020-04-19,109
"444","Pinar Puebla","PP",3,"19.4.2020",2,"12:45","Cistus salvifolius","coleoptero peludo","Tropinota squalida","Tropinota","squalida","Scarabaeidae",2020-04-19,109
"445","Pinar Puebla","PP",3,"19.4.2020",2,"12:45","Cistus crispus","xylocopa violacea","Xylocopa violacea","Xylocopa","violacea","Apidae",2020-04-19,109
"446","Pinar Puebla","PP",3,"19.4.2020",2,"12:45","Cistus crispus","coleoptero verdoso","Psilothrix viridicoerulea","Psilothrix","viridicoerulea","Melyridae",2020-04-19,109
"447","Pinar Puebla","PP",3,"19.4.2020",2,"12:45","Cistus crispus","abejorro marron","Xylocopa  cantabrita","Xylocopa"," cantabrita","Apidae",2020-04-19,109
"448","Pinar Puebla","PP",3,"19.4.2020",3,"16:15","Leontodon hispidus","episyrphus balteatus","Episyrphus balteatus","Episyrphus","balteatus","Syrphidae",2020-04-19,109
"449","Pinar Puebla","PP",3,"19.4.2020",3,"16:15","Echium plantagineum","apis mellifera","Apis mellifera","Apis","mellifera","Apidae",2020-04-19,109
"450","Pinar Puebla","PP",3,"19.4.2020",3,"16:15","Echium plantagineum","apis mellifera","Apis mellifera","Apis","mellifera","Apidae",2020-04-19,109
"451","Pinar Puebla","PP",3,"19.4.2020",3,"16:15","Echium plantagineum","apis mellifera","Apis mellifera","Apis","mellifera","Apidae",2020-04-19,109
"452","Pinar Puebla","PP",3,"19.4.2020",3,"16:15","Echium plantagineum","episyrphus balteatus","Episyrphus balteatus","Episyrphus","balteatus","Syrphidae",2020-04-19,109
"453","Pinar Puebla","PP",3,"19.4.2020",3,"16:15","Cistus salvifolius","escarabajo peludo","Tropinota squalida","Tropinota","squalida","Scarabaeidae",2020-04-19,109
"454","Pinar Puebla","PP",3,"19.4.2020",3,"16:15","Lavandula stoechas","abejorro marron","Xylocopa  cantabrita","Xylocopa"," cantabrita","Apidae",2020-04-19,109
"455","Pinar Puebla","PP",3,"19.4.2020",3,"16:15","Leontodon hispidus","apis mellifera","Apis mellifera","Apis","mellifera","Apidae",2020-04-19,109
"456","Pinar Hinojos","PH",3,"22.4.2020",1,"10:05","Cistus albidus","coleoptero verdoso","Psilothrix viridicoerulea","Psilothrix","viridicoerulea","Melyridae",2020-04-22,112
"457","Pinar Hinojos","PH",3,"22.4.2020",1,"10:05","Leontodon hispidus","escarabajo rojo y negro","Heliotaurus ruficollis","Heliotaurus","ruficollis","Tenebrionidae",2020-04-22,112
"458","Pinar Hinojos","PH",3,"22.4.2020",1,"10:05","Leontodon hispidus","abeja","Andrena  flavipes","Andrena"," flavipes","Andrenidae",2020-04-22,112
"459","Pinar Hinojos","PH",3,"22.4.2020",2,"12:50","Leontodon hispidus","episyrphus balteatus","Episyrphus balteatus","Episyrphus","balteatus","Syrphidae",2020-04-22,112
"460","Pinar Hinojos","PH",3,"22.4.2020",2,"12:50","Leontodon hispidus","abeja","Andrena  cinerea","Andrena"," cinerea","Andrenidae",2020-04-22,112
"461","Pinar Hinojos","PH",3,"22.4.2020",2,"12:50","Halimium calycinum","coleoptero verdoso","Psilothrix viridicoerulea","Psilothrix","viridicoerulea","Melyridae",2020-04-22,112
"462","Pinar Hinojos","PH",3,"22.4.2020",2,"12:50","Leontodon hispidus","abeja= PHt2.1","Andrena  cinerea","Andrena"," cinerea","Andrenidae",2020-04-22,112
"463","Pinar Hinojos","PH",3,"22.4.2020",2,"12:50","Leontodon hispidus","abeja= PHt1.1","Andrena  flavipes","Andrena"," flavipes","Andrenidae",2020-04-22,112
"464","Pinar Hinojos","PH",3,"22.4.2020",2,"12:50","Leontodon hispidus","laseoglosum","Lasioglossum","Lasioglossum","","Halictidae",2020-04-22,112
"465","Pinar Hinojos","PH",3,"22.4.2020",2,"12:50","Leontodon hispidus","coleoptero verdoso","Psilothrix viridicoerulea","Psilothrix","viridicoerulea","Melyridae",2020-04-22,112
"466","Pinar Hinojos","PH",3,"22.4.2020",2,"12:50","Leontodon hispidus","abeja= PHt2.1","Andrena  cinerea","Andrena"," cinerea","Andrenidae",2020-04-22,112
"467","Pinar Hinojos","PH",3,"22.4.2020",2,"12:50","Leontodon hispidus","abeja= PHt2.1","Andrena  cinerea","Andrena"," cinerea","Andrenidae",2020-04-22,112
"468","Pinar Hinojos","PH",3,"22.4.2020",2,"12:50","Leontodon hispidus","abeja= PHt2.1","Andrena  cinerea","Andrena"," cinerea","Andrenidae",2020-04-22,112
"469","Pinar Hinojos","PH",3,"22.4.2020",3,"16:10","Leontodon hispidus","escarabajo verdoso","Psilothrix viridicoerulea","Psilothrix","viridicoerulea","Melyridae",2020-04-22,112
"470","Pinar Hinojos","PH",3,"22.4.2020",3,"16:10","Leontodon hispidus","abeja= PHt2.1","Andrena  cinerea","Andrena"," cinerea","Andrenidae",2020-04-22,112
"471","Pinar Hinojos","PH",3,"22.4.2020",3,"16:10","Leontodon hispidus","abeja","Eucera  elongatula","Eucera"," elongatula","Apidae",2020-04-22,112
"472","Pinar Hinojos","PH",3,"22.4.2020",3,"16:10","Echium plantagineum","mosca","Platycheirus  sp","Platycheirus"," sp","Syrphidae",2020-04-22,112
"473","Villamanrique Sur","VS",3,"23.4.2020",1,"9:50","Halimium halimifolium","coleoptero verdoso","Psilothrix viridicoerulea","Psilothrix","viridicoerulea","Melyridae",2020-04-23,113
"474","Villamanrique Sur","VS",3,"23.4.2020",1,"9:50","Cistus salvifolius","coleoptero verdoso","Psilothrix viridicoerulea","Psilothrix","viridicoerulea","Melyridae",2020-04-23,113
"475","Villamanrique Sur","VS",3,"23.4.2020",1,"9:50","Anemone palmata","episyrphus balteatus","Episyrphus balteatus","Episyrphus","balteatus","Syrphidae",2020-04-23,113
"476","Villamanrique Sur","VS",3,"23.4.2020",1,"9:50","Cistus salvifolius","episyrphus balteatus","Episyrphus balteatus","Episyrphus","balteatus","Syrphidae",2020-04-23,113
"477","Villamanrique Sur","VS",3,"23.4.2020",1,"9:50","Halimium halimifolium","mariposa blanca entera","Pieris sp","Pieris","sp","Lepidoptera",2020-04-23,113
"478","Villamanrique Sur","VS",3,"23.4.2020",1,"9:50","Cistus salvifolius","mosca","Empis  sp","Empis"," sp","Empididae",2020-04-23,113
"479","Villamanrique Sur","VS",3,"23.4.2020",1,"9:50","Cistus salvifolius","apis mellifera","Apis mellifera","Apis","mellifera","Apidae",2020-04-23,113
"480","Villamanrique Sur","VS",3,"23.4.2020",1,"9:50","Cistus salvifolius","abeja","Andrena Hoplandrena sp","Andrena","Hoplandrena sp","Andrenidae",2020-04-23,113
"481","Villamanrique Sur","VS",3,"23.4.2020",1,"9:50","Cistus salvifolius","coleoptero verdoso","Psilothrix viridicoerulea","Psilothrix","viridicoerulea","Melyridae",2020-04-23,113
"482","Villamanrique Sur","VS",3,"23.4.2020",1,"9:50","Halimium halimifolium","episyrphus balteatus","Episyrphus balteatus","Episyrphus","balteatus","Syrphidae",2020-04-23,113
"483","Villamanrique Sur","VS",3,"23.4.2020",1,"9:50","Cistus salvifolius","coleoptero verdoso","Psilothrix viridicoerulea","Psilothrix","viridicoerulea","Melyridae",2020-04-23,113
"484","Villamanrique Sur","VS",3,"23.4.2020",1,"9:50","Cistus salvifolius","apis mellifera","Apis mellifera","Apis","mellifera","Apidae",2020-04-23,113
"485","Villamanrique Sur","VS",3,"23.4.2020",2,"12:50","Halimium halimifolium","coleoptero verdoso","Psilothrix viridicoerulea","Psilothrix","viridicoerulea","Melyridae",2020-04-23,113
"486","Villamanrique Sur","VS",3,"23.4.2020",2,"12:50","Cistus salvifolius","coleoptero verdoso","Psilothrix viridicoerulea","Psilothrix","viridicoerulea","Melyridae",2020-04-23,113
"487","Villamanrique Sur","VS",3,"23.4.2020",2,"12:50","Cistus salvifolius","episyrphus balteatus","Episyrphus balteatus","Episyrphus","balteatus","Syrphidae",2020-04-23,113
"488","Villamanrique Sur","VS",3,"23.4.2020",2,"12:50","Cistus salvifolius","episyrphus balteatus","Episyrphus balteatus","Episyrphus","balteatus","Syrphidae",2020-04-23,113
"489","Villamanrique Sur","VS",3,"23.4.2020",2,"12:50","Cistus salvifolius","abeja","Dasypoda  iberica","Dasypoda"," iberica","Melittidae",2020-04-23,113
"490","Villamanrique Sur","VS",3,"23.4.2020",2,"12:50","Cistus salvifolius","coleoptero verdoso","Psilothrix viridicoerulea","Psilothrix","viridicoerulea","Melyridae",2020-04-23,113
"491","Villamanrique Sur","VS",3,"23.4.2020",2,"12:50","Cistus salvifolius","apis mellifera","Apis mellifera","Apis","mellifera","Apidae",2020-04-23,113
"492","Villamanrique Sur","VS",3,"23.4.2020",2,"12:50","Cistus salvifolius","apis mellifera","Apis mellifera","Apis","mellifera","Apidae",2020-04-23,113
"493","Villamanrique Sur","VS",3,"23.4.2020",2,"12:50","Cistus salvifolius","abeja= VST2.1","Dasypoda  iberica","Dasypoda"," iberica","Melittidae",2020-04-23,113
"494","Villamanrique Sur","VS",3,"23.4.2020",2,"12:50","Halimium halimifolium","mosca","Usia  sp","Usia"," sp","Bombylidae",2020-04-23,113
"495","Villamanrique Sur","VS",3,"23.4.2020",2,"12:50","Cistus salvifolius","coleoptero verdoso","Psilothrix viridicoerulea","Psilothrix","viridicoerulea","Melyridae",2020-04-23,113
"496","Villamanrique Sur","VS",3,"23.4.2020",2,"12:50","Cistus salvifolius","apis mellifera","Apis mellifera","Apis","mellifera","Apidae",2020-04-23,113
"498","Villamanrique Sur","VS",3,"23.4.2020",3,"16:30","Cistus salvifolius","heliotaurus","Heliotaurus ruficollis","Heliotaurus","ruficollis","Tenebrionidae",2020-04-23,113
"499","Villamanrique Sur","VS",3,"23.4.2020",3,"16:30","Cistus salvifolius","heliotaurus","Heliotaurus ruficollis","Heliotaurus","ruficollis","Tenebrionidae",2020-04-23,113
"500","Villamanrique Sur","VS",3,"23.4.2020",3,"16:30","Cistus salvifolius","episyrphus balteatus","Episyrphus balteatus","Episyrphus","balteatus","Syrphidae",2020-04-23,113
"501","Villamanrique Sur","VS",3,"23.4.2020",3,"16:30","Cistus salvifolius","apis mellifera","Apis mellifera","Apis","mellifera","Apidae",2020-04-23,113
"502","Villamanrique Sur","VS",3,"23.4.2020",3,"16:30","Cistus salvifolius","episyrphus balteatus","Episyrphus balteatus","Episyrphus","balteatus","Syrphidae",2020-04-23,113
"503","Villamanrique Sur","VS",3,"23.4.2020",3,"16:30","Cistus salvifolius","insecto","Empis  tesellata","Empis"," tesellata","Empididae",2020-04-23,113
"504","Villamanrique Chaparral","VC",3,"24.4.2020",1,"10:10","Leontodon hispidus","abeja","Panurgus  calcaratus","Panurgus"," calcaratus","Andrenidae",2020-04-24,114
"505","Villamanrique Chaparral","VC",3,"24.4.2020",1,"10:10","Echium plantagineum","sirfido grande","Syrphidae 3","Syrphidae","3","Syrphidae",2020-04-24,114
"506","Villamanrique Chaparral","VC",3,"24.4.2020",1,"10:10","Leontodon hispidus","apis mellifera","Apis mellifera","Apis","mellifera","Apidae",2020-04-24,114
"507","Villamanrique Chaparral","VC",3,"24.4.2020",1,"10:10","Leontodon hispidus","abeja=VCT1.1","Panurgus  calcaratus","Panurgus"," calcaratus","Andrenidae",2020-04-24,114
"508","Villamanrique Chaparral","VC",3,"24.4.2020",1,"10:10","Leontodon hispidus","abeja=VCT1.1","Panurgus  calcaratus","Panurgus"," calcaratus","Andrenidae",2020-04-24,114
"509","Villamanrique Chaparral","VC",3,"24.4.2020",1,"10:10","Leontodon hispidus","abeja=VCT1.1","Panurgus  calcaratus","Panurgus"," calcaratus","Andrenidae",2020-04-24,114
"510","Villamanrique Chaparral","VC",3,"24.4.2020",1,"10:10","Cistus crispus","apis mellifera","Apis mellifera","Apis","mellifera","Apidae",2020-04-24,114
"511","Villamanrique Chaparral","VC",3,"24.4.2020",1,"10:10","Cistus salvifolius","coleoptero verdoso","Psilothrix viridicoerulea","Psilothrix","viridicoerulea","Melyridae",2020-04-24,114
"512","Villamanrique Chaparral","VC",3,"24.4.2020",1,"10:10","Leontodon hispidus","abeja=VCT1.1","Panurgus  calcaratus","Panurgus"," calcaratus","Andrenidae",2020-04-24,114
"513","Villamanrique Chaparral","VC",3,"24.4.2020",1,"10:10","Cistus crispus","apis mellifera","Apis mellifera","Apis","mellifera","Apidae",2020-04-24,114
"514","Villamanrique Chaparral","VC",3,"24.4.2020",1,"10:10","Cistus crispus","apis mellifera","Apis mellifera","Apis","mellifera","Apidae",2020-04-24,114
"515","Villamanrique Chaparral","VC",3,"24.4.2020",1,"10:10","Cistus crispus","apis mellifera","Apis mellifera","Apis","mellifera","Apidae",2020-04-24,114
"516","Villamanrique Chaparral","VC",3,"24.4.2020",1,"10:10","Cistus crispus","apis mellifera","Apis mellifera","Apis","mellifera","Apidae",2020-04-24,114
"517","Villamanrique Chaparral","VC",3,"24.4.2020",1,"10:10","Leontodon hispidus","abeja=VCT1.1","Panurgus  calcaratus","Panurgus"," calcaratus","Andrenidae",2020-04-24,114
"518","Villamanrique Chaparral","VC",3,"24.4.2020",1,"10:10","Tuberaria guttata","apis mellifera","Apis mellifera","Apis","mellifera","Apidae",2020-04-24,114
"519","Villamanrique Chaparral","VC",3,"24.4.2020",1,"10:10","Cistus crispus","apis mellifera","Apis mellifera","Apis","mellifera","Apidae",2020-04-24,114
"520","Villamanrique Chaparral","VC",3,"24.4.2020",1,"10:10","Cistus crispus","apis mellifera","Apis mellifera","Apis","mellifera","Apidae",2020-04-24,114
"521","Villamanrique Chaparral","VC",3,"24.4.2020",1,"10:10","Cistus salvifolius","coleoptero verdoso","Psilothrix viridicoerulea","Psilothrix","viridicoerulea","Melyridae",2020-04-24,114
"522","Villamanrique Chaparral","VC",3,"24.4.2020",1,"10:10","Cistus salvifolius","coleoptero verdoso","Psilothrix viridicoerulea","Psilothrix","viridicoerulea","Melyridae",2020-04-24,114
"523","Villamanrique Chaparral","VC",3,"24.4.2020",1,"10:10","Cistus salvifolius","coleoptero verdoso","Psilothrix viridicoerulea","Psilothrix","viridicoerulea","Melyridae",2020-04-24,114
"524","Villamanrique Chaparral","VC",3,"24.4.2020",1,"10:10","Cistus salvifolius","coleoptero verdoso","Psilothrix viridicoerulea","Psilothrix","viridicoerulea","Melyridae",2020-04-24,114
"525","Villamanrique Chaparral","VC",3,"24.4.2020",1,"10:10","Cistus salvifolius","coleoptero verdoso","Psilothrix viridicoerulea","Psilothrix","viridicoerulea","Melyridae",2020-04-24,114
"526","Villamanrique Chaparral","VC",3,"24.4.2020",1,"10:10","Cistus salvifolius","coleoptero verdoso","Psilothrix viridicoerulea","Psilothrix","viridicoerulea","Melyridae",2020-04-24,114
"527","Villamanrique Chaparral","VC",3,"24.4.2020",1,"10:10","Leontodon hispidus","abeja=VCT1.1","Panurgus  calcaratus","Panurgus"," calcaratus","Andrenidae",2020-04-24,114
"528","Villamanrique Chaparral","VC",3,"24.4.2020",1,"10:10","Cistus salvifolius","coleoptero verdoso","Psilothrix viridicoerulea","Psilothrix","viridicoerulea","Melyridae",2020-04-24,114
"529","Villamanrique Chaparral","VC",3,"24.4.2020",1,"10:10","Cistus salvifolius","coleoptero verdoso","Psilothrix viridicoerulea","Psilothrix","viridicoerulea","Melyridae",2020-04-24,114
"530","Villamanrique Chaparral","VC",3,"24.4.2020",1,"10:10","Cistus salvifolius","coleoptero verdoso","Psilothrix viridicoerulea","Psilothrix","viridicoerulea","Melyridae",2020-04-24,114
"531","Villamanrique Chaparral","VC",3,"24.4.2020",1,"10:10","Cistus salvifolius","coleoptero verdoso","Psilothrix viridicoerulea","Psilothrix","viridicoerulea","Melyridae",2020-04-24,114
"532","Villamanrique Chaparral","VC",3,"24.4.2020",1,"10:10","Cistus salvifolius","coleoptero verdoso","Psilothrix viridicoerulea","Psilothrix","viridicoerulea","Melyridae",2020-04-24,114
"533","Villamanrique Chaparral","VC",3,"24.4.2020",1,"10:10","Cistus salvifolius","coleoptero verdoso","Psilothrix viridicoerulea","Psilothrix","viridicoerulea","Melyridae",2020-04-24,114
"534","Villamanrique Chaparral","VC",3,"24.4.2020",1,"10:10","Cistus salvifolius","coleoptero verdoso","Psilothrix viridicoerulea","Psilothrix","viridicoerulea","Melyridae",2020-04-24,114
"535","Villamanrique Chaparral","VC",3,"24.4.2020",2,"13:07","Cistus crispus","coleoptero verdoso","Psilothrix viridicoerulea","Psilothrix","viridicoerulea","Melyridae",2020-04-24,114
"536","Villamanrique Chaparral","VC",3,"24.4.2020",2,"13:07","Leontodon hispidus","coleoptero verdoso","Psilothrix viridicoerulea","Psilothrix","viridicoerulea","Melyridae",2020-04-24,114
"537","Villamanrique Chaparral","VC",3,"24.4.2020",2,"13:07","Cistus crispus","abeja=VCT1.1","Panurgus  calcaratus","Panurgus"," calcaratus","Andrenidae",2020-04-24,114
"538","Villamanrique Chaparral","VC",3,"24.4.2020",2,"13:07","Cistus crispus","apis mellifera","Apis mellifera","Apis","mellifera","Apidae",2020-04-24,114
"539","Villamanrique Chaparral","VC",3,"24.4.2020",2,"13:07","Cistus crispus","apis mellifera","Apis mellifera","Apis","mellifera","Apidae",2020-04-24,114
"540","Villamanrique Chaparral","VC",3,"24.4.2020",2,"13:07","Cistus crispus","bombilido","Bombylidae 2","Bombylidae","2","Bombylidae",2020-04-24,114
"541","Villamanrique Chaparral","VC",3,"24.4.2020",2,"13:07","Cistus salvifolius","escarabajo verdoso","Psilothrix viridicoerulea","Psilothrix","viridicoerulea","Melyridae",2020-04-24,114
"542","Villamanrique Chaparral","VC",3,"24.4.2020",2,"13:07","Cistus salvifolius","escarabajo verdoso","Psilothrix viridicoerulea","Psilothrix","viridicoerulea","Melyridae",2020-04-24,114
"543","Villamanrique Chaparral","VC",3,"24.4.2020",2,"13:07","Cistus salvifolius","escarabajo verdoso","Psilothrix viridicoerulea","Psilothrix","viridicoerulea","Melyridae",2020-04-24,114
"544","Villamanrique Chaparral","VC",3,"24.4.2020",2,"13:07","Cistus crispus","escarabajo verdoso","Psilothrix viridicoerulea","Psilothrix","viridicoerulea","Melyridae",2020-04-24,114
"545","Villamanrique Chaparral","VC",3,"24.4.2020",2,"13:07","Cistus salvifolius","escarabajo verdoso","Psilothrix viridicoerulea","Psilothrix","viridicoerulea","Melyridae",2020-04-24,114
"546","Villamanrique Chaparral","VC",3,"24.4.2020",2,"13:07","Leontodon hispidus","bombilido=VCt2.1","Bombylidae","Bombylidae","","Bombylidae",2020-04-24,114
"547","Villamanrique Chaparral","VC",3,"24.4.2020",2,"13:07","Leontodon hispidus","bombilido=VCt2.1","Bombylidae","Bombylidae","","Bombylidae",2020-04-24,114
"548","Villamanrique Chaparral","VC",3,"24.4.2020",2,"13:07","Leontodon hispidus","bombilido=VCt2.1","Bombylidae","Bombylidae","","Bombylidae",2020-04-24,114
"549","Villamanrique Chaparral","VC",3,"24.4.2020",2,"13:07","Echium plantagineum","bombilido=VCt2.1","Bombylidae","Bombylidae","","Bombylidae",2020-04-24,114
"550","Villamanrique Chaparral","VC",3,"24.4.2020",2,"13:07","Leontodon hispidus","bombilido=VCt2.1","Bombylidae","Bombylidae","","Bombylidae",2020-04-24,114
"551","Villamanrique Chaparral","VC",3,"24.4.2020",2,"13:07","Cistus crispus","apis mellifera","Apis mellifera","Apis","mellifera","Apidae",2020-04-24,114
"552","Villamanrique Chaparral","VC",3,"24.4.2020",2,"13:07","Cistus crispus","apis mellifera","Apis mellifera","Apis","mellifera","Apidae",2020-04-24,114
"553","Villamanrique Chaparral","VC",3,"24.4.2020",2,"13:07","Leontodon hispidus","bombilido=VCt2.1","Bombylidae","Bombylidae","","Bombylidae",2020-04-24,114
"554","Villamanrique Chaparral","VC",3,"24.4.2020",2,"13:07","Cistus salvifolius","escarabajo=VCC1","Chasmatopterus  illigeri","Chasmatopterus"," illigeri","Coleoptera",2020-04-24,114
"555","Villamanrique Chaparral","VC",3,"24.4.2020",2,"13:07","Leontodon hispidus","abeja=VCT1.1","Myathropa  florea","Myathropa"," florea","Syrphidae",2020-04-24,114
"556","Villamanrique Chaparral","VC",3,"24.4.2020",2,"13:07","Leontodon hispidus","Cacyreus marshalli","Cacyreus marshalli","Cacyreus","marshalli","Lepidoptera",2020-04-24,114
"557","Villamanrique Chaparral","VC",3,"24.4.2020",2,"13:07","Anthemis arvensis","bombilido=VCt2.1","Bombylidae","Bombylidae","","Bombylidae",2020-04-24,114
"558","Villamanrique Chaparral","VC",3,"24.4.2020",2,"13:07","Anthemis arvensis","abeja=VCT1.1","Myathropa  florea","Myathropa"," florea","Syrphidae",2020-04-24,114
"559","Villamanrique Chaparral","VC",3,"24.4.2020",3,"16:20","Cistus crispus","bombilido=VCt2.1","Bombylidae","Bombylidae","","Bombylidae",2020-04-24,114
"560","Villamanrique Chaparral","VC",3,"24.4.2020",3,"16:20","Cistus crispus","apis mellifera","Apis mellifera","Apis","mellifera","Apidae",2020-04-24,114
"561","Villamanrique Chaparral","VC",3,"24.4.2020",3,"16:20","Cistus crispus","apis mellifera","Apis mellifera","Apis","mellifera","Apidae",2020-04-24,114
"562","Villamanrique Chaparral","VC",3,"24.4.2020",3,"16:20","Echium plantagineum","bombilido","Dischistus biroi","Dischistus","biroi","Bombylidae",2020-04-24,114
"563","Villamanrique Chaparral","VC",3,"24.4.2020",3,"16:20","Echium plantagineum","apis mellifera","Apis mellifera","Apis","mellifera","Apidae",2020-04-24,114
"564","Villamanrique Chaparral","VC",3,"24.4.2020",3,"16:20","Echium plantagineum","bombilido=VCt3.1","Dischistus biroi","Dischistus","biroi","Bombylidae",2020-04-24,114
"565","Villamanrique Chaparral","VC",3,"24.4.2020",3,"16:20","Echium plantagineum","apis mellifera","Apis mellifera","Apis","mellifera","Apidae",2020-04-24,114
"566","Villamanrique Chaparral","VC",3,"24.4.2020",3,"16:20","Echium plantagineum","bombilido=VCt3.1","Dischistus biroi","Dischistus","biroi","Bombylidae",2020-04-24,114
"567","Villamanrique Chaparral","VC",3,"24.4.2020",3,"16:20","Cistus crispus","apis mellifera","Apis mellifera","Apis","mellifera","Apidae",2020-04-24,114
"568","Villamanrique Chaparral","VC",3,"24.4.2020",3,"16:20","Cistus crispus","apis mellifera","Apis mellifera","Apis","mellifera","Apidae",2020-04-24,114
"569","Villamanrique Chaparral","VC",3,"24.4.2020",3,"16:20","Cistus salvifolius","apis mellifera","Apis mellifera","Apis","mellifera","Apidae",2020-04-24,114
"570","Villamanrique Chaparral","VC",3,"24.4.2020",3,"16:20","Cistus salvifolius","bombilido=VCt3.1","Dischistus biroi","Dischistus","biroi","Bombylidae",2020-04-24,114
"571","Villamanrique Chaparral","VC",3,"24.4.2020",3,"16:20","Echium plantagineum","bombilido=VCt2.1","Bombylidae","Bombylidae","","Bombylidae",2020-04-24,114
"572","Villamanrique Chaparral","VC",3,"24.4.2020",3,"16:20","Echium plantagineum","apis mellifera","Apis mellifera","Apis","mellifera","Apidae",2020-04-24,114
"573","Villamanrique Chaparral","VC",3,"24.4.2020",3,"16:20","Cistus crispus","apis mellifera","Apis mellifera","Apis","mellifera","Apidae",2020-04-24,114
"574","Villamanrique Chaparral","VC",3,"24.4.2020",3,"16:20","Cistus crispus","apis mellifera","Apis mellifera","Apis","mellifera","Apidae",2020-04-24,114
"575","Pinar Aznalcazar","PA",3,"28.4.2020",1,"10:30","Cistus albidus","episyrphus balteatus","Episyrphus balteatus","Episyrphus","balteatus","Syrphidae",2020-04-28,118
"576","Pinar Aznalcazar","PA",3,"28.4.2020",1,"10:30","Cistus albidus","coleoptero verdoso","Psilothrix viridicoerulea","Psilothrix","viridicoerulea","Melyridae",2020-04-28,118
"577","Pinar Aznalcazar","PA",3,"28.4.2020",1,"10:30","Cistus albidus","coleoptero verdoso","Psilothrix viridicoerulea","Psilothrix","viridicoerulea","Melyridae",2020-04-28,118
"578","Pinar Aznalcazar","PA",3,"28.4.2020",1,"10:30","Cistus albidus","coleoptero verdoso","Psilothrix viridicoerulea","Psilothrix","viridicoerulea","Melyridae",2020-04-28,118
"579","Pinar Aznalcazar","PA",3,"28.4.2020",1,"10:30","Cistus albidus","coleoptero verdoso","Psilothrix viridicoerulea","Psilothrix","viridicoerulea","Melyridae",2020-04-28,118
"580","Pinar Aznalcazar","PA",3,"28.4.2020",1,"10:30","Cistus albidus","coleoptero verdoso","Psilothrix viridicoerulea","Psilothrix","viridicoerulea","Melyridae",2020-04-28,118
"581","Pinar Aznalcazar","PA",3,"28.4.2020",1,"10:30","Cistus albidus","coleoptero verdoso","Psilothrix viridicoerulea","Psilothrix","viridicoerulea","Melyridae",2020-04-28,118
"582","Pinar Aznalcazar","PA",3,"28.4.2020",2,"12:50","Leontodon hispidus","laseoglosum","Lasioglossum","Lasioglossum","","Halictidae",2020-04-28,118
"583","Pinar Aznalcazar","PA",3,"28.4.2020",2,"12:50","Cistus albidus","coleoptero verdoso","Psilothrix viridicoerulea","Psilothrix","viridicoerulea","Melyridae",2020-04-28,118
"584","Pinar Aznalcazar","PA",3,"28.4.2020",2,"12:50","Cistus albidus","episyrphus balteatus","Episyrphus balteatus","Episyrphus","balteatus","Syrphidae",2020-04-28,118
"585","Pinar Aznalcazar","PA",3,"28.4.2020",2,"12:50","Cistus albidus","coleoptero verdoso","Psilothrix viridicoerulea","Psilothrix","viridicoerulea","Melyridae",2020-04-28,118
"586","Pinar Aznalcazar","PA",3,"28.4.2020",2,"12:50","Cistus albidus","coleoptero verdoso","Psilothrix viridicoerulea","Psilothrix","viridicoerulea","Melyridae",2020-04-28,118
"587","Pinar Aznalcazar","PA",3,"28.4.2020",2,"12:50","Cistus albidus","coleoptero verdoso","Psilothrix viridicoerulea","Psilothrix","viridicoerulea","Melyridae",2020-04-28,118
"588","Pinar Aznalcazar","PA",3,"28.4.2020",2,"12:50","Cistus albidus","coleoptero verdoso","Psilothrix viridicoerulea","Psilothrix","viridicoerulea","Melyridae",2020-04-28,118
"589","Pinar Aznalcazar","PA",3,"28.4.2020",2,"12:50","Cistus albidus","coleoptero verdoso","Psilothrix viridicoerulea","Psilothrix","viridicoerulea","Melyridae",2020-04-28,118
"590","Pinar Aznalcazar","PA",3,"28.4.2020",2,"12:50","Cistus albidus","coleoptero verdoso","Psilothrix viridicoerulea","Psilothrix","viridicoerulea","Melyridae",2020-04-28,118
"591","Pinar Aznalcazar","PA",3,"28.4.2020",2,"12:50","Cistus albidus","coleoptero verdoso","Psilothrix viridicoerulea","Psilothrix","viridicoerulea","Melyridae",2020-04-28,118
"592","Pinar Aznalcazar","PA",3,"28.4.2020",2,"12:50","Cistus salvifolius","coleoptero verdoso","Psilothrix viridicoerulea","Psilothrix","viridicoerulea","Melyridae",2020-04-28,118
"593","Pinar Aznalcazar","PA",3,"28.4.2020",2,"12:50","Cistus salvifolius","coleoptero verdoso","Psilothrix viridicoerulea","Psilothrix","viridicoerulea","Melyridae",2020-04-28,118
"594","Pinar Aznalcazar","PA",3,"28.4.2020",2,"12:50","Cistus salvifolius","coleoptero verdoso","Psilothrix viridicoerulea","Psilothrix","viridicoerulea","Melyridae",2020-04-28,118
"595","Pinar Aznalcazar","PA",3,"28.4.2020",2,"12:50","Cistus salvifolius","coleoptero verdoso","Psilothrix viridicoerulea","Psilothrix","viridicoerulea","Melyridae",2020-04-28,118
"596","Pinar Aznalcazar","PA",3,"28.4.2020",2,"12:50","Cistus albidus","coleoptero verdoso","Psilothrix viridicoerulea","Psilothrix","viridicoerulea","Melyridae",2020-04-28,118
"597","Pinar Aznalcazar","PA",3,"28.4.2020",2,"12:50","Cistus albidus","coleoptero verdoso","Psilothrix viridicoerulea","Psilothrix","viridicoerulea","Melyridae",2020-04-28,118
"598","Pinar Aznalcazar","PA",3,"28.4.2020",2,"12:50","Cistus albidus","coleoptero verdoso","Psilothrix viridicoerulea","Psilothrix","viridicoerulea","Melyridae",2020-04-28,118
"599","Pinar Aznalcazar","PA",3,"28.4.2020",2,"12:50","Cistus albidus","apis mellifera","Apis mellifera","Apis","mellifera","Apidae",2020-04-28,118
"600","Pinar Aznalcazar","PA",3,"28.4.2020",2,"12:50","Galactite tomentosa","apis mellifera","Apis mellifera","Apis","mellifera","Apidae",2020-04-28,118
"601","Pinar Aznalcazar","PA",3,"28.4.2020",2,"12:50","Leontodon hispidus","laseoglosum","Lasioglossum","Lasioglossum","","Halictidae",2020-04-28,118
"602","Pinar Aznalcazar","PA",3,"28.4.2020",2,"12:50","Leontodon hispidus","mosca","Platycheirus  sp","Platycheirus"," sp","Syrphidae",2020-04-28,118
"603","Pinar Aznalcazar","PA",3,"28.4.2020",3,"15:30","Convolvulus arvensis","episyrphus balteatus","Episyrphus balteatus","Episyrphus","balteatus","Syrphidae",2020-04-28,118
"604","Pinar Aznalcazar","PA",3,"28.4.2020",3,"15:30","Cistus albidus","Coenonympha pamphilus","Coenonympha pamphilus","Coenonympha","pamphilus","Lepidoptera",2020-04-28,118
"605","Pinar Aznalcazar","PA",3,"28.4.2020",3,"15:30","Cistus salvifolius","coleoptero verdoso","Psilothrix viridicoerulea","Psilothrix","viridicoerulea","Melyridae",2020-04-28,118
"606","Pinar Aznalcazar","PA",3,"28.4.2020",3,"15:30","Leontodon hispidus","mosca","Parageron  sp","Parageron"," sp","Bombylidae",2020-04-28,118
"607","Pinar Aznalcazar","PA",3,"28.4.2020",3,"15:30","Galactite tomentosa","apis mellifera","Apis mellifera","Apis","mellifera","Apidae",2020-04-28,118
"608","Pinar Aznalcazar","PA",3,"28.4.2020",3,"15:30","Leontodon hispidus","coleoptero verdoso","Psilothrix viridicoerulea","Psilothrix","viridicoerulea","Melyridae",2020-04-28,118
"609","Pinar Aznalcazar","PA",3,"28.4.2020",3,"15:30","Leontodon hispidus","insecto","Empis  tesellata","Empis"," tesellata","Empididae",2020-04-28,118
"610","Pinar Aznalcazar","PA",3,"28.4.2020",3,"15:30","Oxalis per caprae","apis mellifera","Apis mellifera","Apis","mellifera","Apidae",2020-04-28,118
"611","Pinar Aznalcazar","PA",3,"28.4.2020",3,"15:30","Leontodon hispidus","sirfido grande rayas muy marcadas","Episyrphus balteatus","Episyrphus","balteatus","Syrphidae",2020-04-28,118
"612","Pinar Puebla","PP",4,"29.4.2020",1,"10:15","Cistus salvifolius","coleoptero verdoso","Psilothrix viridicoerulea","Psilothrix","viridicoerulea","Melyridae",2020-04-29,119
"613","Pinar Puebla","PP",4,"29.4.2020",1,"10:15","Cistus salvifolius","coleoptero verdoso","Psilothrix viridicoerulea","Psilothrix","viridicoerulea","Melyridae",2020-04-29,119
"614","Pinar Puebla","PP",4,"29.4.2020",1,"10:15","Cistus salvifolius","coleoptero verdoso","Psilothrix viridicoerulea","Psilothrix","viridicoerulea","Melyridae",2020-04-29,119
"615","Pinar Puebla","PP",4,"29.4.2020",1,"10:15","Cistus salvifolius","coleoptero verdoso","Psilothrix viridicoerulea","Psilothrix","viridicoerulea","Melyridae",2020-04-29,119
"616","Pinar Puebla","PP",4,"29.4.2020",1,"10:15","Cistus salvifolius","coleoptero verdoso","Psilothrix viridicoerulea","Psilothrix","viridicoerulea","Melyridae",2020-04-29,119
"617","Pinar Puebla","PP",4,"29.4.2020",2,"12:55","Galactite tomentosa","apis mellifera","Apis mellifera","Apis","mellifera","Apidae",2020-04-29,119
"618","Pinar Puebla","PP",4,"29.4.2020",2,"12:55","Galactite tomentosa","Pieris rapae","Pieris rapae","Pieris","rapae","Lepidoptera",2020-04-29,119
"619","Pinar Puebla","PP",4,"29.4.2020",2,"12:55","Leontodon hispidus","coleoptero peludo","Tropinota squalida","Tropinota","squalida","Scarabaeidae",2020-04-29,119
"620","Pinar Puebla","PP",4,"29.4.2020",2,"12:55","Cistus crispus","abejorro marron","Xylocopa  cantabrita","Xylocopa"," cantabrita","Apidae",2020-04-29,119
"621","Pinar Puebla","PP",4,"29.4.2020",2,"12:55","Leontodon hispidus","apis mellifera","Apis mellifera","Apis","mellifera","Apidae",2020-04-29,119
"622","Pinar Puebla","PP",4,"29.4.2020",3,"16:35","Galactite tomentosa","bombus terrestris","Bombus terrestris","Bombus","terrestris","Apidae",2020-04-29,119
"623","Pinar Hinojos","PH",4,"1.5.2020",1,"10:15","Leontodon hispidus","abeja","Andrena  cinerea","Andrena"," cinerea","Andrenidae",2020-05-01,121
"624","Pinar Hinojos","PH",4,"1.5.2020",1,"10:15","Leontodon hispidus","abeja=PHT1.1","Andrena  cinerea","Andrena"," cinerea","Andrenidae",2020-05-01,121
"625","Pinar Hinojos","PH",4,"1.5.2020",1,"10:15","Leontodon hispidus","episyrphus balteatus","Episyrphus balteatus","Episyrphus","balteatus","Syrphidae",2020-05-01,121
"626","Pinar Hinojos","PH",4,"1.5.2020",1,"10:15","Cistus salvifolius","coleoptero verdoso","Psilothrix viridicoerulea","Psilothrix","viridicoerulea","Melyridae",2020-05-01,121
"627","Pinar Hinojos","PH",4,"1.5.2020",1,"10:15","Cistus salvifolius","coleoptero verdoso","Psilothrix viridicoerulea","Psilothrix","viridicoerulea","Melyridae",2020-05-01,121
"628","Pinar Hinojos","PH",4,"1.5.2020",1,"10:15","Cistus salvifolius","coleoptero verdoso","Psilothrix viridicoerulea","Psilothrix","viridicoerulea","Melyridae",2020-05-01,121
"629","Pinar Hinojos","PH",4,"1.5.2020",1,"10:15","Cistus libanotis","coleoptero verdoso","Psilothrix viridicoerulea","Psilothrix","viridicoerulea","Melyridae",2020-05-01,121
"630","Pinar Hinojos","PH",4,"1.5.2020",1,"10:15","Cistus libanotis","coleoptero verdoso","Psilothrix viridicoerulea","Psilothrix","viridicoerulea","Melyridae",2020-05-01,121
"631","Pinar Hinojos","PH",4,"1.5.2020",1,"10:15","Cistus libanotis","coleoptero verdoso","Psilothrix viridicoerulea","Psilothrix","viridicoerulea","Melyridae",2020-05-01,121
"632","Pinar Hinojos","PH",4,"1.5.2020",1,"10:15","Cistus libanotis","coleoptero verdoso","Psilothrix viridicoerulea","Psilothrix","viridicoerulea","Melyridae",2020-05-01,121
